ID,Tweet,Time,User,Likes,Replies,Retweets,in_response_to,response_type
612552313992015872,Oil paintings of women submerged in water are a ripple of colours http://bit.ly/1QGnN4V pic.twitter.com/wTw8kkm2Al,1434878826,creativeboommag,9,0,7,0,tweet
612531068294434816,ILO condemnation of Qatar likely to have ripple effects - http://www.dailynewsegypt.com/2015/06/21/ilo-condemnation-of-qatar-likely-to-have-ripple-effects/ pic.twitter.com/Ledv3LJ21Q,1434873761,DailyNewsEgypt,2,0,4,0,tweet
612521615918764032,Raspberry ripple cake + lots more @totnesgoodfood 2day! @Torbay_Hour @TotnesFoodie @EatOutDevon @DevonFoodHourpic.twitter.com/qgmz9Gnbp6,1434871507,karenscakesuk,4,1,4,0,tweet
612498207856291840,The Ripple Effect - Alex Prudhomme | http://buff.ly/1BrUDiO  | Politics & Current Events #ebook #Politics #Current #Epic.twitter.com/x3bLb2vbQy,1434865927,loriedden,2,0,21,0,tweet
612480068716220416,Acts of kindness radiate out in a ripple that touches countless lives! It's a beautiful thing! | LIAM 82 | Listen: http://itun.es/i6LD4MV ,1434861602,BruceVH,9,0,11,0,tweet
612477549805969408,"If a bunch of short people did the wave, would it be called a ripple?",1434861001,HiveBestHumor,2,0,2,0,tweet
612474676347019264,"Share Lived experience. Tx S.Beaton,  RT @PhilippeRoy3: @iasp2015 Ripple Effect: reducing #suicide #stigma http://flip.it/aPIU8  @akenne31",1434860316,ingioz,1,0,0,0,tweet
612472910930808833,"Me: Who wants to play the ripple game?
@jacidaswhoibe: Huh? ...ohhhhh. I thought you said nipple game.",1434859895,lexx_jaylene,1,0,0,0,tweet
612471511883087872,#Bitcoin#Litecoin or #ripple or #Dogecoin diversify to #Marinecoin #MTC today for %1000 profits Tabetha Batara,1434859562,MTC_Marinecoin,0,0,0,0,tweet
612470407459770368,in the best place in my Life right now..it's amazing to witness the ripple effect of your internal changes reflect on the external,1434859298,universouluv,1,0,0,0,tweet
612453632315949056,Ripple Labs Member Elected to Federal Reserve Team https://www.cryptocoinsnews.com/ripple-labs-member-elected-to-federal-reserve-team/ pic.twitter.com/zp1o5ooKtx,1434855299,CryptoCoinsNews,1,0,9,0,tweet
612453039052488704,"Gee all I'm seeing is ""Ashton with *insert @ name* he only took photos with like 5 ripple in NZ :(",1434855157,amy_eats_toast,1,2,1,0,tweet
612446628641812480,@JeffTolcher I said that yesterday and ripple were all over me. The truth hurts sometimes!,1434853629,MGardnerSports,0,0,0,612445823335571460,reply
612440249474482176,What's Your Ripple Effect? http://mattandaprilfindley.com/whats-your-ripple-effect/?utm_source=ReviveOldPost&utm_medium=social&utm_campaign=ReviveOldPost ,1434852108,findmattley,0,0,0,0,tweet
612435149251342336,The one night I come back to Muncie and all my friends are in Broad ripple. What a tragedy.,1434850892,SavedBy_zieBell,5,2,0,0,tweet
612431915350503424,#crochet Crochet Ripple Stitch - http://crochetcentral.net/crochet-ripple-stitch/ pic.twitter.com/OuLqlYDYDh,1434850121,CrochetCentral,4,0,1,0,tweet
612430648746356736,I see people are startin to feel the $GRID! Follow the AltGod $BTC $LTC $SDC $START $VTC $BLK $DOGE $MONA $DASH $URO $VIRAL $XRP $BTCD $TRON,1434849819,AltCryptoGod,0,0,7,0,tweet
612429732701949952,"Men: there is a legit ""made in Scotland"" kilt in the ladies skirts for $25 at broad ripple vintage. Now go buy it and be hot.",1434849601,JoanofDarkKnits,7,0,0,0,tweet
612424746072813568,#Handmade White & Multi-Coloured Striped #Ripple Stitch #Crochet #Baby #Blanket http://etsy.me/1HaRmq1  #madetoorder,1434848412,2BabyWithLove,1,0,3,0,tweet
612424720043130880,10 Most Mentioned - last 6 hours: $NMC 30 $PPC 15 $DOGE 8 $NET 6 $XPM 5 $SYNC 4 $XRP 4 $COOL 3 $SLG 3 $BLU 3 #altcoin #btc #fintech,1434848406,crypto_chatter,2,0,6,0,tweet
612422553735270400,"FLASH SALE! Butter Ripple Schnapps Cupcakes with a Ginger Ale Frosting. First come, first serve for $30 #YQR #YQRFoodpic.twitter.com/Tfy7Iuia5G",1434847889,CheesecakeryYQR,1,1,0,0,tweet
612420159647678464,1 month later... @ Union Jack Pub-Broad Ripple https://instagram.com/p/4K-TzfNKWV/ ,1434847318,laststarkstndng,2,0,0,0,tweet
612417708399857664,Previous Plunder! Review: Tantus Ripple (Small) http://wp.me/p64opd-1j ,1434846734,PeriPlunders,1,0,0,0,tweet
612413349465227264,"the key diff b/w bitcoin, stellar, hyperledger & ripple is people.  ripple has people sitting on the team who have experience in banking.",1434845695,shin_novation,1,0,0,0,tweet
612411815209902080,"Now that is a Ripple!  

More than 80 churches and counting have pledged to participate in #ChimeWithCharleston... http://fb.me/1EocjY2Aa ",1434845329,Ripple_EffectSC,5,1,3,0,tweet
612411793860882432,Lol. Kann nicht schlafen,1434845324,caaluum_xrp,1,0,0,0,tweet
612411720947134464,@Jaimylifexd du hast nen mund keine fresse.,1434845306,caaluum_xrp,1,1,0,612404433062858752,reply
612411699610587136,9:05   【Ripple Chart】【リアルタイム】現在ののリップルのレート(相場) https://www.digital-gate.jp/?ssid=940 ,1434845301,INVESTMENT_biz,0,0,0,0,tweet
612411582916771840,"< shades of  > #ootn  liketoknow.it http://www.liketk.it/1vcg6  #liketkit @ Broad Ripple, Indiana https://instagram.com/p/4K6aK5q-jP/ ",1434845274,seersuckersaddl,1,0,0,0,tweet
612411552294154240,@caaluum_xrp Calum.. o ich halte jetzt einfach meine fresse..,1434845266,Jaimylifexd,0,1,0,612404433062858752,reply
612411438825508864,お兄ちゃん、リップルとっても嬉しいよ。うふっ。,1434845239,bot_ripple,0,0,0,0,tweet
612411392809959426,@Jaimylifexd habe ich nie gesagt lol.,1434845228,caaluum_xrp,1,1,0,612404433062858752,reply
612411324086284288,"@caaluum_xrp nein, du liebst mich..",1434845212,Jaimylifexd,1,1,0,612404433062858752,reply
612410875329277952,"@lewiswhitehead_ I'll be the first to unfollow, cause a ripple effect",1434845105,Laurnmarshall5,0,1,0,612409176103473152,reply
612410719984816128,@caaluum_xrp zu spät... Und nein ich kann nicht verkackt haben...,1434845068,Jaimylifexd,0,1,0,612404433062858752,reply
612409814786920452,Take a look at RIPPLE Africas mission #SmallCharityWeek @SCWeek2015 http://ow.ly/Nv0F7 ,1434844852,RIPPLEAfrica,0,0,0,0,tweet
612409803546099712,アルトス「トーマスさんがガガーブの向こうのエル・フィルディンという国の色んなレシピを持ってきてくれました！何かに応用できないかなぁ」,1434844849,ripple_ring_bot,0,0,0,0,tweet
612409618610917376,10 Most Mentioned - last 6 hours: $NMC 48 $PPC 13 $SYNC 4 $XPM 4 $XPY 4 $XRP 4 $SWIFT 3 $SLG 3 $DOGE 3 $BLU 3 #altcoin #btc #fintech,1434844805,crypto_chatter,0,0,3,0,tweet
605833312125353985,This is one of those fronts that could have ripple effect if done properly. Closest ISIS opponents could get to the group's real heartlands.,1433276892,hxhassan,3,3,7,605832939587305474,reply
605881703249252352,.@RippleLabs C++ Engineer Scott Schurr won most engaging session at 2015 C++Now! View Slides: http://bit.ly/1AMdHIn pic.twitter.com/peVOZqGbsQ,1433288429,Ripple,5,1,12,0,tweet
605876567907008514,"""Ripple is a ledger like those of the past, it is not set in stone, it can be altered."" -@Dr_Craig_Wright http://www.afr.com/brand/chanticleer/cbas-crypto-currency-move-the-tip-of-the-iceberg-20150602-ghee7i?stb=twt ",1433287205,jonmatonis,11,0,9,0,tweet
605867485963763713,Check out video in article @TonyBoydAFR  explaining differences between #Ripple &  #Bitcoin. Thnx @Oakeslaw #fintech https://twitter.com/Oakeslaw/status/605862329419317250  <quoted_status>@TonyBoydAFR of Australian Financial Review writes an interesting piece on @commbank trialling @ripplelabs.  @Financ https://lnkd.in/eEjWfeA </quoted_status>,1433285039,FinTechIreland,6,0,5,605862329419317250,quoted_retweet
605856488620367873,"#Saakashvili’s appointment as governor of #Odessa will send ripple effects through the region, writes @TomdeWaalCEIP: http://ceip.org/1ESj3gp ",1433282417,CarnegieEndow,2,0,5,0,tweet
605851481418235907,'I'm hoping this will have a ripple effect.' @NewWestPD responds to RCH redevelopment http://tinyurl.com/q428nkb pic.twitter.com/SChH0sHvDX,1433281224,TheRecord,3,0,5,0,tweet
605850717639737345,".@RippleLabs Chief Compliance Officer, tweeting from the #SMEfinance event in Izmir, Turkey: https://twitter.com/karengifford/status/605268502577082368  <quoted_status>.@copernicc at GPFI Izmir: distibuted ledgers have many advantages for reducing friction, cost, improving speed of payments #SMEfinance</quoted_status>",1433281041,Ripple,2,0,8,605268502577082368,quoted_retweet
605838111860387840,"Funny they keep sayin they wanna tax the 1% when they tax a homeless guy $4 for a bottle of Ripple&cigs @Instapundit https://twitter.com/ANYAGV2/status/605824471623081987  <quoted_status>It's kind of funny when they keep saying ""we don't want your guns"" when they mean ""we want everyone's guns."" :) @BlackIrishI @AmberGirl3</quoted_status>",1433278036,Clearsightd,3,0,3,605761842187673600,quoted_retweet
605831239904292865,"Just a little kindness spreads like a ripple across the city, across your life. http://winnipegwednesday.ca/kindness  https://twitter.com/TheWpgChamber/status/605826434074972160  <quoted_status>June 3rd is the first of four Winnipeg Wednesdays from @UnitedWayWpg. Pledge to be (extra) kind to someone tomorrow #wpgwed</quoted_status>",1433276398,UnitedWayWpg,3,0,3,605826434074972160,quoted_retweet
605828313827803136,Altcoin market cap has surpassed half a billion USD  http://coincap.io/#/  #litecoin #ripple #dash #dogecoin #NXT #counterparty #bitcoin,1433275700,ErikVoorhees,5,1,12,0,tweet
605819042838933505,"COLUMN | Ripple effects of early childhood development support go beyond the classroom, writes @NomalangaSA Mkhize http://ow.ly/NKxHa ",1433273490,BDliveSA,8,0,4,0,tweet
605813642164985856,Be a generous giver! The ripple effect of generosity is fun to watch! #GiveMorepic.twitter.com/bqt3K8ISN1,1433272202,BruceVH,8,1,17,0,tweet
605809305841864704,"Super stoked to play @TheVogue tmrow w/ @Within__Reason & @Buckcherry. Doing tix drops today DT Indy, Ripple, and Castleton. PM if in need.",1433271168,LindsayManfredi,3,0,2,0,tweet
605769488298995713,Remember kids all waves start as just a ripple,1433261675,AdamGoesHam,14,1,3,0,tweet
605769427770970113,"#bitcoin : Have you heard that the Ripple fine may/may not  be the tip of an iceberg? Stay ahead of it for your biz: https://twitter.com/ChamberDigital/status/604285539571773440  <quoted_status>We are holding a BRIEFING next Thurs 6/4 ""What the Ripple Action Means for Digital Currency Businesses"" RSVP: https://www.eventbrite.com/e/industry-briefing-what-the-ripple-action-means-for-digital-currency-businesses-registration-17143988130 </quoted_status>",1433261660,BitCoinSusan,3,0,7,604285539571773440,quoted_retweet
605737020284104704,"USING THE POWER OF HAMON, JOSEPH CAUSES THE SPUNK IN THE SOCK TO RIPPLE, CHARGING A DEVASTATING ATTACK!",1433253934,NightmareModeGo,3,2,3,0,tweet
605713061144444928,Doctor Doom is coming!  Joint project between Ripple and STB.  Brilliant psychedelic doom headed your way on CD... http://fb.me/tuAzLCTO ,1433248222,RippleMusic,6,0,2,0,tweet
605698990001254400,"Woke up with the question ""What kind of ripple do I want to cause today?"" #RippleEffect #BeIntentional #BePositive @TheSummitOR",1433244867,amylof,11,0,4,0,tweet
605694104190746624,Caitlyn Jenner's big announcement barely makes a ripple in Singapore. http://yhoo.it/1ERFSkl pic.twitter.com/dylfnZBkuy,1433243702,YahooSG,6,0,6,0,tweet
605669818105253888,"Stigma has a ripple affect that affects the people around you, particularly family, who can be blamed- Heather #rightsforlife",1433237912,seemescotland,2,0,5,0,tweet
605668220054446080,Realising that if I were a homophobe there are some amazing people in my life that wouldn't be there. Including their ripple effects.,1433237531,SihleNtsaluba,0,0,3,0,tweet
605656465156796416,Want to start a ripple of change? Watch the new Action Oldham Fund video https://youtu.be/-IpF6_1RhBc  @actionoldham,1433234728,OldhamCouncil,2,0,3,0,tweet
605655375220764673,"""Have to believe your own thing and to know all the facts"" @OttoLiuhtonen @woneio #startup #venturecapital #tekes #ripple @info_eastwing",1433234468,VMRuottinen,5,0,1,0,tweet
605627441600708608,"CBA signs deal with Ripple for Blockchain settlements, may eventually support Bitcoin http://ow.ly/2Zjvy8 ",1433227808,FutureOfTalents,1,0,0,0,tweet
605618007939751936,An interesting piece on @CommBank testing Ripple and #cryptocurrency as the tip of the iceberg by @TonyBoydAFR http://www.afr.com/brand/chanticleer/cbas-crypto-currency-move-the-tip-of-the-iceberg-20150602-ghee7i ,1433225559,GetCoinJar,4,0,5,0,tweet
605607449253543936,"COLUMN | Ripple effects of early childhood development support go beyond the classroom, writes @NomalangaSA Mkhize http://ow.ly/NKxrj ",1433223042,BDliveSA,6,0,3,0,tweet
605601572316274688,Nickels for Nepal http://wp.me/p61SQ8-p  via @beverly_ladd - Great blog post on how a tiny ripple can create a wave. #INZPirED,1433221641,KSThakral,2,0,2,0,tweet
605601455165345792,"""My toes numb at the thought. Change always brings a ripple of problems with it."" -Ruby #quote #novel #magic",1433221613,mebeddingfield,1,0,1,0,tweet
605590696670699520,"It's crazy how anything that happens in your life has this huge ripple effect. That not only changes your future, but everyone you meet",1433219048,Courtney_Poll,8,1,2,0,tweet
605582192819847168,Your acts of kindness have a ripple effect. Lynda Kaplan #gratitude #kindness #wuvip #love #joytrainpic.twitter.com/Xe6gYh5Kr6,1433217020,_LovingYrself,6,0,4,0,tweet
605568969328717824,Discussed ripple effects of ROH going on national cable in my @PWInsidercom audio today.  First one confirmed.,1433213867,MikePWInsider,3,2,1,0,tweet
605563028315074560,Interact with @Ripple from the command line with the new ripple-cli module https://github.com/ripple/ripple-cli  #ripple #crypto #nodejs #decentralized,1433212451,CryptoFact,1,0,1,0,tweet
605561555900440576,@sjfm @SUPERRANL @tostay98 @NLYFF @roaryj @BacalaoCuisine @ChinchedBistro @VOCMNightline pic.twitter.com/wQ3Y8neW3k cabbage planting Ripple Farm,1433212100,goldieporter57,2,0,3,0,tweet
605550414885449728,What the Fox Learnt - Ripple Digital Publishing | http://buff.ly/1JefDL7  | Children's Fiction #free #ebook #freebookpic.twitter.com/c9KrKB0Evx,1433209444,janinebucks,3,0,40,0,tweet
605547016035311616,#proudlyGEI A5: Profound & exponential. Becomes difficult to measure ripple effect of helping our students’ children ... their children ...,1433208633,BrentJFreeman,3,0,0,0,tweet
605546453256110081,Understand #bitcoin + @CommBank's new #Ripple #cryptocurrency? It's possible with @JessicaSier's explainer! http://www.afr.com/videos/technology/explainer-ripple-vs-bitcoin-pizxrmdtqejfdg5o9p6fvkihme0ob6rs.html  #ausbiz,1433208499,KyBusiness,1,0,2,0,tweet
605535962593001472,Explainer: #Ripple vs #Bitcoin and how the #blockchain stitches it all together. http://www.afr.com/videos/technology/explainer-ripple-vs-bitcoin-pizxrmdtqejfdg5o9p6fvkihme0ob6rs#ooid=piZXRmdTqejFdG5o9P6FVkihME0ob6rS ,1433205998,jessicasier,8,1,5,0,tweet
605532223731695616,"Yes! That IS The Ripple Effect! Take an ACTION that begins as a DROPLET & becomes an unstoppable WAVE for GOOD!!  https://twitter.com/lionel_satouf/status/605360057316978689  <quoted_status>You may never know what results come of your actions, but if you do nothing, there will be no results. - Gandhi #quote</quoted_status>",1433205107,FanYourFlame,12,0,5,605360057316978689,quoted_retweet
605528415186255872,WATCH | Major reconstruction work on Main Street is having a ripple effect on the commute #ottnews #cbcott http://cbc.sh/Wf4uBtN ,1433204199,CBCOttawa,3,0,1,0,tweet
605528405405081600,今日　自分を正当化する夢を見ました【ripple】,1433204196,takabee_bot,0,0,0,0,tweet
605528394118365184,Ripple Appoints DTCC’s Former CEO as Advisor... http://goo.gl/iqfjhu  h ...pic.twitter.com/zidw6GkiOI,1433204193,BitcoinAndSo,0,0,0,0,tweet
605528360396013568,@846n だね(笑)知ってたけどねwww,1433204185,ripple_lianyi,0,1,0,605522104381902849,reply
605528212068696064,when is ripple effect 2 it's been like half a year,1433204150,softresets,0,0,0,0,tweet
605527971441418240,"ファイナンスを身近に
Rippleがあれば誰でも世界経済へ
参加できるようになります。 https://ripple.com/  https://www.digital-gate.jp/?ssid=985 ",1433204093,INVESTMENT_biz,0,0,0,0,tweet
605527969889693696,"@jannarden I recco ""Ripple"" as a starting point. :)",1433204092,ioverherder,0,0,0,605517318257438720,reply
605527964009136128,@VampireHacker «« shoulder blade and feeling muscles ripple.]|,1433204091,StartWithF,0,1,0,605483639485259776,reply
605527858107121664,@oosorarirero ですよね！ すべての人の創作を読みたいくらいの気持ちで一杯です(笑),1433204066,ripple_lianyi,0,0,0,605522618834231296,reply
605527643836981248,Ripple Club rename to RippleTalk，Welcome you join in.Invite link is https://telegram.me/joinchat/05262df900afefc481a37713abdabb23  . Need you have telegram ID.,1433204015,lieefu,1,0,1,0,tweet
605527587285180416,9:10   【Ripple Chart】【リアルタイム】現在ののリップルのレート(相場) https://www.digital-gate.jp/?ssid=940 ,1433204001,INVESTMENT_biz,0,0,0,0,tweet
605526937398833153,El Commonwealth Bank of Australia (CBA) realiza experimentos con la tecnología de Ripple Labs http://www.diariobitcoin.com/index.php/2015/05/29/el-commonwealth-bank-of-australia-cba-realiza-experimentos-con-la-tecnologia-de-ripple-labs/ ,1433203846,Shadowargel,0,0,0,0,tweet
605526481016471552,"@ripple_lianyi http://wonmaga.jp 

こうか",1433203737,846n,0,1,0,605522104381902849,reply
605525991092424705,ふん、早速か。よし、暗号文を全部隊に打電っ！「たかおやまくだれ 17:40」！,1433203621,bot_ripple,0,0,0,0,tweet
605525639106461696,"@CosimaReilly ありがとうございます素敵！(*´∇｀*)ブクマしました！
こぬ太君は悠太君だったんですね。",1433203537,ripple_lianyi,0,0,0,605522104381902849,reply
605524775105101824,Check out my Ripple Bolas!,1433203331,josephjoestar_e,0,0,0,0,tweet
605524745472204800,母「パンを作るのも楽じゃないわ。でも、皆さんが美味しそうに食べるのを見ているとふふ、作りがいがあるというものですね」,1433203324,ripple_ring_bot,0,0,0,0,tweet
613560111240318976,@OliviaSchmidt55 split ripple ideas  https://twitter.com/videosofscience/status/613065179601895425 ,1435119104,ROBbinBAYnks,2,1,1,0,tweet
613821815161528320,"The housing crash slammed black homeowners disproportionately, and the ripple effects could last generations http://read.bi/1dgRiaR ",1435181499,businessinsider,8,1,9,0,tweet
613529431194234880,I LOVE THIS RIPPLE SO MUCH pic.twitter.com/KIYN2A54ZO,1435111789,bbypatty,8,1,0,0,tweet
613829237506732032,"ING Experimenting with an “XRP-Less Ripple clone""? https://xrptalk.org/topic/6788-ing-experimenting-with-an-%E2%80%9Cxrp-less-ripple-clone/  #Ripple #XRPless",1435183269,XRPtalk,4,0,4,0,tweet
613803519217238016,"We're loving the ShapeShift integration at http://www.DaDice.com ! Deposit/withdraw Litecoin, Ripple, NXT, Dash, Dogecoin, Storj @DaDice1",1435177137,ShapeShift_io,1,0,9,0,tweet
613787774517297152,Little red Ryders in the Ripple forest. #tantusgrabbagpic.twitter.com/uZqxQSyNOQ,1435173383,Tantus_Pirate,11,3,1,0,tweet
613779046858625024,".@Ripple Discontinues Smart Contract Platform Codius, Citing Small Market by @JeffreyMaxim_ http://btcm.ag/codius ",1435171302,BitcoinMagazine,1,0,20,0,tweet
613776376366170113,Ripple Maker Employs 3D Printing Technology To Extrude Beautiful Images in Your Coffee Foam http://3dprint.com/76087/ripple-maker-3d-print-coffee/ pic.twitter.com/NMgj2Bxt2o,1435170666,3DPrintingIt,5,0,5,0,tweet
613770038688919552,Do you ever just like hit your thigh and watch the fat ripple all the way down your leg?,1435169155,Stephani_Katris,13,0,2,0,tweet
613742627855339520,.@RippleLabs EVP of Business Development Patrick Griffin speaking at the #SAPFSForum on the Internet of Value.pic.twitter.com/6ubw5lkoo1,1435162619,Ripple,3,0,4,0,tweet
613737231748980736,"Ask questions with a child-like lens. Focus on questions, not answers. Cause a ripple effect. @ausd_vannasdall #keynote #arcadiainnovation",1435161333,cindyyuribak,4,0,2,0,tweet
613723308069113856,Marshall Segal reflects on the divine ripple effects of fallen Christian leaders. http://dsr.gd/1Ie0dqy ,1435158013,JohnPiper,34,1,17,0,tweet
613711433386213377,"Monta Ellis has until midnight to tell the #Mavs of his opt-out/in status. Either way, it'll be a huge ripple effect.",1435155182,DwainPrice,6,1,8,0,tweet
613709809418768385,"behave has you want to be remembers 

and think about ripple in mind

do worry about the ripple you make 

#smaccUS @LWestafer @cliffreid",1435154795,_Matt_Simpson,3,0,4,0,tweet
613696899154116609,"2 part blog series on how Ripple can benefit banks and other financial institutions:
 https://ripple.com/blog/the-true-cost-of-moving-money/  https://ripple.com/blog/for-banks-its-time-to-upgrade-from-the-telegraph/ ",1435151717,RippleLabs,3,0,3,0,tweet
613689454629400576,"Hollyoaks spoilers: Ben's secret will have a massive ripple effect, Ben Richards reveals http://go.dspy.me/sCqw  #soapnews",1435149942,soapscoop,3,0,3,0,tweet
613678328663404545,#bitcongres15 Fidor have their Ripple gateway up and running and can originate transactions,1435147289,dgwbirch,7,0,8,0,tweet
613641984113266689,".@Ripple ""What is the Internet of Value? Matching payment buyers and sellers."" #SAPFSForumpic.twitter.com/MNjM5NEZ7g",1435138624,albullington,13,3,14,0,tweet
613637386677952512,".@Ripple ""It's faster to send money overseas through a FedEx envelope than int'l wire."" #SAPFSForumpic.twitter.com/oHHUsoUAaH",1435137528,albullington,13,0,20,0,tweet
613612215946637312,"Sleek pod of dolphins
trace flaming arc of sunset;
barely a ripple
#haiku #micropoetry #sea",1435131527,pauljudges,17,6,11,0,tweet
613601203763740672,@DG_Yagami this is gonna make a ripple. That will show you who cares about you.,1435128901,YouSpoonyBard1,2,0,0,613600387497619457,reply
613595112677883904,I strongly believe in the ripple effect. Most of your decisions are going to alter yours or the worlds or someone else's future.,1435127449,ErinWhitehurst,3,1,0,0,tweet
613589976119439360,"There's no such thing as a small act of kindness, every act creates a ripple  pic.twitter.com/yZLt8xVd0Y",1435126224,RachaelT_82,7,0,3,0,tweet
613589037547327488,"That's a Tsunami @Arunapk57 created, with a ripple in her mind. Awesome.!!  https://twitter.com/arunapk57/status/613562968257642496  <quoted_status>आज सुबह सुबह लिखा मैंने  @kokeesachdeva  I remember and than you whenever I write. pic.twitter.com/X6ZVSLWVdP</quoted_status>",1435126001,kokeesachdeva,2,0,0,613562968257642496,quoted_retweet
613579833780535297,Bright Green Turquoise Ripple Abstract Minx® Nail Wraps http://wp.me/p37smd-1aQ ,1435123806,BrightVibes,0,0,5,0,tweet
613561051209166848,"I float to the surface of sleep and my dreams swim away, leaving faint images that ripple into fainter images and fade.",1435119328,IMcMillan,22,3,6,0,tweet
613560111240318976,@OliviaSchmidt55 split ripple ideas  https://twitter.com/videosofscience/status/613065179601895425 ,1435119104,ROBbinBAYnks,2,1,1,0,tweet
613558534983286784,The Ripple Effect: Lyrics Born & The LB Mixed Re-View http://de-la-soul.musicnewshq.com/news/the-ripple-effect-lyrics-born-the-lb-mixed-re-view-real-people-1?utm_campaign=social-repost&utm_source=twitter&utm_medium=text  #DeLaSoul,1435118728,mhq_rap,2,0,2,0,tweet
613554651984756736,"""If she can pee she's old enough for dad"" - Kyle Ripple",1435117802,carlseidita,3,0,0,0,tweet
613545511031705600,I'm sorry tubas I never saw that ripple. But that ripple was Sooo good omfg ,1435115623,char_bae,7,1,2,0,tweet
613541634135855104,Ripple is coming to @atthebarns Sat 27! Drop newborn/6T clothing to WBCA tent at BENSON & CHRISTIE. @StClairWestTO @TheStopCFC @WychwoodBIA,1435114699,KidsRipple,2,0,4,0,tweet
613540488948383744,"For Banks, It’s Time to Upgrade From the Telegraph | Ripple http://bit.ly/1QP0Igl  @Ripple $XRP $BTCpic.twitter.com/adw180zDW7",1435114426,CryptoGamr,2,0,0,0,tweet
613533253807534080,"purple and white, 
purple and white, 
wild flowers ripple 
in a river of sunlight",1435112701,JohnJGeddes,4,0,3,0,tweet
613529431194234880,I LOVE THIS RIPPLE SO MUCH pic.twitter.com/KIYN2A54ZO,1435111789,bbypatty,8,1,0,0,tweet
613523465912500224,@Joe_Mazza a5 #ptchat #ptcamp experience of the ripple effect and power of the connections you'll make. Assistance to grow your PLN!!,1435110367,GenieneD,2,1,2,613522845692481537,reply
613518655951781888,"Congrats to @DeniseMSwank for winning BEST COMPANION NOVELLA for ""Ripple of Secrets"" Utopia Awards 2015! http://www.amazon.com/Ripple-Secrets-Gardner-Mystery-Novella-ebook/dp/B00RKVZ1VA/ref=tmm_kin_swatch_0?_encoding=UTF8&sr=8-1&qid=1435108947 ",1435109220,WestmarchPub,1,1,1,0,tweet
613516095866191872,Craig Ripple's hoping a borrowed generator can save his food after not having power in Cassville for 2 days #news3pic.twitter.com/9UuhAeEFWH,1435108610,Matthew_WSAW,0,0,5,0,tweet
613510171390836737,"I  LOVE I/O COIN,  just bought more beets! :-)  https://www.youtube.com/watch?v=UxuyJHdEUTU  #iocoin $ioc #ioc #bitcoin #ripple #xrp #stellar #btc #vericoin #xmr",1435107197,luvchenkopras,3,1,4,0,tweet
613507358333861888,"New Song Around The World, ""Ripple,"" coming July 5th as the final video of @JamBase's @GratefulDead tribute series! http://bit.ly/1BzHuV5 ",1435106527,playing4change,7,0,8,0,tweet
613507265954492416,Great night of touch.  I believe we had 10 on 10 at one point.  We will be back at it again Thursday night 6-8pm at Broad Ripple Park.,1435106505,Indyrugby,0,0,0,0,tweet
