ID,Tweet,Time,User,Likes,Replies,Retweets,in_response_to,response_type
587306941258534913,California drought creates grim ripple effect: http://on.msnbc.com/1GYomzR  (Gardi/Azdarya) pic.twitter.com/bMb99oNM1X,1428859861,MSNBC,7,6,14,0,tweet
587208626823102464,Remember there's no such thing as a small act of kindness. Every act creates a ripple with no logical end.,1428836421,MrAlMubarak,64,1,118,0,tweet
587384240469254144,Your Mom Creates Grim Ripple Effect,1428878290,CNNyourmom,6,0,4,0,tweet
587381051514716161,"Your $$ TODAY will have a powerful effect on our first week numbers, which will have a ripple effect on the campaign. http://VoteRoderick.com ",1428877530,johnroderick,3,0,4,0,tweet
587363415959728128,Serving others doesnt require a grand gesture; the smallest kindness creates a profound ripple effect. #YourUltimateLifePlan,1428873325,DrJennifer,5,0,6,0,tweet
587352535842848770,Pretty cool tire ripple pic.twitter.com/1FGlgXHmcv,1428870731,kennady_,11,0,0,0,tweet
587352067699769347,"#Volunteerism has a ripple effect—the good you do is felt, and shared, by those who receive it. pic.twitter.com/bWl9ssoDRd",1428870620,salvationarmy,10,1,10,0,tweet
587314559838457857,"Georgette, a #volunteer at #TansleyWoods is part of the ripple effect. 
Thank you! #NVW2015 #Burlington #BurlONpic.twitter.com/Y2CiNzxMqy",1428861677,SchlegelVillage,7,0,5,0,tweet
587299848921206784,Barry Brandt's influence will ripple throughout the GPAC 4 yrs. 2 come! Thanks 4 your leadership & love 4 students.  https://twitter.com/jimabbott33/status/587296723724189696  <quoted_status>Great stuff from @Play_NAIA Athletic Director of the Year Barry Brandt. #classact #naiaconvention pic.twitter.com/hY51FmMCAq</quoted_status>,1428858170,dogbuilt,9,0,6,587296723724189696,quoted_retweet
587299444305088512,"Maybe I can't change the world, but I can impact my little corner of it & watch the ripple effect ~ #DTN #kindnesspic.twitter.com/wLeSzJCqT0",1428858073,DTNEtiquette,3,0,4,0,tweet
587296633316110336,Be a generous giver! The ripple effect of generosity is fun to watch! #GiveMorepic.twitter.com/bqt3K8ISN1,1428857403,BruceVH,21,0,24,0,tweet
587296166095650816,Big shout out to #manyfacesnl who volunteer. They have a huge impact on our daily lives. Become one! Be part of the ripple effect.VOLUNTEER!,1428857292,CSCNL,7,0,13,0,tweet
587295471179292673,Volunteers are part of the ripple effect. Celebrate 2015 National Volunteer Week http://volunteer.ca/nvw2015  @VolunteerCanada,1428857126,itsinyoutogive,5,1,5,0,tweet
587287322871390209,"Sometimes my Pandora station shares some amazing #music
#PhuturePrimitive - Ripple Effect
   http://bit.ly/1yQcQyL ",1428855183,ADevotedYogi,12,0,3,0,tweet
587271683230330881,"Our debut broadcast! Come hear about The Ripple Movement, what @thetravelbee and I are working on, and NY! https://twitter.com/ripplemovement/status/587258247763120129  <quoted_status>LIVE on #Periscope: LIVE from London! Meet the team, announcing #RipplesInNYC https://www.pscp.tv/w/Vwuw9DgxNjIzNnw0MTM0ODU0dbJCCLUl2r5nUA6jmo2uH6_KewVdnWrOZNJgMWUh5Yo= </quoted_status>",1428851454,aDylanLowe,4,0,2,587258247763120129,quoted_retweet
587218381666918400,Can you help us identify these Male? Fraud Ripple Road #Barking Call Crimestoppers 0800555111pic.twitter.com/vJL2KMtFDt,1428838746,MPSBarkDag,3,0,6,0,tweet
587156755123204097,"@JimCantore Strong wind & melting ice led to ripple effect on Lake Champlain in Burlington, VT, on Sat. https://youtu.be/7I2Tpy_yUAs ",1428824053,Wej12,9,2,10,0,tweet
587111776766074880,Driving through broad ripple on a Saturday night is like driving through a herd of lost sheep,1428813330,carolwashburn1,7,0,0,0,tweet
587103270310559744,"That ripple tho 
#FirstPlace pic.twitter.com/Gk8RA73ohV",1428811302,WhoGon_StopMeh,5,0,8,0,tweet
587086482264825856,"""Every time you stand up for an ideal, you send forth a tiny ripple of hope."" - Robert Kennedy",1428807299,LibertyBell1000,3,0,2,0,tweet
587085635241975808,@Te_Taipo @36th_Parallel Or gcsb just call it something else and pretend emphasis is on incoming data- this mass take is not surveillance,1428807097,ben_ripple,1,0,0,586376401273520128,reply
587085238192513026,Accept #Ripple #XRP payments in #PHP #Wordpress #Css. #Bitcoin $XRP Goto - https://gourl.io/voting-xrp-now.html pic.twitter.com/kAEy5xCceY,1428807002,CryptocoinAPI,2,0,2,0,tweet
587083952315215872,DWI checkpoint tonight in broad ripple area. On broad ripple ave. Be safe friends.,1428806696,Heygood4U,1,0,0,0,tweet
587080365765959681,Each choice creates a ripple of results that affect subsequent choices.  http://bit.ly/1BKEFLo ,1428805841,MrBriankwright,1,0,0,0,tweet
587078207544889344,When you can walk in a brand new pair of heels down broad-ripple and back without asking your significant other to carry you.  #keepers,1428805326,macnnieten,2,1,0,0,tweet
587075439488868352,Vintage  Housewares 1930's Ripple Crinkle Cutt http://arnd.co/KyXHH  #Vintage #Mantiquespic.twitter.com/43tEpoGyA2,1428804666,ChknCoopAntique,0,0,3,0,tweet
587072162659491840,State of #Bitcoin Q1 2015: Record Investment Buoys Ecosystem http://bit.ly/1CETvCj  $BTC $XRP @coindeskpic.twitter.com/daigCB5VYp,1428803885,CryptoGamr,1,0,1,0,tweet
587068950933929984,@onesedonia just thinking about Ripple gives me a headache #TCMParty,1428803119,queenofnoirs,1,1,0,587068644015771650,reply
587068644015771650,"That Ripple will get you every time kids...
#TCMParty
#AliceDoesntLiveHere",1428803046,onesedonia,2,1,0,0,tweet
587068533810528256,That satisfying moment when you move a certain way and muscles you didn't know you had ripple  #fitlife #gymrat #bodybuilding,1428803020,Frank_sccr8,2,0,0,0,tweet
587067258842693632,@erikmal @twolinepass @katiebakes the net doesn't even ripple in the GIF; I can't imagine how it could have passed through,1428802716,Ugarles,1,0,0,587063062936612864,reply
587060812440821761,"Happy Birthday to my long lost best friend @Shelby_Ripple hope your days been great, miss you tons tell me when u come to Michigan",1428801179,Evelyndancey__,1,0,0,0,tweet
587055894162202625,Saturday nights in Broad Ripple are so live. I love it.,1428800006,BlasianBliss,1,0,0,0,tweet
587055890852945920,"They're doing ""The Ripple"" at Citizens Bank Park. It would be ""The Wave,"" but this place is half empty.",1428800006,Tom_Schad,1,0,0,0,tweet
587051469397868544,“@brooke_ripple: @harrysfeminist yea you seem a little jealous?” Why would I be jealous of white girls with no lips culture and self love,1428798951,CHlSMOSA,10,0,4,585945506741784576,reply
587051143617888256,"@brooke_ripple hoe I hope you know that you white girls WISH you had our lips, butts, boobs, hips, skin color, hair etc",1428798874,CHlSMOSA,3,0,1,585945506741784576,reply
587050782437969921,“@brooke_ripple: @harrysfeminist ain't nothing fake about us” I KNOW YOU DID NOT JUST SAY THAT THERE AINT NOTHING FAKE ABOUT WHITE GIRLS,1428798788,CHlSMOSA,7,1,3,585945506741784576,reply
587047695967248384,happy birthday @Shelby_Ripple love youu ,1428798052,amanda_smeltzer,1,1,1,0,tweet
587046473470181377,so goood to me home with a ripple and a glass of water i need this right now,1428797760,ben_lew_,1,0,0,0,tweet
587044905593126913,"@Chris_Gammell Whoa, check out the ripple on that guys abs!",1428797386,ssshocker,2,0,0,587042394023059456,reply
587044841772683264,How crazy the commercial comes out and now they are paired together #ripple,1428797371,Mattyg29006,0,0,0,0,tweet
587044506840784896,"Ripple energy is love,
ripple energy is life. pic.twitter.com/ohqYc5vDTc",1428797291,reduxaldrifter,0,0,0,0,tweet
587044323729940480,まぁ、何ということでしょう！ご両親に戴いた五体満足の身体で勝ち取ったチャンスを、こうも無駄にするだなんて！あなたひとりで大きくなったとでも思ってるのっ！きぃー。,1428797248,bot_ripple,0,0,0,0,tweet
587043946120916992,A simple act of caring creates an endless ripple,1428797158,AngelJaydenA,0,0,0,0,tweet
587043773172973568,"Ripple Explained with David Schwartz, Chief Cryptographer of Ripple Labs http://www.naation.com/2015/01/27/ripple-explained-with-david-schwartz-chief-cryptographer-of-ripple-labs/5750/ ",1428797116,PatelliPaschal,0,0,0,0,tweet
587042747548209152,父「アルトスは今日もバイオリンの練習か」母「いい音色どんどん上達してるわね」父「このバイオリンに歌が合わさったらさぞかしいい曲になるだろうな」,1428796872,ripple_ring_bot,0,0,0,0,tweet
587042669882257408,"XRPの価格暴落、リップル周辺のトラブル継続

 http://cryptocurrencymagazine.com/ripple-trouble ",1428796853,RippleNewsJapan,0,0,1,0,tweet
583714335723233281,"Coinbase, Blockstream, BitPay, Circle and Ripple Labs and others have voiced support for a BitLicense 'safe harbor' http://coinde.sk/1Gh5VGu ",1428003317,coindesk,5,2,20,0,tweet
583749463212068864,"Bitstamp freezes $1M in funds disputed by McCaleb & Ripple, goes to court: http://bit.ly/1GQvGxH  — McCaleb wanted to sell XRP to buy STLR",1428011692,TuurDemeester,1,1,5,0,tweet
583757057813127168,Watch the @RippleLabs Tech Talk: Understanding @Ripple Consensus https://ripple.com/blog/ripple-labs-tech-talk-consensus-within-the-ripple-protocol/ pic.twitter.com/EKFP7eL6cE,1428013502,Ripple,15,0,27,0,tweet
583747588303618049,"Our residents knitted scarves, sold them and sent funds home to their families! We love the ripple effect of freedom. pic.twitter.com/aqqT8rCYf3",1428011245,A21,35,1,11,0,tweet
583746553476710400,"You really think my wife will like this? 

Try not to talk, it's making your body ripple. pic.twitter.com/J0lmFrqx06",1428010998,Simpsons_Addict,6,0,4,0,tweet
583740437925650433,From small actions to big changes. See how this ripple effect is making a huge splash: http://bit.ly/1DAU3yA  #OneNote #CollectiveProject,1428009540,whymicrosoft,5,0,5,0,tweet
583726133407047680,Another big ripple of Twitter applause for Nicola Sturgeon pic.twitter.com/BksQZpdU63,1428006129,carljackmiller,12,0,7,0,tweet
583725461911502848,"Tiny, micro-ripple after-shock from a distant echo of Cleggmania there.",1428005969,rafaelbehr,3,0,3,0,tweet
583709702107881472,The cool kids got the same Ripple! @NIRSAFoundation @NIRSAlive @RipplesGuy #NIRSA2015pic.twitter.com/6EjZV1ZGLy,1428002212,bssmit1,11,0,3,0,tweet
583701278842322944,"$1 Million Legal Fight Ensnares Ripple, Bitstamp and Jed McCaleb http://coinde.sk/1HnliM5  pic.twitter.com/IaRD5rr22q",1428000204,coindesk,4,0,21,0,tweet
583680968763904001,Ripple Labs: Jed breached the agreement https://xrptalk.org/topic/5973-ripple-labs-jed-breached-the-agreement/  @Ripple @RippleLabs @StellarOrg,1427995361,XRPtalk,4,0,3,0,tweet
583680810227597313,"@Ripple featured in MIT Tech Review!
 http://bit.ly/1DAoODT ",1427995324,Camp1Ventures,9,0,15,0,tweet
583678482720235520,Check out my first app Ripple Drop on the Play Store! Download it here! http://goo.gl/NOkm6u  #AndroidOnly,1427994769,LanTBas,5,0,1,0,tweet
583670177990057984,Fantastic support for the Ripple Retreat inc @kettleco @kitchensint @WareWithAll @jamesmorrowhes @Collinson_ltd http://www.itsgood2give.co.uk/who-is-helping-with-the-ripple-retreat/ ,1427992789,itsgood2give,5,1,5,0,tweet
583669460587966464,"Take a look at this,see the comments. This is the ripple effect of what we have done in Nigeria https://mobile.twitter.com/jdmahama/status/583132992316563456  <quoted_status>I have called President-elect Buhari to congratulate him and also called President Goodluck Jonathan to commend him for his statesmanship.</quoted_status>",1427992618,manmustwack,1,0,6,583132992316563456,quoted_retweet
583664321173008384,"#socialmedia #marketing ripple effects in business.

Thought Leadership from @mojobizsolution http://bit.ly/1anmN2B pic.twitter.com/WIkrmWIeIO",1427991392,SmartCEO,10,0,6,0,tweet
583648091716235264,"Indianapolis, me and @KeithAlberstadt will be @CrackersComedy Club in Broad Ripple tonight-sat.  http://bit.ly/1CNfTy4 ",1427987523,johnbcrist,6,1,2,583391752045879296,reply
583647612877676544,FinTech Startup Creates Ripple Gateway for Counterparty http://dlvr.it/9DD6Kw pic.twitter.com/tx1f5syYsq,1427987409,BitcoinPRBuzz,2,0,2,0,tweet
583624387821207552,We need to send a tiny ripple of hope to our security forces and students who are battling terror. #GarissaUniSiege @JulieGichuru,1427981871,patmaichbmf,7,5,13,0,tweet
583560832577048576,"Every word
A ripple in my story
#amwritingfantasypic.twitter.com/v31DZ7kLgB",1427966719,DJBowmanSmith,2,2,6,0,tweet
583552670314721280,"Domestic Abuse: The Ripple Effect - Conference, Liverpool, 29th April - http://www.kcvs.org/domestic-abuse-the-ripple-effect-conference-liverpool-29th-april/ ",1427964773,KnowsleyCVS,2,0,4,0,tweet
583538858224197632,"Raspberry Ripple enews is on holiday this week  - Happy Easter to all @GuidingLaSER vols & staff, enjoy time w/ family & friends this w/e!",1427961480,PipMcKerrow,2,0,2,0,tweet
583536618633437184,"What happens if the butterfly effect is real?  This guy goes back in time, causes a ripple, and now I suddenly have a hernia.  #RedEye",1427960946,awj9009,3,1,1,0,tweet
583535543327129600,The pay-cheque diplomacy of Saudi Arabia has its tantalising fruits but with very lethal ripple effects. http://www.thenews.com.pk/Todays-News-9-310354-The-Yemen-conundrum ,1427960689,ArvindBosmia,1,0,3,0,tweet
583520987993415681,Symbiont Creates Ripple Gateway for Counterparty XCP  http://globalcryptonews.com/symbiont-creates-ripple-gateway-for-counterparty-xcp/  #DigitalCurrency,1427957219,globalcryptos,2,0,5,0,tweet
583516790036234240,#kindness ripple - go on make it happen pic.twitter.com/FsWV0FRwHg,1427956218,tgcm,3,0,4,0,tweet
583513590537269249,Today we are speaking in Hyde bank young offenders prison about the ripple effects of crime from a victims point of view,1427955455,rayandvi,0,0,3,0,tweet
583511699350626304,"Ripple, a Cryptocurrency Company, Wants to Rewire Bank Authentication http://bit.ly/1Fk0MvN ",1427955004,techreview,18,1,28,0,tweet
583497476201553920,“@CheerVines: This ripple https://vine.co/v/O3wpVrTeTDw ”cheer athletics are my babbyysss,1427951613,DAYDMC,2,0,0,581252917203730432,reply
583494544819232768,Influencing one person positively can have a ripple effect across society quote #entrepreneur #leadership #marketingpic.twitter.com/oGRT0ZfeJQ,1427950914,jasontreu,9,0,3,0,tweet
583471267120095232,I'm in love with this ripple (Vine by @thecheervine) https://vine.co/v/O3wpVrTeTDw ,1427945365,awechitt,3,0,0,0,tweet
583469644620685312,"Played an April Fools joke on the team .. Laugh, learn and make a ripple @Enactus_USA @Merry_EnactusUSpic.twitter.com/V92XPJgpxx",1427944978,FredoniaENACTUS,6,0,4,0,tweet
583456356692205568,"@RippleFrog @bwiyurin @e_bitchuary and i saw a frog skeleton in a jar today, thought of you ripple frog",1427941810,beefmilk,3,1,0,552212579276185600,reply
583441974184833024,Mayor Jim Wood @RedDeerCounty talking about the ripple effect of kindness and volunteering.  Lets all https://instagram.com/p/09EjnWI6iq/ ,1427938381,EverydayABn,0,0,2,0,tweet
583434231583354880,The Ripple in time is a Great wave to surf.,1427936535,MetalJac_Fang,2,0,1,0,tweet
583432749786255360,"""@Only_Brunettes: Christina Ripple  #BrunetteBeauty pic.twitter.com/sE46t5r7oQ"" that's how I work out ;-)",1427936181,du_nugoth,6,1,4,0,tweet
583419722517086208,Teachers: I want to publish your thoughts on the verdicts in Atlanta and how/whether you have felt ripple effects of the cheating there.,1427933075,emmersbrown,12,6,23,0,tweet
583418618836348928,@DonStuckRadio at alley cat lounge b ripple pic.twitter.com/lfkDCPEbrn,1427932812,GINNCAT,2,0,1,577592606810611712,reply
585123053266456576,"""Ripple Delete"" inexplicably stopped working. Now, my life is a nightmare...",1428339181,JoelHeyman,121,10,11,0,tweet
585225017341935616,"$1 Million Legal Fight Ensnares Ripple, Bitstamp and Jed McCaleb http://www.coindesk.com/bitstamp-court-1-million-dispute-ripple-jed-mccaleb/ ",1428363491,Bitcoin,3,0,16,0,tweet
585211542649577473,".@RippleLabs expands to Asia Pacific, led by @diliprao http://www.bankingday.com/nl06_news_selected.php?act=2&stream=1&selkey=18467&hlc=2&hlw= pic.twitter.com/e4ok1ZD3d4",1428360279,Ripple,11,2,17,0,tweet
585206892814675969,Ripple bracelet for @Irish_Huntresspic.twitter.com/4P1BL3jupl,1428359170,sosgearmt,14,1,2,0,tweet
585205516604870656,Ripple bracelet headed to @ILBOWHUNTINGpic.twitter.com/pqUSlLLqOd,1428358842,sosgearmt,13,1,6,0,tweet
585192401309806592,I don't care what you think about @tigerwoods this new @nike spot is #amazing Ripple http://youtu.be/CdhWhgA8Y0A ,1428355715,KevinFrazier,11,4,15,0,tweet
585187253288214528,"Latest Work:  Nike ""ripple"" by Wieden & Kennedy http://dlvr.it/9H0QGS ",1428354488,Campaignmag,6,1,4,0,tweet
585177967099301888,.@Ripple adds dropdown customizations to its price charts http://bit.ly/1ID2eK4 ,1428352274,Finovate,3,0,4,0,tweet
585146634784415745,I hope you'll check out the book club. Really could use your input when we get to Ch.9 #Ripple #Bitcoin @nbougalis http://bit.ly/1E141KG ,1428344803,haydentiff,4,1,5,584896615095390208,reply
585134352444563457,Tiger Woods and Rory McIlroy Star in Nike Golf’s New “Ripple” Film http://nicek.io/1GEb8IA ,1428341875,nicekicks,12,3,8,0,tweet
585125385978785792,Congrats to @BruggeBrasserie for winning #MaltMadness! We will tap Tripel de Ripple this Fri,1428339737,twentytap,4,1,4,0,tweet
585123226612797440,"Nike's ""Ripple"" Ad with Rory McIlroy and Tiger Woods: https://youtu.be/ttztouyK2dg  The Ripple Effect. Love this. @My_PE_Exam @PE4Learning.com",1428339222,ImSporticus,7,5,9,0,tweet
585117954758545408,#LiberalIceCreamFlavors Doesn't Hate And Fear Everyone Different From Him Peanut Butter Ripple,1428337966,jitka,10,1,3,0,tweet
585111443034476545,The winner of @indystar's 2015 #MaltMadness #INbeer bracket is...@BruggeBrasserie Tripel de Ripple! pic.twitter.com/upRN6eK8ld,1428336413,AmyBHaneline,22,2,30,0,tweet
585106709728854016,"W+K, Tiger Woods create ‘Ripple’ for Nike Golf http://ow.ly/3xHKAd ",1428335285,AgencySpy,5,0,2,0,tweet
585094804847079424,#LiberalIceCreamFlavors Black and Blue Ripple Cripple pic.twitter.com/csSZBm5Fo8,1428332446,danmsnyder,7,2,5,0,tweet
585084132339933184,"Ripple from @nike. Outstanding ad.

 https://www.youtube.com/watch?v=CdhWhgA8Y0A ",1428329902,mattjlange,5,0,6,0,tweet
585069773794324480,The influence of MORTDECAI continues to ripple through the American cultural landscape pic.twitter.com/1fbkX3U7wy,1428326478,jessehawken,7,0,2,0,tweet
585056336582467584,Great new @nikegolf spot. A true salut to Tiger #ripple https://www.youtube.com/watch?v=CdhWhgA8Y0A pic.twitter.com/sMqamPxZK0,1428323275,adamjphillips,9,0,4,0,tweet
585045507015217152,"Each time we act to improve the life of another person, we send forth a ripple of hope in what appears to be a hopeless society.",1428320693,Heidi_Steinke,9,0,9,0,tweet
585040427562205184,"Anyone wanna help Green victory in Beaconsfield?
Each gracious conversation you have, about why you're voting green, creates a lovely ripple",1428319482,Dave4Beaconsfld,2,1,5,0,tweet
585036535675940864,"Well done, @Nike, well done. Parents of athletes, this is a must watch! Ripple: https://youtu.be/CdhWhgA8Y0A  via @YouTube",1428318554,Jennifer_Hogan,3,0,1,0,tweet
585027962434519040,"Rare ripple-leaf muttonwood, Myrsine richmondensis, can be seed-banked #AustralianRainforest
 http://www.ingentaconnect.com/content/ista/sst/2008/00000036/00000001/art00023  pic.twitter.com/gAzKiqLsOX",1428316510,ApsaraCat,13,0,9,0,tweet
585027438498951168,"Ahead of The Masters.. clever Nike 'Ripple' advert featuring @TigerWoods and @McIlroyRory
 https://www.youtube.com/watch?v=CdhWhgA8Y0A ",1428316385,adeymoorhead,5,0,6,0,tweet
585013688249253888,"Every hate crime has a ripple effect; a backlash that will consume your own people elsewhere, also a minority away from home.",1428313106,gimbakakanda,2,0,12,0,tweet
585010392075730944,"This is the best #advert I have seen so far in 2015, well done @Nike #ripple #marketing https://www.youtube.com/watch?v=CdhWhgA8Y0A ",1428312321,MarketingInCork,3,0,3,0,tweet
585006566048456704,"With new dropdown customizations on @ripple charts, select the specific currencies that you would like to view. http://ow.ly/Lbbv7 ",1428311408,Ripple,3,0,4,0,tweet
585005720380182528,Love this video @nikegolf https://m.youtube.com/watch?v=CdhWhgA8Y0A  #teamnike #inspiring #ripple,1428311207,DanWebsterGolf,3,0,4,0,tweet
585000666369785856,@Aimingtobegreen And rightly so! Here he is - the gorgeous Ripple @AdoptADonkeypic.twitter.com/MpAGUgsJjz,1428310002,DonkeyCrafts,7,2,5,584993569427091456,reply
584999848794951682,"Azim Premji attends RSS function, pseudo-secular feel ripple in stomuch http://timesofindia.indiatimes.com/india/Azim-Premji-attends-RSS-function-creates-ripples/articleshow/46817733.cms  Wah re secularism. @SurajitDasgupta",1428309807,_deepaktiwari,3,1,5,0,tweet
584962238701776896,What the Fox Learnt - Ripple Digital Publishing | http://buff.ly/1NHiZFy  | Children's Fiction #free #ebook #freebook #freeebook #Childrens ,1428300840,janinebucks,0,0,16,0,tweet
584954949492219905,What we're doing here will send a giant ripple through the universe. ― Steve Jobs,1428299102,entreprenershp,2,0,0,0,tweet
584938947379232768,"the ripple effect. 
everyone is influenced by someone. love this ad. #Golf #TigerWoods #RoryMcllroy #TheMasters
 http://youtu.be/CdhWhgA8Y0A ",1428295287,_alexvince,36,6,15,0,tweet
584919576347070465,Cherry explains how ripple texture cleans you well enough to go commando! http://ln.is/www.youtube.com/j6IfA  #cottonellecleancrew #sponsored #Gocommando,1428290668,ImAmyyall,16,0,13,0,tweet
584919314970648577,I'm sat here watching The Royle Family at 4 in the morning picking Galaxy Ripple crumbs off my pubes. A new low even by my standards.,1428290606,Big_Baner,3,0,1,0,tweet
584904696734748673,"I invited Rob to come with.

Rob from work or Rob who is a T-Rex?

*Glass of water begins to ripple like in Jurrasic Park*",1428287121,Dan_Haak,16,0,4,0,tweet
584891569184104448,"Nike Golf Film ""Ripple"" Features Tiger and Rory http://isbx.it/7901b  via @isebox",1428283991,MarkAllenGolf,6,0,2,0,tweet
584890927958794241,Cinderella story for 2 Broad Ripple girls. http://indy.st/1HEmkU4 ,1428283838,indystar,5,0,2,0,tweet
584871305578680320,"Here's Nike's newest ad, Ripple, with Tiger and a young Rory: http://bit.ly/1a78KgW pic.twitter.com/tYNvNwOpvC",1428279160,GOLF_com,46,7,49,0,tweet
584868203777527808,"Ripple, a #cryptocurrency Company, Wants to Rewire Bank Authentication http://goo.gl/DAnWOd  #bitcoin #marketspic.twitter.com/2gfUINIy2B",1428278420,vrstartup,1,1,0,0,tweet
590285099607851008,"“Invention, my dear friends, is 93% perspiration, 6% electricity, 4% evaporation, & 2% butterscotch ripple.” – Willy Wonka #MondayMotivation",1429569909,GeekandSundry,51,3,29,0,tweet
590261224140595200,.@chrislarsensf on @letstalkpaymnts discussing the future of #payments and vision of @Ripple. Listen in: http://ow.ly/LL6nb ,1429564217,RippleLabs,6,0,9,0,tweet
590258437931556865,"The 1-on-1 engagement does take time, but it is so worth it in terms of the loyalty that's built & ripple effect it creates #sbizhour",1429563552,LorrieGuerrieri,2,1,4,0,tweet
590253878689562624,"The IWC would like to thank Kevin Coval, Purdue University Calumet, White Ripple Gallery, and all who attended... http://fb.me/6xsus4jH6 ",1429562465,IWC14,2,0,2,0,tweet
590247585664921601,"Lessons from the Lion, the Ox and their little friends - Ripple Digital Pu | http://buff.ly/1CtGyfO  | Children's Ficpic.twitter.com/2YU0QmHOF7",1429560965,janinebucks,0,0,18,0,tweet
590237450414399488,"@jonlear ""SWIFT is the messaging layer, and @Ripple is fundamental movement of value. We're in an era of collaboration."" @NACHA_PAYMENTS",1429558548,albullington,11,2,15,0,tweet
590230713317904384,Great response from residents at our two #labourdoorstep sessions today. Join me tomorrow 2pm at Lambourne/Ripple. pic.twitter.com/lJHtRgxkaU,1429556942,margarethodge,7,0,7,0,tweet
590225998165086208," https://givenola.org/#npo/northshore-technical-community-college 
Become a ripple in the pool to start a tidal wave. Or a star in the dark sky to light someone's life up! Give May 5.",1429555818,AmyValentine29,2,0,2,0,tweet
590206230821470209,"I gave her a case of Ripple and Roseola, she gave me a case of crabs and the blues.",1429551105,Hobo_Splendido,4,0,4,0,tweet
590193926310473728,Here's a HUGE S/O to @KariJoys @alxindia @RockChristopher @T1AOG @P_TREBAUL @Socialfave @CrowdKind @TheJoyTrain Ripple effects growing!! ,1429548171,TriciaL1448,4,2,3,0,tweet
590193459769769984,".
Your thighs quiver
with the force
of your thought

it's nothing profound

only a gelatin ripple
lent
by your warm
& generous flesh.

#mpy",1429548060,Wyrde,6,0,2,0,tweet
590174335823958016,"I saw the smooth and tender surface
I saw it flow and ripple with yearning desire
I saw underneath and all the promise waiting there.",1429543501,MonteSeesAngels,33,0,7,0,tweet
590165279814115328,A fresh batch of our homemade raspberry ripple ice cream courtesy of Luke :) #foodiepic.twitter.com/63Alt82MV1,1429541342,caffecreamuk,7,0,3,0,tweet
590150548361388032,Become part of the ripple effect #volunteer #NVW2015 300 people with #disabilities are waiting for a friend like you.pic.twitter.com/7ecGNBvpL3,1429537829,CitAdvocacyOtt,4,0,2,0,tweet
590150441352220672,Acts of kindness radiate out in a ripple that touches countless lives! It's a beautiful thing! | LIAM 82 | Listen: http://itun.es/i6LD4MV ,1429537804,BruceVH,6,0,8,0,tweet
590139184863641600,Over 75 people attended the Ripple Labs Tech Talk for understanding consensus -now watch it online: http://ow.ly/LKVen ,1429535120,RippleLabs,3,0,4,0,tweet
590138621920825344,Today we're @NACHA_PAYMENTS to talk early adoption of @Ripple & the future of b2b transfers. 1:30-2:30p #Payments2015 http://payments.nacha.org/GameChangers15 ,1429534986,zed_zed,8,0,3,0,tweet
