ID,Tweet,Time,User,Likes,Replies,Retweets,in_response_to,response_type
605439929515130880,I like to brighten up my Monday with a sweet treat. A dragonfly ripple milkshake is my go-to start to a happy week. Yummy!,1433183102,KermitTheFrog,73,4,34,0,tweet
605296320899883008,"Commonwealth Bank to trial Ripple technology, potentially Bitcoin http://on.mash.to/1AEPnIK pic.twitter.com/yuVXZ7z5Lk",1433148863,mashable,39,1,66,0,tweet
605521757576015872,"Check out Handcrafted Afghan Zig Zag Ripple Pattern Single Stitch 58 1/2"" X 34 1/2""   http://www.ebay.com/itm/Handcrafted-Afghan-Zig-Zag-Ripple-Pattern-Single-Stitch-58-1-2-034-X-34-1-2-034-/301651007408?roken=cUgayN&soutkn=Z6k877  via @eBay",1433202611,7SistersBooks,3,0,10,0,tweet
605480150818418690,Down day for almost all cryptocurrencies- Live prices: http://www.CoinCap.io  #bitcoin #dash #ripple #litecoin #dogecoin #forex #stocks #XCP,1433192691,ErikVoorhees,2,1,3,0,tweet
605475380615610369,@ScruffKerfluff A border collie - Ripple :) pic.twitter.com/9cIqIkGzmP,1433191554,SpazzFox,15,3,0,605466880250388480,reply
605472737642090497,"Live stream from @gregkidd of @RippleLabs on digital ledgers at the @FSRoundtable's event Wed 6/3, 9am #BITSforumDC",1433190924,Ripple,4,0,9,0,tweet
605471246663360512,Big stuff happening at this new little lounge in Broad Ripple. @Sangrita_Indy opens this week. More to come. pic.twitter.com/2V2bYRugPu,1433190568,AmyBHaneline,7,1,9,0,tweet
605468173232504832,"Trade your Bitcoin against any asset in the Ripple network with http://ggateway.biz 
#Bitcoin $BTC paired with $XRP $EUR $USD on @Ripple",1433189836,GoldenGatewayUS,9,11,10,0,tweet
605449110909419520,Interact with @Ripple from the command line with the new ripple-cli module https://github.com/ripple/ripple-cli  #ripple #crypto #nodejs #decentralized,1433185291,stevenzeiler,5,1,10,0,tweet
605442350656143360,Empowering women around the world has a ripple effect -Alexandra @GirlUp @unfoundation #TweetADream watch LIVE: http://bit.ly/1HUVJG9 ,1433183679,plus_socialgood,14,0,23,0,tweet
605407213557972992,"Each time we act to improve the life of another person, we send forth a ripple of hope in what appears to be a hopeless society.",1433175302,Keithzok,5,0,7,0,tweet
605404879847362562,".@AmerBanker: ""The Fed's Unexpectedly Bold Payments Idea"" http://bit.ly/19ar8W5 ",1433174745,Ripple,4,0,7,0,tweet
605404803917840385,Would you live in a home made of #shippingcontainers? Ripple Container Home http://ow.ly/NEMXJ  via @ShippedCompic.twitter.com/osKI9i2kWk,1433174727,DTContainerPark,7,0,4,0,tweet
605404453810896897,Drop a kind compliment and watch the ripple effect it has in your life,1433174644,cutepeacelover,37,2,28,0,tweet
605402958155665408,@uk_sport @TheYarnold The ripple http://effect.One  small pebble... We now have many inspirational sportswoman to be proud of #DalaiLama,1433174287,RealDeniseLewis,6,2,2,605352389663670272,reply
605402052806602752,Ripple! @erin_onelove @JoeDeaton1 @Lyferdeadhead @ChrisNi15810094 @barrettric @tomcorsie @Weireveryweir @nickvanwhypic.twitter.com/pBdyqnm0us,1433174071,pawhite,11,3,7,605337519950073857,reply
605387202558861312,There is no such thing as a small act of kindness. Every act creates a ripple... ~Adams TY @Koksalakn #RippleEffectpic.twitter.com/Zh9ofDGLzm,1433170531,effimera01,633,17,439,0,tweet
605373625659760640,Ripple Labs names former DTCC boss Donahue as an advisor http://www.finextra.com/news/fullstory.aspx?newsitemid=27416  #fintech,1433167294,Finextra,4,0,6,0,tweet
605363168819458048,Closure of nine metro #Denver Safeways has ripple effects: http://dpo.st/1Gdhxgb  by @SteveRaabeDPpic.twitter.com/u2b4sRxeuo,1433164801,denverpost,2,0,3,0,tweet
605352592533618688,"i don't think another love revelation will make a big ripple, an IDOL secret marriage would be more exciting.",1433162279,Twiteettay,9,3,25,0,tweet
605352302459785217,Ripple Appoints DTCC’s Former CEO as Advisor: Digital currency startup Ripple Labs has appointed... http://bit.ly/1Jju7JR  #Bitcoin #btc,1433162210,TopBTC,1,0,2,0,tweet
605351942970306561,Welcome Advisor Donald Donahue to @RippleLabs: http://bit.ly/1Kx3Eae ,1433162124,Ripple,6,0,8,0,tweet
605351629320286209,Ripple Appoints DTCC’s Former CEO as Advisor http://coinde.sk/1I4wi2e ,1433162049,coindesk,5,0,19,0,tweet
605328079330910208,The Ripple Effect - Alex Prudhomme | http://buff.ly/1Ap9MBf  | Politics & Current Events #ebook #Politics #Current #Events bestselling ebooks,1433156435,loriedden,4,0,10,0,tweet
605315690933927937,Watch a trailer for @goatmedialtd & Ripple Arts’ new film project A Dance Explosion: http://ow.ly/NHwIK  #aberdeen #fife #stirling,1433153481,CreativeScots,2,0,3,0,tweet
605313607220531201,"@Esther9982 stay strong #support is here for you...journeys together will ripple effect to your truth known,believed and given justice ",1433152984,unitedwithmark,8,0,3,603654817752489984,reply
605307336144629761,Commonwealth Bank Australia recognises shift towards crypto currencies - prepares to launch Ripple trial http://www.afr.com/technology/commonwealth-bank-to-embrace-bitcoin-and-air-miles-as-fintech-goes-mainstream-20150601-ghcre6 ,1433151489,TheFinTech50,3,0,4,0,tweet
605296320899883008,"Commonwealth Bank to trial Ripple technology, potentially Bitcoin http://on.mash.to/1AEPnIK pic.twitter.com/yuVXZ7z5Lk",1433148863,mashable,39,1,66,0,tweet
605249768147722241,Never underestimate the power of destiny Because when you least expect it the littlest thing can cause a ripple effect that changesyour life,1433137764,Manoloq7,3,0,6,0,tweet
605239377049100288,"CBA signs deal with Ripple for Blockchain settlements, may eventually support Bitcoin http://ift.tt/1KxkgyI ",1433135286,SiliconANGLE,2,0,1,0,tweet
605236287386320896,Growth - CommBank starts using Ripple digital currency network – what it means for Australian fintech: http://www.startupsmart.com.au/growth/commbank-starts-using-ripple-digital-currency-network-what-it-means-for-australian-fintech/2015052914837.html#.VWvllVOzhXM.twitter ,1433134550,elizalde240,4,0,0,0,tweet
605229811682787328,"Storytelling On Social Media - The Ripple Effect

 http://blog.digitalinsights.in/how-brands-are-leveraging-social-media-storytelling/05285787.html pic.twitter.com/nrG1p7YnfN",1433133006,DimentionsIndia,7,0,9,0,tweet
605217419859226624,@tjHOTTUNA you're a fan favorite. Reba is a great and Ripple will be another great addition to #TeamOtt #ReelTalkpic.twitter.com/mFCnHgPjyL,1433130051,ericsalach,4,0,1,0,tweet
605196927483846656,"I love the ripple effect on Twitter, as different people get through a #GoT episode.",1433125166,Rizzz,4,0,0,0,tweet
605180558587662338,"Meet Ripple, Reba's sister and the newest #WickedTuna cast member!pic.twitter.com/DOIVRjI6TC",1433121263,WickedTuna,206,20,41,0,tweet
605174933539459074,"I lost in PM to both Plup and Ripple lol.
PM is so tough",1433119922,TempoAxe,22,5,2,0,tweet
605162186256859136,"“Make just a ripple. Come on be brave. This time a ripple, next time a wave.” - Anyone Can Whistle #ArdenMasterStoryteller",1433116883,ArdenTheatreCo,5,0,2,0,tweet
608053635684134912,"Australia Embraces Faster, Smarter Payments http://ow.ly/O26at ",1433806258,Ripple,3,0,6,0,tweet
608036546265157634,MT @CHIPIndy: 10 days left to register for Run 317 in @Broad_Ripple. Race to benefit community partner @IndySOW! FMI: http://tinyurl.com/RUN317 ,1433802184,IndySOW,2,0,2,0,tweet
608034166001831936,"@NSeditor our speakers @HIC2016 https://worldhealthinnovationsummit.wordpress.com  ""The Ripple Effect"" #togetherweinspirepic.twitter.com/Iroh1PPLAn",1433801616,GarethPresch,4,0,3,0,tweet
608030815667294208,"It's time to get excited about your new little cantina, @Broad_Ripple http://buff.ly/1QisBNv pic.twitter.com/NKJ430jtvI",1433800817,NUVO_net,3,0,2,0,tweet
608018028823838720,6/24/15: Chat & run with me and Bob Kennedy @AthleticAnnex in the Ripple http://on.fb.me/1F4P7gZ  #Xcountry #yalitpic.twitter.com/6uYq95mD8m,1433797769,BillKenley,4,0,8,0,tweet
607994637937180672,"Ripple & Fidor: enabling cross-border payments - Ryan Terribilini, Ripple Labs https://xrptalk.org/topic/6649-ripple-fidor-enabling-cross-border-payments-ryan-terribilini-ripple-labs/  @Ripple @RippleLabs",1433792192,XRPtalk,2,0,5,0,tweet
607993535141421056,Join us for the next NYC @ripple meetup on July 8 hosted by @IntellectEU http://meetu.ps/2JRYPq ,1433791929,RyanZagone,4,0,6,0,tweet
607975122801008640,"If you’re doing a cookie-based “Jurassic” parody and the dino-ripple isn’t in a glass of milk, you’re not even trying.",1433787539,TheFienPrint,16,0,4,0,tweet
607940197565788160,Westpac Banking Corporation and the Australia and NZ Banking Group are testing payment technology from  .@RippleLabs. http://bit.ly/1GuUzkz ,1433779212,Ripple,15,0,21,0,tweet
607929197483454464,Sexually:when you hitting it right and it got that ripple in it when it's coming back or she bend over look like https://twitter.com/v_erifiedbeauty/status/607924307331682304  <quoted_status>Why do niggas love booty so much </quoted_status>,1433776590,Suave_young50,3,1,3,607924307331682304,quoted_retweet
607919373131456512,"Westpac, ANZ trial Ripple payments, but big four reluctant on bitcoin http://afr.com/technology/westpac-anz-trial-ripple-payments-but-big-four-reluctant-on-bitcoin-20150608-ghhmsq?stb=twt  via @FinancialReview",1433774247,DrummondShaun,3,0,1,0,tweet
607905112649043969,.@RippleLabs EVP of BD Patrick Griffin will speak at the J.P. Morgan & Paul Hastings NextGen Payment Services Forum 6/10 in SF.,1433770847,Ripple,4,0,6,0,tweet
607893243481620480,@GrowninBritain ripple sycamore cut last week. pic.twitter.com/uhmnh1yJ0l,1433768018,TylerHardwoods,9,0,4,0,tweet
607823268721082368,Daily #Fintech: Real-time Payments is a Game-changer http://ow.ly/NWrw4 ,1433751334,Ripple,5,1,8,0,tweet
607818076441034752,Women in emerging markets should ‘take action’ and cause a ‘ripple effect of change’ http://bit.ly/1JyeOhS ,1433750096,HRFuturemag,2,0,3,0,tweet
607796758127738880,"A recent court case has ensared major digital currency industry players including Ripple Labs, Bitstamp and Stellar http://coinde.sk/1QbdbdT ",1433745014,coindesk,4,0,16,0,tweet
607779220908064768,Remember there's no such thing as a small act of #kindness. Every act creates a ripple with no logical end ~ Scott Adams,1433740832,GaryLoper,2,0,3,0,tweet
607749295316434946,"""People used to write that Ripple was the Western Union killer, now @WesternUnion is exploring Ripple."" @justmoon @NYTconf",1433733698,Ripple,11,1,19,0,tweet
607748782491467776,AND A BIG FUCK YOU TO THOSE EHO DOUBTED CLEVELAND GOODBYE JUMP OFF THE BANDWAGON BECAUSE YOURE ALL PEASANTS,1433733575,j_ripple,5,0,4,0,tweet
607710491792637952,"""Bottom line is that banking transfers should be instant, they should be cryptographic, they should be nearly free."" @justmoon @NYTconf",1433724446,Ripple,19,2,28,0,tweet
607709700440756226,For those who want to use their long weekend to try and comprehend Bitcoin & banks + a bit of Ripple thrown in. https://twitter.com/jessicasier/status/607694564443357184  <quoted_status>.@eyersj and I break down #Bitcoin and the banks: worth it or a waste of time? http://afr.com/technology/are-bitcoin-and-the-banks-worth-it-or-a-waste-of-time-20150605-ghh9n8?stb=twt  via @FinancialReview @JonMatonis</quoted_status>,1433724257,SaysSmithy,0,0,0,607694564443357184,quoted_retweet
607709498753417216,"""Ripple has created a better solution for banks to use the digital ledger system.""  @wences @NYTconf",1433724209,Ripple,5,1,4,0,tweet
607708966445932544,"When 1 person get on my nerves, everybody else start to get on my nerves like a ripple effect ",1433724082,klassykessa,0,0,0,0,tweet
607707858671566848,"""We wanted a system with a distributed ledger that could hold real currency and comply with banking regulations."" @justmoon @NYTconf",1433723818,Ripple,5,0,6,0,tweet
607707562377506818,"""Ripple is the bridge between the banking system and the distributed nature of a digital ledger."" @RippleLabs CTO @justmoon @NYTconf",1433723748,Ripple,5,0,7,0,tweet
607706137182412801,#Handmade Multi-Coloured #Striped #Ripple Stitch #Crochet #Baby #Blanket http://etsy.me/1KsZTpv  #madetoorder,1433723408,2BabyWithLove,0,0,1,0,tweet
607705936103415808,Wrapping up a very fun weekend with the fam. @derektburg blkntan debbie.pipkins @ HopCat - Broad Ripple https://instagram.com/p/3peh10DVlJ/ ,1433723360,El_Tburg,0,0,0,0,tweet
607705789784981504,The production of King and I frittered a perfect opportunity to have Anna rip one and have it ripple through her poofy dress. #TonyAwards,1433723325,patpowers,2,0,0,0,tweet
607704657310253056,That path led me to the ways of the Ripple.,1433723055,wzeppeli_en,0,0,0,0,tweet
607703607174037504,"Neku: Did you see that Magnemite earlier? The one bragging he has HP Dragon?
Ripple: Oh, no...not that guy...",1433722805,GummieAlien,0,0,0,0,tweet
607703092113625088,#Bitcoin#Litecoin or #ripple or #Dogecoin diversify to #Marinecoin #MTC today for %1000 profits Caren Agrios,1433722682,MTC_Marinecoin,0,0,0,0,tweet
607702713351208962,Water Ripple Effect by pete4725 on DeviantArt http://ift.tt/18LlLvY ,1433722592,peterelvidge,0,0,0,0,tweet
607702515598114816,Look--it's Samantha Ruiz! You don't see her right by the duck? #water #InvisibilityProblems #Ripple http://fb.me/3rondz9p0 ,1433722544,cidneyswanson,0,0,0,0,tweet
607700454684946432,NEW ARRIVAL // RIPPLE ASYMMETRICAL T-SHIRT http://ift.tt/1JBjQZm ,1433722053,theuncnvntional,0,0,0,0,tweet
607699866895192064,CTO Stefan Thomas (@justmoon@) will speak @NYTMagLive: Design & Technology event today in #SF. Tune in to @Ripple for live tweet!,1433721913,RippleLabs,3,0,5,0,tweet
607699831289745408,Watch gravity waves ripple through Earth?s atmosphere http://dragplus.com/post/id/30683217 ,1433721904,tech__agent,0,0,0,0,tweet
607699549730271232,"Remember there's no such thing as a small act of kindness. 
Every act creates a ripple with no logical end.
~... http://fb.me/3MnI3spPi ",1433721837,RiversInOcean,0,0,1,0,tweet
607698596452954112,Win a RIPPLE BLANKET!!! See our page for more info.,1433721610,obdesigns,0,0,0,0,tweet
607698591885488128,My banana soft serve (with peanut butter ripple) is melting!!! #nutribullet #bananasoftserve #pb2 #cashewmilk #nondpic.twitter.com/6v6qM4S0Zi,1433721609,NUTRiBULLETFans,1,0,0,0,tweet
615142615437197312,Ripple prints a perfect picture onto your latte http://popme.ch/6012BBUgK pic.twitter.com/3d1KoXjipY,1435496402,PopMech,13,1,11,0,tweet
615287074288205824,RFRA Ripple Effect now on WISH.,1435530844,shellawish,2,0,3,0,tweet
615286647500881920,Lovely pink ripple of cloud from Wright at 7am @TweetCanberra @visitcanberrapic.twitter.com/sj8xd0l025,1435530742,c_mperman,4,0,2,0,tweet
615279220416245760,Happiness has a ripple effect. #SeaRay #250SLXpic.twitter.com/QJSssuddLK,1435528972,SeaRayBoat,10,1,9,0,tweet
615263693870366721,Save the Date for our Indianapolis Walk on September 12 at Broad Ripple Park! #WalkwithUs http://bit.ly/IndyWalk15 ,1435525270,LupusResearch,5,0,5,0,tweet
615260978477989889,...and they're off. Broad Ripple rubber duck race. pic.twitter.com/n3q9UJJslo,1435524622,John_Tuohy,26,0,8,0,tweet
615240167259963392,"Come meet me! I'm the girl with the #selfiestick at the @Broad_Ripple duck race! 1,000 ducks go in the canal today! pic.twitter.com/BIUMEYX7vM",1435519661,CaraRAnthony,3,0,4,0,tweet
615234474310287366,"Thank you Xrp, The best station for the unsigned out there bar none ;-) https://twitter.com/XRPRadio/status/615233072536113153  <quoted_status>#nowplaying in #TAGGED #livenow #np on http://www.XRPRadio.co.uk   home of #unsigned & #independent #newmusic #radio #xrp @TheeAspiring</quoted_status>",1435518303,TheeAspiring,3,1,2,615233072536113153,quoted_retweet
615229787922145280,Corruption should attract the death penalty. The ripple effects of such actions lead to deaths that can never be accounted for. #CheckPoint,1435517186,SokoAnalyst,6,3,26,0,tweet
615218857968439296,"#PennZero Synopsis Of The Ripple Effect,Where Dragons Dare/ Rip-Penn pic.twitter.com/ESh1d1lOLu",1435514580,Chevistian1,9,0,2,0,tweet
615217313248354304,Saw this today Dahlia Edge of Joy - adding it to my grow list for next yr. looks like strawberry ripple ice-cream  pic.twitter.com/l6RoYaClwO,1435514212,Riggers779,13,1,1,0,tweet
615205321095688193,#Greece is on the verge of a total economic collapse. Not good for them and the ripple effect is still unknown. #GreeceCrisis,1435511353,drewwest_press,2,0,5,0,tweet
615196575619387392,"Grateful,thanks @genderlogindia @NiceMangos ""Ripple in still water / When there is no pebble tossed / Nor wind to follow..""~ Hunter/Garcia",1435509268,shirtysharath,2,1,2,0,tweet
615194247940014080,Being a T~Rex and making your coffee ripple is a great way to start a Sunday.,1435508713,awesomeJCtm,3,0,2,0,tweet
615168275819966464,My sister just told me that it was my mum who took the galaxy ripple out the packet then she sealed it back up omfg soz Galaxy,1435502520,heathertadman,7,1,1,0,tweet
615167473994829824,We're all ready to rock at Broad Ripple Park til 3pm. It's Girl's Rock! Portion of proceeds will be donated to an a pic.twitter.com/14Zt9IBnpx,1435502329,BeastTruckIndy,2,0,3,0,tweet
615159087056052224,The exhilarating ripple of her voice was a wild tonic in the rain.,1435500330,BookChat_,5,0,3,0,tweet
615147522143703041,"Tuesday 6-8pm is JMF night @AthleticAnnex in B Ripple- run from the store, discounts on merchandise, register for r July 11 race. RT plz",1435497572,JMF_IndyBest5K,3,0,3,0,tweet
615120143417503744,Ripple Dot Zero turns 2 years old today! We're celebrating by removing all in-game ads! http://www.rippledotzero.com pic.twitter.com/YW2GWzIKHx,1435491045,tommislav,7,2,9,0,tweet
615094694222151681,@woolwarehouse Here is my neat ripple by #attic24 made with 39 balls of your Sugar and Cream cotton.Just my 3rd make.pic.twitter.com/D6rXWvXbVw,1435484977,moto26261,4,1,1,0,tweet
615094490957770752,RBS Trials Ripple as Part of £3.5 Billion Tech Revamp http://coinde.sk/1FEVQyA  via @CoinDesk,1435484929,byte_shopper,2,0,1,0,tweet
615069382352334849,"I'll ruffle your ripple and snuffle ya sniffle, get a fat chick make u suck on her nipple, make a fat person shake all o dey ripples.....",1435478942,ItsLo__,1,0,2,0,tweet
615068434712256512,@hebehu @secondzeit wait a minute; d'ya say $11M? sounds like mcCully tomfoolery,1435478716,ben_ripple,2,0,0,615056025830330368,reply
615046706988625920,"*drags me into the aisle*
""look at this rogue carton of milk!!!! he doesn't go to there!!! HE'S A SPY""
@joshua_ripple pic.twitter.com/5MXthRs4WM",1435473536,pay10dollaz,11,0,2,0,tweet
615038846233878528,@brbrewpub @jquate1 And the Broad Ripple's ESB is still one of the best out there after all of these years.,1435471662,TheDumpBuckets,2,0,2,614867278157512704,reply
615022757626126336,"It is a perfect song, musically and lyrically. Hunter at his most brilliant. And Jerry RT @edubb2086 ripple is beautifully written",1435467826,RoobNBCS,5,1,0,615013598847455233,reply
615016604485746689,"Set 2 wish list: Casey Jones, Box of Rain, Sugaree, Ripple (Chicago?), Friend of the Devil, Brokedown Palace, Eyes, Dark Star #dead50 #gd50",1435466359,abbeserphos,2,0,0,0,tweet
615009253036666880,We will be at Broad Ripple Park tomorrow for the Girls Rock Event from 10-3..Come hang out and eat your Chef Dan favorites!!,1435464606,ChefDansIndy,2,0,3,0,tweet
615006462411051008,"This whole women complimenting other women idea could carry a nuclear ripple effect, resulting in a less neurotic American female.",1435463941,Mere_Death,14,3,6,0,tweet
615006163822903296,"Oh & though I've been working the past 15 hours, just wanted to shout out @BreeNewsome. May your ripple of inspiration reach those in need",1435463870,infinitespeech,2,1,0,0,tweet
614999421793792000,Storytelling on Social Media - The Ripple Effect http://bit.ly/1e7p978 pic.twitter.com/LSlZ8y178R,1435462262,allinsights,1,0,1,0,tweet
614993276119048192,@JohnnyFunkDJ never disappoints. @Lizard__Lounge,1435460797,Ripple_Rick,3,0,1,0,tweet
614969908452048896,"Looks like Ripple that's gone flat. In fact they should call it flapple.

#FredSanford
#SanfordAndSonpic.twitter.com/CumTgcC3Ye",1435455226,IslanderNation,7,2,2,0,tweet
614961420615176192,"Lemon Drizzle Raspberry Ripple Cake 
An easy, soft and great tasting cake, perfect with a cup of tea! 
Recipe... http://fb.me/7a6vSaM5J ",1435453202,lovefoodies,1,0,1,0,tweet
614955660556435456,"Thunder is loud and it rumbles, like crashing waves against rocks. 
Lightning is either a clap or a silent ripple 
just so you ppl know",1435451829,smokingroovy,3,0,0,0,tweet
614954929816530944,@Bitcoin_Moxy #VeriCoin solved this problem when they implemented PoST (Proof-of-Stake-Time).  #VRC #SuperNET #DOGE #DASH #XRP #PPC #NXT,1435451655,Too_Astute,2,0,1,614951270542127104,reply
614953813221482496,Special thanks to XRP Radio for your recent support! @XRPRadio http://www.xrpradio.co.uk/  Support indie!!!pic.twitter.com/6NtSgEMM8m,1435451389,goevolutionband,1,0,1,0,tweet
614950717896290304,Got out of the shower and was transfixed by the mirror as a single tiny movement caused a slow head to toe fat ripple.,1435450651,8989belinda,22,0,18,0,tweet
614947075361513473,"""..they find the simple sight of a ripple of water or rising of the sun to be more exquisite than any beautiful antique or lovely painting.""",1435449782,CelestiaIUnity,1,0,1,0,tweet
614946360148787202,Nah cant beat a galaxy ripple ,1435449612,Jamieleighvicc,6,0,0,0,tweet
608543630878330880,Ted: The littlest thing can cause a ripple effect that changes your life.,1433923082,TheHIMYMQuotes,229,3,251,0,tweet
608449456636354562,"Sometimes, the smallest actions can ripple through the soul and have a profound impact on someone",1433900629,flowerrfull,260,2,259,0,tweet
608633508110680065,That big story being whispered that will have ripple effects throughout wrestling is apparently on the verge of breaking.,1433944510,voiceswrestling,6,7,8,0,tweet
608780092072812544,I-5 SB OPEN again... but ripple effect still has The City GRIDLOCKED in many places. #pdxtraffic #Liveonk2pic.twitter.com/z9GHPJjRej,1433979459,MichaelRConvery,1,2,4,0,tweet
608778250039349248,"""What we offer in incredibly attractive to corporate treasuries. Not just as a tech vendor, but as a marketplace.' Patrick Griffin",1433979020,Ripple,4,0,7,0,tweet
608777734257401856,"""This concept is very academic, but the important thing is the bottom line. Our partners see an opportunity to reduce their float."" Griffin",1433978897,Ripple,2,0,5,0,tweet
608777271709564928,"""As a business and as a value proposition, we are very interested in corporate payments."" @RippleLabs EVP of BD, Patrick Griffin",1433978786,Ripple,2,0,6,0,tweet
608761928970850304,"Together we've generated the ripple, and now the movement begins #MTOP2015pic.twitter.com/Mcqz30WKIs",1433975128,theDiff_Tom,5,0,4,0,tweet
608750255610408960,"Craig wishart feels bad calling me a cripple so he calls me a ""raspberry ripple"" boys a mess",1433972345,jessicatrant7,9,0,0,0,tweet
608737823277981696,Connect. Learn. Grow. Twitter transforms PD & causes a ripple effect in education. #tepsa15 #tlap pic.twitter.com/SyKRMf2T4q,1433969381,steph_frosch,6,0,4,0,tweet
608718310885236737,@KateSlater2 @johnwalsh88 @NorthSn @fidgetfairy @CarolLRead @catmichelle76 @enduringdelight noted: how we present outwardly + ripple effect,1433964729,DomCushnan,5,2,4,608715816754933761,reply
608715213794201600,"I secured an internship at Ripple Grove Press (@RGrovePress), a children's book publishing company, this fall. I'm thrilled! #publishing",1433963991,Kellie_Doherty,4,0,1,0,tweet
608705444526366722,Positive individual changes ripple to culture change. It starts with a smile. @shawnachor @thesarahhagan @bcschwartz #WorkHuman,1433961661,thistweety,3,0,6,0,tweet
608652821265682432,"Hello !  MJGlobal fam -Every morning Mr, Man just waitng for us to ripple out his truth . #MichaelJackson #MJfampic.twitter.com/NEq9BuodOE",1433949115,MJJJusticePrjct,6,3,4,0,tweet
608649717506056192,"Before you play football, picture you at your best...add a feeling of freedom in your feet, and let confidence ripple through your legs...",1433948375,DanAbrahams77,32,0,12,0,tweet
608625607677595648,"Simple acts of #kindness have #ripple effects in society. Become more #conscious of how U 
show up in others' lives.pic.twitter.com/xzlgJ5c20b",1433942627,dharammegha,9,0,6,0,tweet
608621446194167810,"Ahh the memories with the wet paper of the sherbet, the mouth watering Opal Fruits & the crisp ripple paper Marathon. pic.twitter.com/g1ubeXfqM1",1433941635,IL0VEthe80s,34,2,27,0,tweet
608607400027910144,Great to see @currency_cloud @yoyowallet @transferwise @ripple @azimomoney: Young FinTech Startups To Watch - http://letstalkpayments.com/50-young-fintech-startups-to-watch-out-for/13205  #fintech,1433938286,SteveLemon2,5,0,4,0,tweet
608597268338487296,"Asset-backed or non asset digital currencies? Stan Stalnaker, Hub Culture explains differences Ben/Bitcoin/ripple pic.twitter.com/K5hDaLghHS",1433935870,Capco,2,1,2,0,tweet
608592243813965824,Tiffy is getting in touch with @DonkeySanctuary @LeedsDonkeys to talk about how we can help out. Here's Ripple! pic.twitter.com/w2MMCGYAFB,1433934672,WetnoseDay,5,0,6,0,tweet
608590574120251392,HAPPY BDAY TO @kwakuzee MR RIPPLE EFFECT https://instagram.com/p/3vw0NGulTH/ ,1433934274,DJMENSAH1,3,0,4,0,tweet
608589041085378561,What the Fox Learnt - Ripple Digital Publishing | http://buff.ly/1SYOIYb  | Children's Fiction #free #ebook #freebookpic.twitter.com/jr2rn9Bpgm,1433933909,janinebucks,2,0,3,0,tweet
608558378948939776,"#NoNames LIVE from Paisley, SCOTLAND. XRP without doubt the BEST interactive internet station on the planet. #indiemusic",1433926598,DaveyXRP,1,0,2,0,tweet
608543630878330880,Ted: The littlest thing can cause a ripple effect that changes your life.,1433923082,TheHIMYMQuotes,229,3,251,0,tweet
