ID,Tweet,Time,User,Likes,Replies,Retweet,in_response_to,response_type
755964647300366336,blocked. blocked. blocked. none of you are free of doge,1469070991,TumblrSimulator,106,0,105,0,reply
756253627493167104,True love is when your doge eats a big off your leg cause ur to scared to touch it ,1469139889,emilyy_jacksonx,5,1,0,0,reply
756238255616565248,My doge only has one ball but produced 10 pups that's wild.,1469136225,RUready4Freddy,7,0,0,0,reply
756203654902788105,Why I Sold All My #Bitcoin: I sold my bitcoin and #dogecoin for a better #cryptocurrency http://dlvr.it/Lrm565 pic.twitter.com/B1SLJXaiQ9,1469127975,bitcointonic,2,0,6,0,reply
756202610957352960,last walk o the day: get to apartment and the doge is not here. now i'm just hanging out w this cat named Jack pic.twitter.com/nmNvJnK7rk,1469127726,gobbinjr420,5,1,0,0,reply
,,,dogecoin,0,0,0,,tweet
756200182409105412,"thanks!  wow!  may open much long on polo cuz yolo @andyypants @bitcoinbegger @pinguino
$doge #dogecoin",1469127147,jmgranola,3,0,3,756197154943799296,reply
756197194936487936,"yup. who knows, we all might be using doge in space someday",1469126435,barrysilbert,6,1,0,756182104866566144,reply
756197154943799296,@jmgranola @bitcoinbegger @pinguino #dogecoin is hitting an epic low. I predict a short accumulation then massive rebound. buy is my advice!,1469126425,andyypants,4,2,1,0,reply
756191983245352960,TB to when I would dress up my doge and make her do my Latin homework lmfao pic.twitter.com/dj7wRDcOmb,1469125192,fckkk_boy,17,0,0,0,reply
756177626469920768,If my doge could use a phone I'd have like 69txts & 23missed calls before I got down the street,1469121769,seltiva,20,0,1,0,reply
756175954012241920,"Learn how to Shop at Amazon with #ethereum, #litecoin or even #dogecoin: https://www.youtube.com/watch?v=DXrHvG0KwWg … @ShapeShift_iopic.twitter.com/TfrV8A4A3R",1469121371,PurseIO,5,0,8,0,reply
756175566538153984,When Doge takes a sharp turn right https://twitter.com/IngrahamAngle/status/756088689449693185 … <quoted_status> We tried to help and warn Ted Cruz. Very sad. Such brainpower. Such a shame.</quoted_status>,1469121278,aNuChallenger,14,0,4,756088689449693185,quoted_retweet
756158944624664576,"shibe very jealous
   omg want go #SDCC2016 too!

 doge b ROCKIN' COSPLAYER! pic.twitter.com/YtiQhHXNww",1469117315,Dogebrarian,13,0,3,0,reply
756150453746831360,Lol doge quality control hologram! Such pass! Many testings! Wow! pic.twitter.com/xUrS4HrVzj,1469115291,tigg,3,0,2,0,reply
756150375988752384,Work doge is now on lap  pic.twitter.com/k9QlrMThHZ,1469115272,inspectorbeans,10,1,0,0,reply
756146132644921345,Another group photo from last furwalk and @chutkajou taking the pics and her little doge pic.twitter.com/Hbdt3bgCyC,1469114261,DatBlueHusky,8,2,3,0,reply
756128003688628225,When your doge falls in the pool and he hates water Hahahaha pic.twitter.com/lbR0Uuq9sO,1469109938,IAmLexieA,20,0,3,0,reply
756110752684146689,"Bitwala Announces Global Transfers For Ether, Litecoin, Dogecoin And Dash https://www.cryptocoinsnews.com/bitwala-announces-cheapest-global-transfers-for-ether-litecoin-dogecoin-and-dash/ …pic.twitter.com/0lcsEcIhOx",1469105825,CryptoCoinsNews,2,0,6,0,reply
756094943752495104,Hard-forking a currency to put money in the right accounts means #Ethereum is now more of a joke than #Dogecoin ever was.,1469102056,mkomaransky,21,2,10,0,reply
755990788538966017,The only way to describe @kelsey_lauren1 and I's relationship is the fact that we just argued about how to say Doge right for 5 minutes,1469077224,JyKackson,6,0,0,0,reply
755989485574197249,Sleeeep doge pic.twitter.com/4g9PXZRzuC,1469076913,killMadison,9,0,1,0,reply
755987442830745601,"First there was Bitcoin.

Then doge.

Then Dogecoin.  

Now there's Pokémon Go... and Trump

Excited for the coming Trump Go.",1469076426,mattmoehr,0,1,1,0,reply
755987289981845504,Goodnight from me and the doge!! pic.twitter.com/HP2LCpJcFY,1469076390,MTGtweets,6,3,0,0,reply
755985398896037888,i love doges this doge on the other hand did not love me pic.twitter.com/5OSBsjXQ70,1469075939,LysherRyan,11,0,0,0,reply
755982620241059840,why fight kaiju when you can commit petty theftpic.twitter.com/980GnlXu8m,1469075276,doge_king,4,2,0,0,reply
755976716967825409,love my doge pic.twitter.com/VsuaW78uDJ,1469073869,yungxsacrifice,5,0,0,0,reply
755976352424005632,missing my doge right now:(( pic.twitter.com/oN5hbL938R,1469073782,andrewball___,8,0,0,0,reply
755975850600697856,Current approx. value of 1M DOGE in USD: $238.6116 values from vircurex + coinbase at 07/20/16 23:55 #dogecoin,1469073662,dogecointicker,2,0,0,0,reply
755972950436749312,@Sydney_Doge is my personal photographer  pic.twitter.com/bFITjt2KYt,1469072971,_daniellee3,9,1,2,0,reply
755971702928969728,Mikey is a majestic doge,1469072673,snholzbach,13,0,3,755971132986187776,reply
755964647300366336,blocked. blocked. blocked. none of you are free of doge,1469070991,TumblrSimulator,106,0,105,0,reply
755950168466423808,all the best #freebitcoin #dogecoin and #ethereum sites in one place ! #getrich #makemoney #earncash today! goto :http://page.is/earn-freestuff ,1469067539,earn_freestuff,1,0,1,0,reply
755937020602646528,Never before has a commentary team made me smile as much as @WWEDanielBryan & @mauroranallo #CWC,1469064404,doctor_doge,1,1,3,0,reply
755935108683751424,My future doge pic.twitter.com/aQ5gJFE7Sa,1469063949,Reynohz,8,0,0,0,reply
755933395620737025,"Just remembered we got my doge puppy mints, I'm gonna go feed him 20?",1469063540,laura_miksch,2,0,0,0,reply
755933254662942720,Vote for us on http://FreeCrypto.co  http://ift.tt/1Rgwb7E  #dogecoin keep voting thanks #Bitcoin #dogecoin #veg… http://cur.lv/qp5ej ,1469063507,CryptocrawlLV,2,0,0,0,reply
755928681554513920,ASHITOON IS. SO SASSY IM DOGE https://twitter.com/kttenmgc/status/755927949128368128 … <quoted_status> iM SCREAMJNGGGGG  https://twitter.com/colorslrh/status/755927821407617024 …</quoted_status>,1469062416,silkcherrypie,2,0,1,755927949128368128,quoted_retweet
755918930972057600,doge and doug pic.twitter.com/1F92NyyVKO,1469060092,lindseehowe_,54,0,4,0,reply
755915425267974144,"Distortbot turned my doge into a lion (?)
It knows me so well pic.twitter.com/rhCnJ35NJP",1469059256,pencillion,5,0,0,0,reply
755915198867922946,#Bitcoin#Litecoin or #ripple or #Dogecoin diversify to #Marinecoin #MTC today for %1000 profits Tamie Aurora,1469059202,MTC_Marinecoin,1,0,0,0,reply
755915197840183296,Current value of DOGE in BTC: Vircurex: 0.00000036 -- Volume: 1886940.0 Today's trend: down at 07/20/16 19:55,1469059202,dogecointicker,1,0,0,0,reply
749255903480799232,Cooking with doge pic.twitter.com/5CyO8yMEmj,1467471502,BlackHalt,24,0,17,0,reply
749061535146864640,Doge fall asleep on boob pic.twitter.com/PvuCQnbS8L,1467425161,kennabbby,337,3,51,748634799925927936,reply
749264528697950208,DOGE R U OK ???  pic.twitter.com/36m9DpFM6G,1467473558,MrRoflWaffles,727,25,78,0,reply
749371215031128065,The holidays that let you legally blow shit up are always the best.,1467498994,dirty_doge_,3,0,0,0,reply
749232112377573376,Some Ych icons i did tonight.pic.twitter.com/Xd1prrR9p5,1467465830,tired_doge,0,0,1,0,reply
,,,dogecoin,0,0,0,,tweet
749378440026005505,Currently crying bc someone in my photography class photoshopped doge onto the moon and I can't handle this pic.twitter.com/MXL3sdPylz,1467500717,HofmannAmanda,9,0,0,0,reply
749372579773755392,Do you and your family have a few moments to read this pamphlet about there being no God,1467499320,mockndroll,2,1,1,749355526358786048,reply
749361266012090368,"Atheism=fastest growing religion; been linked to recent rise in Nazismhttps://twitter.com/AtheismIsALie/status/714265771719974912 … <quoted_status> POLL: What is your religion?

Sorry for ones left out, only 4 slots so putting the 4 most popular religions

Thanks</quoted_status>",1467496622,Goon_Boy,1,2,2,713607082180755456,quoted_retweet
749359436116824064,Sparty the Doge deserves better tbh,1467496186,Vistox,15,3,0,0,reply
749352625930371073,When u a deer disguised as a doge pic.twitter.com/valcWLa4LX,1467494562,KatraHigher,11,1,1,0,reply
749351434227949570,i cut off the sleeves of my doge shirt pic.twitter.com/rOIU4OglRP,1467494278,hoodietoons,6,1,0,0,reply
749351222633717760,#Dogecoin Dogecoin is better than Bitcoin. Dogecoin alone has a crucial tech innovation that will allow it to... http://cur.lv/104hpm ,1467494228,julia_vaingurt,3,0,2,0,reply
749334722787078144,"#blimeycowphotoaday
Doge have very friendly face pic.twitter.com/sI6RB7DWRp",1467490294,daJoezenOne,7,0,0,0,reply
749332065309626368,Find someone who looks at you the way my dog looks at her ball #doge pic.twitter.com/7Cm528IlJ2,1467489660,NelmaSeamus,16,0,1,0,reply
749328654224662528,"Hbd to my fellow doge lover, wouldn't want to share alternate gold with anyone else  
Have a good one babe! pic.twitter.com/gtQFHtnjIS",1467488847,Lindecent,3,1,1,0,reply
749311573982900224,There is doge eating ice cubes. pic.twitter.com/2cnDTSdBRQ,1467484775,krazyfrog,5,2,1,0,reply
749304627691134976,Spamming doge but I'm so happy he's home!!! pic.twitter.com/BSlHCDmaKg,1467483119,caralaurynm,13,0,1,0,reply
749262831342620673,@TinaDayton @RayNarvaezJr nice doge. Nice Team Tina meetup yesterday! pic.twitter.com/apVA4HX7pv,1467473154,AH_DoctorSwag,167,0,7,0,reply
749252825897664516,Here's the only way to see Venice's Doge's Palace without the crowds. #takewalks http://bit.ly/29onz1d  #Italypic.twitter.com/znH6zIPwou,1467470768,Walks,7,0,0,0,reply
749250283339935744,"*doge runs out front door of hotel towards AC, dragging bag twice his size*

bark *drag* bark *drag* bark *drag* bark *drag*",1467470162,raththomas,5,0,0,0,reply
749245548251582464,I have seven Armada scarves but I'm still going to take @Doge_9o4 scarf,1467469033,ItsLogie,3,1,1,0,reply
749230753796460544,Im Soff just went 12/0/8 as AP DOGE on Summoner's Rift #LeagueOfLegends http://matchhistory.euw.leagueoflegends.com/en/#match-details/EUW1/2738699169/39029815?tab=overview …,1467465506,ImSoff_,7,3,0,0,reply
749221902829445120,Doge adventures pic.twitter.com/qfstjl6aod,1467463396,RINNE_AND_CO,21,1,6,0,reply
749218639056863232,"Day two of Hash's Bash 2.0 brings you even more freebies, fresh deals, and not so fresh memes!!! But really, doge... http://fb.me/8fQYs9tJq ",1467462618,mcmullenwrites,5,0,3,0,reply
749199660229754880,"I know I sit in my house everyday wanking over memes, but I have no regret.",1467458093,Typical_Doge,2,0,0,749199428288933888,reply
749192229231681536,"Yeah #marchforeurope Goldman Sachs, JP Morgan, the impoverishment of Africa and debt slavery for Greece. Because it's trendy.",1467456321,decent_doge,8,0,6,0,reply
749172398587465728,I tried to pet a doge today and he bit me :///,1467451593,Fuck_Gandalf,5,1,0,0,reply
749166789536387072,"Doge heard me talking about punching a botnet, he's happy with this. pic.twitter.com/rcdCibRmRe",1467450256,sudosev,11,0,0,0,reply
749136601234583553,1st of each month should be declared as the rent-kab-doge-day of the month.,1467443058,abhijix,9,0,19,0,reply
749127803099049988,My dogecoin went to a different address via /r/dogecoin http://ift.tt/29abj2w ,1467440961,RedditDogecoin,1,0,2,0,reply
749119978390061056,"Unlimited Free Bitcoin, Litecoin,Dogecoin,Peercoin,Dash Coin  Earn

http://videonetwork-x.blogspot.in/2016/07/unlimited-free-bitcoin.html …",1467439095,tnews_world,1,0,2,0,reply
749085928359026689,This doge is done with our shenanigans pic.twitter.com/hSI41GZSIP,1467430977,Jade_Lewis2017,9,0,0,0,reply
749075179196653568,Democracy doge 1  #democracydog #AusVotespic.twitter.com/1JqTqGo3He,1467428414,WillPJK,4,0,1,0,reply
749071640873537536,My sweet Frank has a very big tumor. Right now it's not looking good. Please keep my lovely doge in your thoughts pic.twitter.com/oKCdrY5AEi,1467427570,sassywhiteteen,74,2,0,0,reply
749062595831705601,I Petted thy Hallowed Doge pic.twitter.com/EXZ6vRyNeV,1467425414,feeshseagullsyo,11,0,0,0,reply
749061535146864640,Doge fall asleep on boob pic.twitter.com/PvuCQnbS8L,1467425161,kennabbby,337,3,51,748634799925927936,reply
749060552765370368,"Our ability to balance and be flexible, to anticipate, to doge and weave when needed, it's all part of... pic.twitter.com/rWOT424WLR",1467424927,CarmelJoyBaird,14,1,1,0,reply
749046428144574464,"FortuneJack Launches LuckyJack, a Brand New Bitcoin Casino Game - Yahoo Finance http://bit.ly/29iBGGr  #dogecoin",1467421559,140Dogecoin,1,0,2,0,reply
749037527571443713,doge pic.twitter.com/pz3KfjCLbw,1467419437,losersmcu,4,0,1,749035772402081792,reply
749031546808446980,"3.5 k swim, off for two bridges walk with bride and doge - and vote, see a friend and her babbe & party like its 1969 - happy Election Day ",1467418011,marcuskelson,4,0,0,0,reply
749031364528398336,pic.twitter.com/7LPKVFGujq,1467417968,Doge_shepard,0,0,0,0,reply
749031162840920064,Walking my doge,1467417920,brandeluna,0,0,0,0,reply
749030945706041345,love this game otherwise tho just sayin guise,1467417868,Voltosaurus,1,0,0,749027734840418304,reply
749030935505489920,wow dude you need some milk,1467417866,The_Chosen_Doge,0,0,0,749027734840418304,reply
749030764897923072,like honestly I'd rather play LOL comp. and that legitimately makes me wanna cut my cock off,1467417825,Voltosaurus,2,2,0,749027734840418304,reply
749030360936316928,"yeah, I know. ;-)",1467417729,decent_doge,0,0,0,749021161548312576,reply
749030079972331520,Current approx. value of 1M DOGE in USD: $271.336 values from vircurex + coinbase at 07/01/16 19:55 #dogecoin,1467417662,dogecointicker,1,0,0,0,reply
749030029049339905,What do #Lexit think of #AndreaLeadsom who likes exposing JP Morgan deliberate role in causing 2008 crisis?,1467417649,decent_doge,1,0,1,0,reply
749030024523591680,"Dogecoin - DOGE
Price: $0.000302051
Change in 1h: -0.03%
Market cap: $31711908.0
Ranking: 10
#Dogecoin #DOGE",1467417648,coinstats,0,0,0,0,reply
749029919443726336,waiting for @ESPN to post a tsunami picture when someone gets rolled in football this year,1467417623,soju_warrior,0,0,0,749020770488053760,reply
749029854574698496,"Saath Agar Doge Muskrayenge
Zarur, Pyar Agar Dil Se
Karoge To Nibhayen  - Read full Sms on http://smsforum.co.in/thread-33916.html … #jokes #love #shayari",1467417608,SMS_Forum,0,0,0,0,reply
749029826938363905,Current value of DOGE in BTC: Vircurex: 0.0000004 -- Volume: 63456.72844503 Today's trend: down at 07/01/16 19:55,1467417601,dogecointicker,1,0,0,0,reply
753105257509560320,"In this house,
We do Pepe
We do doge
We do shrek
We do the bee movie
We do Guy Fieri
We do dat boi...
In this house,
We do dank memes.",1468389260,awkwardlylauren,131,7,26,0,reply
753202236986052608,Because doge. pic.twitter.com/n2xJt8VX5M,1468412381,CeejAgudelo,15,8,0,0,reply
753371050528894977,"Got a few popsicles for tonight's stream. Not for doge, all mine. pic.twitter.com/NaWtPwkfVo",1468452630,Kripparrian,919,65,110,0,reply
753053333074477056,doge ~ pic.twitter.com/NRQ5TbVBQf,1468376880,ChewedMarkers,29,3,2,0,reply
753266963191738368,we doge now,1468427813,oxalispescaprae,20,3,2,0,reply
,,,dogecoin,0,0,0,,tweet
753306713533640704,Doge Bizarre Adventure pic.twitter.com/qfmb740r3V,1468437290,VongolaaFamily,67,4,119,0,reply
753124924865347584,Just because it comes in an orange bottle with a label on it doesn't mean it's all cool.,1468393949,dirty_doge_,3,0,1,0,reply
753280440513863680,Woooo #WildlifeWednesday ! Some random AC shots of curl doge  pic.twitter.com/MDrpb4ZqT4,1468431026,SchecterWolfe,70,1,7,0,reply
753091312090570752,Ahahahahahahahaha poor doge pic.twitter.com/x2FrVrF2jv,1468385935,feministlady,24,0,13,0,reply
753225833603444736,Good morning. Doge pictures will be up in 4 hours <3,1468418007,RealKraftyy,105,9,3,0,reply
753106729383124993,I might fuck around and wear all doge to warped,1468389610,Flyh_,12,0,0,0,reply
753075570901221376,Doge pic.twitter.com/ja8nfVgVfp,1468382182,adam_trimper,16,0,0,0,reply
753127769937182721,Me and doge bout to watch some anime and pass out  pic.twitter.com/eVptVTvIXU,1468394627,Rozoken,21,5,0,0,reply
753052489734299648,"My squad broken, top doge pika #52 pic.twitter.com/mTug3OHjMw",1468376679,Trick2g,151,12,20,0,reply
753364993882648576,I got a doge backpack and I'm so :))))!!,1468451186,cokexqueen,4,0,0,0,reply
753362376334925825,Here's the only way to see Venice's Doge's Palace without the crowds. #takewalks http://bit.ly/29w49t2  #Italypic.twitter.com/06Y2YSEjTI,1468450561,Walks,9,0,8,0,reply
753359129456947200,"E - Elphias Doge 
M - Mia Thermopolis 
I - Isabelle Lightwood
L - Luke Skywalker 
Y - Ygritte from GoT pic.twitter.com/ghF4cfZqaj",1468449787,emilyjmead,9,3,0,0,reply
753355154280312832,"Hollidays r pretty boring rn, but guarantee as soon as I go away on Holliday I'll miss 17 gaffs, 8 fights, a fire , and my doge will be deid",1468448840,Ewannn_B_,49,0,11,0,reply
753353179232804865,my legit reaction every time i see a dog caught by @andrewrose_ if you look closely you can see doge in the window pic.twitter.com/qESJtt7Oxw,1468448369,kianamichellee,31,1,1,0,reply
753327115832025088,Doge tried to stay up for the entirety of @WKCRjazz's Ayler broadcast. Couldn't quite make it.pic.twitter.com/fVVjeMcA73,1468442155,frozenreeds,15,1,0,0,reply
753306713533640704,Doge Bizarre Adventure pic.twitter.com/qfmb740r3V,1468437290,VongolaaFamily,67,4,119,0,reply
753280440513863680,Woooo #WildlifeWednesday ! Some random AC shots of curl doge  pic.twitter.com/MDrpb4ZqT4,1468431026,SchecterWolfe,70,1,7,0,reply
753268252889976832, Doge Weather Card SVG Animation - Dribbble inspired http://codepen.io/wintr/pen/GqOBQZ …,1468428121,HotOnCodePen,3,0,2,0,reply
753266963191738368,we doge now,1468427813,oxalispescaprae,20,3,2,0,reply
753261740696023042,"omg Doge B unbelivings 
a Senate hold???
 pls tell very elected officials to pressure GOP, confirm Dr. Hayden! pic.twitter.com/N6gynShsLz",1468426568,Dogebrarian,13,0,9,0,reply
753225833603444736,Good morning. Doge pictures will be up in 4 hours <3,1468418007,RealKraftyy,105,9,3,0,reply
753202236986052608,Because doge. pic.twitter.com/n2xJt8VX5M,1468412381,CeejAgudelo,15,8,0,0,reply
753154607531036674,Cloudy with a chance of Doge - Night View –  User interface by @minhbeardy http://www.uplabs.com/posts/cloudy-with-a-chance-of-doge-night-view …pic.twitter.com/Tr9ncpCqqW,1468401026,_SITEUP_,17,1,5,0,reply
753127769937182721,Me and doge bout to watch some anime and pass out  pic.twitter.com/eVptVTvIXU,1468394627,Rozoken,21,5,0,0,reply
753105257509560320,"In this house,
We do Pepe
We do doge
We do shrek
We do the bee movie
We do Guy Fieri
We do dat boi...
In this house,
We do dank memes.",1468389260,awkwardlylauren,131,7,26,0,reply
753093426548211712,"Welp, Fizz Doge just demonstrated that she knows how to open the gajillion dollar gate we had built to keep her in the yard.",1468386439,andreagrimes,30,6,0,0,reply
753093286588456960,"i've said ""wow"" quite a lot today, what am i, doge? i should at least switch it up with ""whoa"" or smth",1468386405,realztao,11,0,0,0,reply
753091312090570752,Ahahahahahahahaha poor doge pic.twitter.com/x2FrVrF2jv,1468385935,feministlady,24,0,13,0,reply
753085077064679425,Doge person,1468384448,HalleyKenney,15,1,0,0,reply
753082370400591873,Smoking with my doge is my second favorite hobby,1468383803,twells1219,9,0,0,0,reply
753075570901221376,Doge pic.twitter.com/ja8nfVgVfp,1468382182,adam_trimper,16,0,0,0,reply
753063342973984768,valor doge pooped out from hunting pic.twitter.com/hqhLgvDEd3,1468379266,hakuku,27,1,3,0,reply
753053333074477056,doge ~ pic.twitter.com/NRQ5TbVBQf,1468376880,ChewedMarkers,29,3,2,0,reply
753052489734299648,"My squad broken, top doge pika #52 pic.twitter.com/mTug3OHjMw",1468376679,Trick2g,151,12,20,0,reply
753027297788125184,"you know its 2016 when u go out and see a girl wearing 3d movie glasses with the lenses popped out, a doge shirt, and playing pokémon go",1468370673,YourPrincessLoL,20,0,0,0,reply
753026136225882112,no I'm talking bout stevies doge,1468370396,Rollingstoned47,1,0,0,753023923374043136,reply
753025959989645312,This is doge pic.twitter.com/hvKh2mvGhU,1468370354,SUZYUOX,1,0,2,0,reply
753025909368557568,"♤ 100000 Dogecoin  (100K 100,000 Doge) - Direct to your Wallet http://ebay.to/1rb4ia8 pic.twitter.com/WAKkdN8cJb",1468370341,bitcoin_dealer,0,0,0,0,reply
753025756620464128,who is doge,1468370305,sehunqca,1,1,0,0,reply
753025480052191232,Miyaya@ Funny Doge Dog Animal Head Mask for Mask Festival?halloween?easter or http://dlvr.it/LnLCdf pic.twitter.com/wtMnOfGN1y,1468370239,BuyClothingShoe,0,0,0,0,reply
753024001010786305,Doge,1468369887,ValouFTh,2,1,0,753002630620844032,reply
753023903874768896,1 DOGE Price: Bter 0.00000040 BTC #doge #dogecoin 2016-07-12 20:31 pic.twitter.com/KH6p0oc2aY,1468369863,coinok,0,0,1,0,reply
753023649918099457,I just realized you American fuckholes have no idea what these are. These little pieces of heaven are called doge this is fine,1468369803,TumblrSimulator,2,1,0,753020374951071744,reply
753021222737305600,"Visit top payout #faucet http://BoxDoge.co.in/  Claim every 10 minutes, prizes: 0.05 - 2400 #doge coins",1468369224,LandBitcoin,0,0,0,0,reply
753020896047050752,minghao: I don't know a jun [doge emoticon] [doge emoticon] [doge emoticon],1468369146,wonnhao,1,0,1,0,reply
753018931829497856,that's exactly what I thought. It sounds just like em,1468368678,samirows,1,0,0,753014982854512641,reply
753018680863260673,I'm 90% sure that's old Citta battler.,1468368618,doge_king,2,2,0,753014982854512641,reply
753018615431999488,Redeem DOGE for Free! Scan the QR code below http://coinok.pw  #doge #dogecoin #faucet 2016-07-12 20:10pic.twitter.com/j2y7THw94h,1468368602,coinok,0,0,1,0,reply
753017563680944128,Agreed ayy lmao woof germae shepper sheppre sheppre good day to be a ruff time fudk doge im not steal you? #OpenRP,1468368352,bump_png,0,0,0,0,reply
753017095034662912,That Taco Doge one is worth whatever you paid for it,1468368240,mnisnis,1,0,0,753007094215958528,reply
753016609476935682,That'll be five bucks.,1468368124,Skreequency,1,0,0,753010932020805633,reply
753016347294965760,Current approx. value of 1M DOGE in USD: $266.084 values from vircurex + coinbase at 07/12/16 19:55 #dogecoin,1468368062,dogecointicker,0,0,0,0,reply
753016156135587841,"#gameofdoge #tshirt and more
http://buff.ly/29LPRpl 
#doge #meme #got #gameofthrones #jonsnow #tvtag #demthronespic.twitter.com/mvklPESDqi",1468368016,jonsnowsfan,1,0,0,0,reply
753016094437232640,Current value of DOGE in BTC: Vircurex: 0.0000004 -- Volume: 48339.0457918 Today's trend: down at 07/12/16 19:55,1468368001,dogecointicker,0,0,0,0,reply
749824957262225408,I have steep stairs in my condo. Took my little doge half a day to learn to go up and down. Some cs pros still don't know mirage smokes,1467607175,JoshNissan,996,26,187,0,reply
750005098726567936,happy fourth from me and doge :) pic.twitter.com/6swa8LhtZZ,1467650124,maciebement,38,1,7,0,reply
750087960037588993,Happy birthday to the cutest lil doge in the whole world! 6 years old today!  pic.twitter.com/JoP58jyds4,1467669880,aquaxkitty,23,2,1,0,reply
750073073739571200,"HOLY SHIT TOMORROW MEANS LANE BOY AND KITCHEN SINK AND HEATHENS AND SUDDENLYY I AM LAYING ON THE FLOOR.
DOGE IS V EXCITED TOO",1467666331,907bis,35,3,1,0,reply
750069498326110208,Grave is a Doge confirmed. pic.twitter.com/AeAn53G9aE,1467665478,AcolyteAE,6,1,2,0,reply
,,,dogecoin,0,0,0,,tweet
750067972455018497,Kelly's breaking up with Corey because he's never heard of the Doge meme; you heard it here first,1467665114,KT_Wohlford,10,1,1,0,reply
750040754781904896,Here's the only way to see Venice's Doge's Palace without the crowds. #takewalks http://bit.ly/29iYCDp  #Italypic.twitter.com/qC9K1UYrjP,1467658625,Walks,8,0,3,0,reply
750021414242115585,"32 days till @OrlandoCountySC ,@KevinIsHistory ,@ItsLogie ,@Doge_9o4 ,@OlindoFL and I all  over the Championshiphttps://twitter.com/efl/status/749964235338346496 … <quoted_status> Counting down the days... 

#EFLKickOff pic.twitter.com/9EUVMkM0hC</quoted_status>",1467654014,Rays1299,6,3,2,749964235338346496,quoted_retweet
750020742503432192,"Gf- Mere Bday Par Kya Doge?
Bf- Diamond Ring & Gold Necklace
Gf-Wow Lv U.Kya Karte Ho Tum?

Bf-I Am AAP Volunteer

#SheBlocked
#आप_के_धोखे",1467653854,BATOLEBAZI,13,0,15,0,reply
750017073984708608,The moment when you realise you love Doge so much that your colleague buys you a Doge pillowcase. Merci @Jeremlgtpic.twitter.com/36S2viON82,1467652979,monsieurwillie,5,0,1,0,reply
750000031013437440,Best Of Doge Memes http://bit.ly/1Le1wcr pic.twitter.com/CwiLjsEB9r,1467648916,CatsLoveSpace,6,0,9,0,reply
749994686643777538,"doge b neighboring
 O M G already starts worksfire
   shibe no like kabooming
don't care pretty
   hide here all day pic.twitter.com/HgglgcZnpI",1467647642,Dogebrarian,8,1,5,0,reply
749981596950732800,I thought BB-8 was a toy for my doge buT ITS A DANG HEADBAND LOL---!!!! pic.twitter.com/NcrlGDilez,1467644521,YNJTB,21,0,0,0,reply
749976400816377856,Just a doge and his ball pic.twitter.com/OCfJPiQI8m,1467643282,KayleighWolf1,12,0,0,0,reply
749957115813519361,There is a doge next to me and she's sad her owner is in a meeting #saddogepic.twitter.com/JsGqoumCq7,1467638684,lady_jeanette,8,2,1,0,reply
749942193142587392,"Day 3 of being a Doge,still no Doge avi :c",1467635126,DatBoiKapz,4,0,1,0,reply
749941373244235776,"So yesterday at the Toronto Pride Parade, I was a doge! :3

Absolutely amazing time marching! <3
Did you spot me? :P pic.twitter.com/3PkrqcunJD",1467634931,MattTheLombax,6,2,0,0,reply
749922181426057216,Oi doge you ain't even been to the jim mate pic.twitter.com/wvOG27bWQc,1467630355,PulseHROllie,5,0,1,0,reply
749915609119518721,20 RTs and @thesoundoffear will buy me the doge meme machine please help a sister out pic.twitter.com/9RlnpcEfr9,1467628788,oddafycso,5,2,35,0,reply
749912571143032832,I love doge forever purest meme to grace the internet,1467628064,nich0lael,15,2,5,0,reply
