ID,Tweet,Time,User,Likes,Replies,Retweets,in_response_to,response_type
825131117649002496,aw I just liked the doge in shot gun,1485561563,WhosChaos,20,1,7,825018593024827393,reply
825126661079199744,Kopyto signs a shirt. Karen has a shit eating grin. Doge contemplates. @Zanamaru @Oneiorosgrip @Typhonblue @girlwriteswhat pic.twitter.com/OkgT35atVY,1485560500,HoneyBadgerBite,41,4,8,0,tweet
825122216811622400,I'm on a hunt for a wild doge assistant. Please tell me of you spot him @wgrates,1485559441,SeaAir_Uh,9,2,0,0,tweet
825117963309219841,Let's play to the social roulette with amazing x2.05 multiplier !  https://www.bitsler.com/play/roulette/btc  #bitcoin #gambling #btc #roulette #eth #ltc #doge pic.twitter.com/XaZt9v47VF,1485558427,BitSler,4,0,1,0,tweet
825098047382183936,My doge pic.twitter.com/BSBnssNHfS,1485553678,6Graphs,9,0,0,0,tweet
825086393353277440,#LTC and #Dogecoin accepted as well as #Bitcoin now at http://beardbalm.us  @SatoshiLite,1485550900,GoCoin,11,0,8,825082347859107840,reply
825078448372617216,Overwatch doge  pic.twitter.com/gn3GXcXd84,1485549005,fempute,21,1,2,0,tweet
825057162586103808,Squeezed a few hours for #100DaysOfCode writing tests and improving performance on http://rjl.li/ggsrv . Time to go play with my doge ,1485543931,robjloranger,9,0,1,0,tweet
825041911069155329,"hi, am teh woahmen ur domecsticated doge weshes it could be, troxi metal",1485540294,TroxiMetal,15,1,0,0,tweet
825024698874417152,Very Important Doge Meeting adjourned!  #IsItTimeForLunchYet  #BetterYetYappyHour pic.twitter.com/uZFM5SWntg,1485536191,SneakersCorgi,23,0,3,0,tweet
825006356721704961,Wow! Such doge! So 2013! Seeing a tired meme as a Smite skin cheers this hack writer: https://goo.gl/iFMy69 pic.twitter.com/Jhdc4IoPcT,1485531817,rockpapershot,28,3,10,0,tweet
825003625365770240,Anon features for Dogecoin will increase demand and value - http://bit.ly/2kB9P6c  #doge #dogecoin,1485531166,MuchCryptoNews,3,0,2,0,tweet
824984435309367296,Melancholy doge wishes we were all more susceptible to mind control #DailyDogepic.twitter.com/E61rmIzPdu,1485526591,Epwnaz,14,0,0,0,tweet
824928064790491137,omg stalp what ru doing #doge #wowpic.twitter.com/Sm2Fgwae4e,1485513151,wowdogethedog,19,0,3,0,tweet
824890536922279936,HAPPY BIRTHDAY TO THIS SQUIRREL!!! I HOPE YOUR BDAY IS LIKE ONE BIG DOGE INSTA!  pic.twitter.com/bpOx0gRybG,1485504204,WhosTheVos,25,0,0,0,tweet
824844521947099136,Happy birthday to the doge @brettmautepic.twitter.com/2UtGUgJPMF,1485493233,Shovz27,7,1,1,0,tweet
824826345817534465,Water doge.... Land doge pic.twitter.com/i8Mj1v6P5q,1485488900,sean_smart07,40,0,2,0,tweet
824823251192991745,Here is 1 doge not happy I'm still awake  pic.twitter.com/GmNC2qD3yn,1485488162,Xxaphyra,5,1,1,0,tweet
824819605122084865,omg this doge butte https://twitter.com/thesarahkelly/status/824819494862348288  <quoted_status>Orrrr here's Red keeping an eye on democracy to #makeamericafluffyagain pic.twitter.com/gQKQ986jxm</quoted_status>,1485487292,andreagrimes,11,0,0,824814092036640768,quoted_retweet
824813900071829506,"Hi-Rez has outdone themselves with marketing. Skadi's doge skin got the public who didn't play or know smite (for bad or good, it did)
10/10",1485485932,SmiteDatamining,61,3,6,0,tweet
824811356104724480,doge is the worst meme to ever happen,1485485326,MedicalGoth,2,0,0,0,tweet
824809319438901248,"isnt the old doge meme like...supposed to be prounounced ""dog-ie""? and not ""do-je""? i need a meme expert here",1485484840,ShyVibrance,1,2,0,0,tweet
824802538994143232,"*In a quiet house, doge staring at me, rewriting my social media policy*",1485483224,stevis78,2,0,0,0,tweet
824801162679418880,My parents got a doge and my brovaries are exploding at all the cute pics omfg ,1485482895,rollshibe,2,0,0,0,tweet
824798637465104384,"doge never died, doge just came back stronger and more obnoxious than ever before https://twitter.com/SmiteGame/status/824301815571234816  <quoted_status>Check out the newest skin to join the battleground, Such Cold Skadi! pic.twitter.com/jJbCaXitew</quoted_status>",1485482293,keanerie,4,1,1,824301815571234816,quoted_retweet
824795745354129408,Doge's eyes are closed so :shrug,1485481604,BoatRideCharm,1,0,0,824779826200473600,reply
824792748217757698,"Sleeping better lately. Feels great. But now I get the urge to nap at 8:30 even tho I aim for 11:30. Chill, body. Chill.",1485480889,speckled_doge,1,1,0,0,tweet
824792160520187909,@DailyDoges wheres my daily doge photo? wtf,1485480749,North91_,3,1,0,0,tweet
824790465023188992,doge? pic.twitter.com/ozIwjKdMrj,1485480345,DannyFryerr,2,0,0,824651297848774656,reply
824789054134775808,You can't spell Doge without Dog. :^))),1485480009,itsJohnnyO,3,0,0,0,tweet
824788491414429698,"#bitcoin #blockchain #btc #business #reddit #cryptocurrencies Ethereum,bitcoin,dogecoin,letcoin mining Zcash from Genesis mining 2016 ... pic.twitter.com/85mLozNHF7",1485479874,buzz_take,4,0,1,0,tweet
824787890198679553,"After watching the Skaldi Doge video, I can really tell that @TempoKaeyoh is regretting leaving the SMITE scene.pic.twitter.com/4RrSU96Zxl",1485479731,beckw1n,14,1,1,0,tweet
824786908266057732,QUALITY DOGE IS MUCH CUTE,1485479497,_Gannondorf_,2,1,0,824785325398568960,reply
824784504086810626,I wish my mom would let me take in a doge  https://twitter.com/kyleewuut/status/824781977014435841  <quoted_status>my friend has to give his puppy up and he needs to find him a home quick please anyone if your interested dm me for his #! pic.twitter.com/tRqoTZ4YZc</quoted_status>,1485478924,MasoNation757,1,0,1,824781977014435841,quoted_retweet
824781674110124033,THOSE PICTURES. BIRTHDAY DOGE,1485478249,sluttyseagull,1,0,0,824761008367484928,reply
824773298919706625,Just chillin with Daytime on Roblox keep city watching Doge on TV #firsttweet #suchdogepic.twitter.com/fVmpOH46Wb,1485476252,daytimeender,4,1,0,0,tweet
824773151821295618,Someone who's never seen doge explain what's going on in this picture,1485476217,TumblrSimulator,22,0,8,0,tweet
824773071018000385,"I saw that Smite Doge video again and remembered I still had the game installed.

Fucking.

Rectified.

That.

Shit.",1485476198,Zonino2000,5,1,0,0,tweet
824769558661697536,i just saw a video of the doge skin for the wolf girl in smite like. gamin. its saved. league who,1485475360,panluflalu,1,1,0,0,tweet
824769299894169600,Doge uses me as personal pillow pic.twitter.com/Vg64u5qaGc,1485475299,UppityTwit,6,2,0,0,tweet
817057518128103424,"January 5: Happy Birthday to the late David Ryall, who passed away in December 2014. He played Elphias Doge in Deathly Hallows Part 1. pic.twitter.com/j4KQ05kQ9o",1483636667,HPotterUniverse,435,0,121,0,tweet
817046600426131456,Only 2014s kids remember dogecoin,1483634064,egg1111115,6,2,0,0,tweet
817108135282360322,Doge = all,1483648735,SpineyoX,3,1,1,817103212692013060,reply
817055667026620416,i took this pic where is my credz scamaz doge,1483636225,Ziqoftw,15,2,0,816908868173369345,reply
816854376643858432,"ash the doge
jashes
interracial",1483588234,trustharri,2,3,1,816854072196116480,reply
817076735963336704,That’s one floofy doge. pic.twitter.com/XY0DKLWdW6,1483641249,James_LRR,66,4,11,0,tweet
816830873911689216,"I dis doge bcuz he is very stubborn like a big  and acts crazy at parks, but he's very calm during  rides #ADogsPurpose #DogsPurposeSFpic.twitter.com/XlSR9OtpVq",1483582630,justjudyxox,3,1,0,0,tweet
817118624418664448,This is the dogecoin railway. :) pic.twitter.com/o32EH2hPyD,1483651236,SatoshiLite,9,2,1,817111780317011968,reply
817013086259478528,Every time I read about bitcoin or cryptocurrency all I can think of is the Dogecoin NASCAR car http://read.bi/2iF2QeC pic.twitter.com/ejvedmCIFW,1483626073,RobertBryan4,2,2,0,0,tweet
817139200210321408,"same doge, new claws pic.twitter.com/WmAGbKw7I0",1483656141,bunnie_hime,16,3,1,0,tweet
817135008834027520,I have the cutest doge and you will never convince me otherwise pic.twitter.com/tGCpWgPND6,1483655142,uhluhshuh,19,0,0,0,tweet
817116552885653504,Planned does more than provide abortions. Planned does more than provide abortions. Planned does more than provide abortions. Planned does m,1483650742,Colonial_Doge,16,0,4,0,tweet
817113034351083520,Witnesses have recorded shocking footage of a hit and runpic.twitter.com/oRtvb1h3NX,1483649903,Typical_Doge,6,0,2,0,tweet
817112054855176192,Here's my doge pic.twitter.com/d0uKhN1j2I,1483649669,Mariia19,11,2,0,0,tweet
817107797355528192,3 years ago I got ma doge AND I LOVE MA DOGE HE TURNED 3 IN DECEMBER I LOVE MA RICO pic.twitter.com/4MVOste29f,1483648654,nerdburg15,10,1,0,0,tweet
817106384252760064,Win additional 0.35 BTC and 500 lottery tickets on monthly wagering contest #ethereum #dogecoin #bitcoin @Crypto_Games,1483648317,Crypto_Games,2,0,4,0,tweet
817103426261753857,the ukulele case i ordered arrived today and it came with a free doge pouch??  pic.twitter.com/LSyiX2JSjr,1483647612,MaseyElick,8,1,0,0,tweet
817098362562326528,This Doge Might Be the Quickest Treat Catcher of All Time http://bit.ly/2iFy05S pic.twitter.com/PhALzzx19P,1483646405,Cheezburger,9,1,2,0,tweet
817082357924642818,150 Sos calls for blue doge @Snugglepuffle @Evo2587 @TifaCloud83 @GoffRocka @Hound00med @Hariyamaaapic.twitter.com/IOafRp4QOV,1483642589,Chels_wolves,12,0,4,0,tweet
817069694104588288,girl on the bus infront of me looking at weak ass doge memes smh,1483639570,PAPl__,9,0,1,0,tweet
817069484515074048,Damn bro I didn't know you was in the band now @darkpony71 https://twitter.com/zebracakepapi/status/816751842000535552  <quoted_status>I still don't like this nigga pic.twitter.com/zqfL1OmQEL</quoted_status>,1483639520,ur_doge,10,1,3,816751842000535552,quoted_retweet
817068038591827968,My Doge Pepsi pic.twitter.com/xm8UavlRKJ,1483639175,WoleyWoah,7,0,0,0,tweet
817057518128103424,"January 5: Happy Birthday to the late David Ryall, who passed away in December 2014. He played Elphias Doge in Deathly Hallows Part 1. pic.twitter.com/j4KQ05kQ9o",1483636667,HPotterUniverse,435,0,121,0,tweet
817008004700770304,"& also a big departure for my doge. St. Louis is going to love u, but not as much as I ever will:( I'm gonna miss u zoe. Come home soon plz pic.twitter.com/l6Ejqhrgf2",1483624862,juliamayes99,13,0,0,0,tweet
816988561115414528,#Bitcoin #Penguin #Casino | BTC LTC DOGE Gambling | 200+ Games! Game #15: Slots Angels http://bit.ly/BitcoinPenguin pic.twitter.com/KfMRGQXCSf,1483620226,BitcoinAndBets,3,0,6,0,tweet
816982781800697856," http://TuxExchange.com 
Transparent
Safe
Simple
User Friendly
Blazing fast #Bitcoin #Monero #Syscoin #Ethereum #Litecoin #Doge #Dash #Potpic.twitter.com/pD04Chg6eD",1483618848,bitpython,3,1,4,0,tweet
816962111838580736,Early #morning Doge Palace  in #venice .....with a #cold :-( #twilight #earlymorning #Sunrise #leica @leica_ukpic.twitter.com/lLz58KH13t,1483613920,marcosecchi,32,2,121,0,tweet
816952536661823488,I will protect you doge. pic.twitter.com/wTWG25dTKM,1483611637,miniallmight,12,1,2,0,tweet
816951700288176128,Doge filter and no makeup  pic.twitter.com/gYYeuBnc3A,1483611438,jaycie_eaton,16,1,0,0,tweet
816938150958284800,I don't wear makeup buuut I still love the doge filter :-) so not a completely natural pic  pic.twitter.com/ePmWBig7uo,1483608207,junildamarie,33,0,5,0,tweet
816911669041315840,I look like a bum but hot diggity doge she's looking good  bone apple tea  pic.twitter.com/98c1lXH5Ka,1483601894,anthunayy,7,1,1,0,tweet
816908868173369345,"Good morning! (my paw is so fancy, you already know)pic.twitter.com/EjzOIvmOJC",1483601226,amigo_doge,50,3,3,0,tweet
816896085826424832,Blue doge!!! pic.twitter.com/uWfmupd8f7,1483598178,lprulez_69,13,0,0,0,tweet
816890294834642944,somebody adopt this doge please https://twitter.com/yeetvet/status/816751548734652416  <quoted_status>u guys... this is Alley and she's at Pima Animal Care Center. She's gonna be put down at 7pm on Friday if she's not adopted :( pic.twitter.com/HbKOA91EWx</quoted_status>,1483596798,TayJeeezy,1,0,5,816751548734652416,quoted_retweet
816883620455424004,My doge turned 5 today!  pic.twitter.com/DdDRVDXNGV,1483595206,josephcasass,20,0,1,0,tweet
816871812235563008,Doge pic.twitter.com/GpvffYYmt1,1483592391,SofiaDecio,10,0,0,0,tweet
816858234334183424,Shibe is so doge face. Awesome shirt I got for Christmas! pic.twitter.com/Wi1XXkAzcs,1483589154,SoraHusky,16,1,5,0,tweet
816831520405123072,Have this good night croissant doge to reset your brain to a happy place  pic.twitter.com/9pE75DGQGK,1483582785,Epwnaz,16,2,0,0,tweet
816826589593927680,Just wanted to share this stoic doge I found pic.twitter.com/fD4n2GRPfY,1483581609,JHannon4,10,0,2,0,tweet
816806234892468224,Publix soda labels were the original doge memes and no one even knew pic.twitter.com/SbARfkwtXB,1483576756,saxophoniumjd,19,0,0,0,tweet
816805855299567618,and here's my sleepy doge pic.twitter.com/8SGF8g1G9P,1483576666,typhlotictiger,1,1,0,816805341711060992,reply
816805823695319040,"nah i dont mind, can solo it after :D",1483576658,ArcticBigness,0,0,0,816735584572100608,reply
816805629809430528,everyone go follow @jazz.doge on the gram for some low quality pics of a high quality dog ,1483576612,maggiejoy98,3,0,1,0,tweet
816804578926673920,RIP to my doge twitter header,1483576361,Rachhbrimm,0,0,0,0,tweet
816804164525236229,1 DOGE Price: Bter 0.00000019 BTC #doge #dogecoin 2017-01-04 19:31 pic.twitter.com/QUWl4fnpcx,1483576262,coinok,0,0,0,0,tweet
816803572637634560,MEGA Gaming Bundle Giveaway! https://wn.nr/SSnTH5 ,1483576121,doge_blaster246,0,0,0,0,tweet
816803190112997376,I love this angel and spending time with her. Plus doge. https://www.instagram.com/p/BO3M8zojrEe/ ,1483576030,OptimalNerdRage,0,0,0,0,tweet
816803160488550400,IGNIS NOOOOOOOOOOOOOOOO,1483576023,doge_king,0,0,0,0,tweet
816803109842415616,"We out here killin mehiconos n sheet 
Come thru",1483576011,johnny_doge,1,1,0,816792473204879360,reply
816802776244219904,"Day 4. So I don't want to seem biased, I really don't. But the first one that comes to mind is... Y'know, Blue Fields... FFVIII...pic.twitter.com/hAMuHBg7f6",1483575931,Ghost_doge,1,0,0,0,tweet
816801052662108161,"Why can't they add back year 1 armor aswell we already got some class items and elite gear, every faction armor looks the same",1483575521,Lord_Doge,1,1,0,816784656058163200,reply
816799505014280192,uploaded doge stock photos #sad,1483575152,Gluegames,0,0,0,0,tweet
816798881031868416,Redeem DOGE for Free! Scan the QR code below http://coinok.pw  #doge #dogecoin #faucet 2017-01-04 19:10pic.twitter.com/VuSK4P0DeZ,1483575003,coinok,0,0,0,0,tweet
816798629599977473,I love my pup but I s2g if this doge ain't toilet trained in the next week we gon have words,1483574943,Horsefeathering,0,1,0,0,tweet
816797246595497986,@soccerelvis Preston North End is going to be on TV Saturday - FS1 1230PMpic.twitter.com/GgcNUr38VX,1483574613,Duval_Doge,1,1,0,0,tweet
816796608117424128,Current approx. value of 1M DOGE in USD: $204.5754 values from bter + coinbase at 01/04/17 18:55 #dogecoin,1483574461,dogecointicker,1,0,0,0,tweet
816796578690240512,$DOGE is 19 satoshi. Such price. Many dig. Wow. pic.twitter.com/qs75GXFBOd,1483574454,RedPillTrading,4,0,2,0,tweet
816796355125395456,Current value of DOGE in BTC: Vircurex: 0.0000002 -- Volume: 100000.0 Today's trend: stable at 01/04/17 18:55,1483574401,dogecointicker,1,0,0,0,tweet
816796352344653824,The big doge head marked quite possibly the best stall in work but the direct link in this Tweet does.,1483574400,44_ebooks,1,0,0,0,tweet
823488377404035072,Such doge https://twitter.com/TheAnimaIGifs/status/692546962005041156/photo/1pic.twitter.com/xPHhMo0t9C ,1485169903,dognkitty,31,0,12,0,tweet
823680327256252418,This doge(female) needs a name...halp! pic.twitter.com/5h7PezK5Bs,1485215667,awwwthatscute,5,1,1,0,tweet
823661336433459200,"""Dogecoin Community Expands Charity Effort to Provide More Socks to the Homeless"" — #DogecoinSocksForTheHomeless https://www.cryptocoinsnews.com/dogecoin-community-homeless-charity/ ",1485211140,dogecoin,52,6,9,0,tweet
823660332958760960,What's a Doge? You'll find out on the legendary #Venice tour http://bit.ly/2jV8VEV  via @tompalladioink #takewalkspic.twitter.com/YJ1zG4r7QT,1485210900,Walks,5,0,2,0,tweet
823655925500248064,#Bitcoin #Penguin #Casino | BTC LTC DOGE Gambling | 200+ Games! Game #53: Triple Edge Poker http://bit.ly/BitcoinPenguin pic.twitter.com/Zk4gwvAseX,1485209850,BitcoinAndBets,5,0,8,0,tweet
823640175452426240,I love my doge,1485206094,Kianaboggs,9,0,2,0,tweet
823631600751624196,"If you refer to a dog (or any age, size, or breed) as a ""pupper"", ""doge"", or ""doggo"", I wish you a short, unfulfilled life.",1485204050,eardnov,6,1,1,0,tweet
823617343842557952,coming home from a bad day to a doge is honestly the best feeling ,1485200651,katiecatto2,10,0,0,0,tweet
823608309441818624,N effing kappa B is the Doge of immunology. Such kappa. Much effing.,1485198497,MikeyJ,5,1,1,0,tweet
823607432127676416,Oh no its the a-paw-calypse. >m>;,1485198288,speckled_doge,5,1,1,823604731679539203,reply
823571072012419072,here's a selfie with a sausage doge x pic.twitter.com/eOVzMGhIxq,1485189619,NEEDURL0VE,24,0,3,0,tweet
823557581960515584,if there was any chance of me playing smite that doge meme skin might have smothered it in its crib,1485186403,faeriefountain,13,6,2,0,tweet
823551754394550272,Trying to get warm after swimming in the river pic.twitter.com/2ttoGNMLCe,1485185013,amigo_doge,57,8,8,0,tweet
823527109574426625,"very live lookings at doge b's face when @repjohnlewis won Coretta Scott King Author Award in his disctrict #alayma 
  much wow!pic.twitter.com/JzkJwcupxn",1485179137,Dogebrarian,24,0,3,0,tweet
823508837638569984,"Much Doge, Many Pin, Amaze, Such Shiny, Do Want http://buff.ly/2jcb3Hg  #Doge #EnamelPin #PinGamepic.twitter.com/72qAeqJmjU",1485174781,PowerUpPins,5,0,3,0,tweet
823485344758775809,"Soon Venice starts to dress up again. Explore Venice during the Ballo del Doge: http://lux.ht/2jgKLU9 
#CarnevaleVenezia2017 pic.twitter.com/a9iCv5u3d5",1485169180,thegrittipalace,15,0,10,0,tweet
823476103461343233,@iamsrk raees ticket booked bt mai nai jaungi dekhne jb tk ap mujhe rply nai doge i luv u if u rply me i'll see it maximum 20tyms in theater pic.twitter.com/ClKiFpvE8n,1485166977,TejaswaniSriva1,5,1,2,0,tweet
823442549595635712,I was meant to sleep earlier but nooooope. Gonna take my doge for a walk then cook bweakfast. See you later.,1485158977,Paynefvl,29,0,0,0,tweet
823428021063446529,Ayyy hayyyy marr doge kya sooo cute looking https://twitter.com/bonysengupta/status/823427078766940161  <quoted_status>Okk i scored a 10 on d first go !! What prize do i get ? @VenkateshFilms @SangeetBangla @SurinderFilms  pic.twitter.com/lJiealpCPH</quoted_status>,1485155513,mansipawar6186,9,0,4,823427078766940161,quoted_retweet
823384666220752896,Doge pic.twitter.com/gEyUZHP0dU,1485145176,ChaseVardy1,14,1,1,0,tweet
823379989655535616,Current approx. value of 1M DOGE in USD: $197.9846 values from vircurex + coinbase at 01/20/17 20:40 #dogecoin,1485144061,dogecointicker,1,0,1,0,tweet
823376702537613312,I miss my doge and her sweet side eye pic.twitter.com/6xDoxwcjkI,1485143278,isagray1,4,1,0,0,tweet
823373085214654467,"FLASH I TOLD YOU TO STOP GOING OVER TO THE NEIGHBORS YARD!!!!
NOW LOOK WHAT YOU DID!!!!",1485142415,ClaytonQuiggle,2,0,0,823370106281533440,reply
823371509444083713,"glad you enjoyed your birthday, hope you continue to receive doge pics of love",1485142040,thebesttaco,2,0,0,823337138859241477,reply
823370350721236992,"a few of the under dogs :) PPC, EXP, XZC,MAID,SYS, NEM,DOGE",1485141763,Schrekt,2,0,0,823368916986642433,reply
823365952855298048,Pupper doge pic.twitter.com/b2Z4Em2UQt,1485140715,omarleon21,5,0,0,0,tweet
823364322776743938,"Allllright, hit 30 in The Division. Wanted to stream but had to stop frequently to entertain doge. Live tomorrow :3",1485140326,Failstar,2,0,0,0,tweet
823356729140400131,"Had an amazing night with metro last light more tomorrow, now go give some love to my favorite doge @wgrates! http://Twitch.tv/wgrates ",1485138516,AngryHippieTTV,5,1,0,0,tweet
823349751282335744,Blockchain might be the savior of small companies. http://ow.ly/e0xA3083P9O  #blockchain #bitcoin #software #dogecoin,1485136852,IMSTA_FESTA,2,0,0,0,tweet
823349423753351168,"smol doge, bork bork pic.twitter.com/L8IIcB8YBw",1485136774,summerlpxo,6,0,1,0,tweet
823346058726174720,"I did it @wgrates! I figured it out! Thank you so much, my Doge Bud! I love your face!!!! pic.twitter.com/qFrKJ45ivU",1485135972,XawnderWeber,4,2,0,0,tweet
823345982842748929,"Hope everyone had a great weekend!

#shibainu #doge #shibastagram #cutedogs #dogsofinstagram #shibasmile #shiba #shpic.twitter.com/N5rjqzCNJS",1485135953,myfirstshibainu,7,0,2,0,tweet
823344510579175425,King Doge ,1485135602,Burnbxx,7,2,0,823340275300990978,reply
823342679572484098,RTing this so everyone can see how cute this doge is https://twitter.com/colbykayallday/status/823305617171419137  <quoted_status>update: still hiding Sammy in my bed hail still hasn't returned pic.twitter.com/l74iz71LeL</quoted_status>,1485135166,kayalibozek,3,0,3,823281788864884737,quoted_retweet
823342650036088832,Look at my doge. pic.twitter.com/tROFjcqd7n,1485135159,zerodegreescel,2,0,1,0,tweet
823339738329477120,I've been following that doge,1485134465,zMFA8,1,0,0,823335668323667968,reply
823331902232948738,We're getting a doge!!!,1485132596,SPACEMAN_BMC,2,0,0,0,tweet
823331090144202752,"Sleepy snoring doge, Jasper. I love this new member of our family so!!! Such a good boy.  pic.twitter.com/MiJFngMagA",1485132403,kjkjerstin,5,0,0,0,tweet
823324509537042432,@KPFunism @Love_MyNeighbor @BitcoinStore THANK YOU https://news.bitcoin.com/bitcoin-store-helps-shibes-for-socks-program/?utm_source=OneSignal%20Push&utm_medium=notification&utm_campaign=Push%20Notifications  #dogecoin r/dogecoin #DogecoinSocksForTheHomeless #ShibesForSocks,1485130834,tom_carbon,6,0,1,0,tweet
823320499639951362,THIS DAY OF CROOTIN SUCCESS DESERVES ITS OWN DAMN VICTORY DOGE SIC EM BEARS https://vine.co/v/e30YQw30uTJ ,1485129878,dfank_BU,52,0,2,0,tweet
823320246752841730,"Patience is a virtue. I would be in the same boat as you. Want to get the F... out of doge on my own. But just chill,",1485129818,sparker366,0,1,0,823318748706799616,reply
823319820561104896,Doge of Death; Thanatos!,1485129716,Los_eBooks,0,1,0,823183080173158401,reply
823319777393471488,The #bitcoin Store Helps Shibes For Socks Program - Bitcoin News #Charity #dogecoin http://bitcoinagile.com/AAB6ED/the-bitcoin-store-helps-shibes-for-socks-program-bitcoin-news_stream pic.twitter.com/qfNJOI2lgz,1485129706,bitcoinagile,0,0,0,0,tweet
822467487434313729,RIP Gabe the Doge :(,1484926504,SirDukesAlut,2,2,2,0,tweet
822562520011575298,"6. Who's your favourite from doge sos?

Quote / reply with your answer + #5SOSFAM #BestFanArmy #iHeartAwardspic.twitter.com/sTlgST4PwA",1484949161,5SOS_Updates,28,21,190,822528383938658304,reply
822489666175778817,DUCKLINGS with a doge pic.twitter.com/27dcbnnEU7,1484931792,_shireenahmed_,10,2,2,822487638632439808,reply
822307712688001028,If I had a doge here in Austin so many of my school problems would be less stressful. ,1484888411,DawsonHinkley,5,2,0,0,tweet
822573902710837248,Could possibly be my new doge  pic.twitter.com/ImHc3Idazt,1484951875,ItsAshtroVex,2,2,0,0,tweet
822546769653485575,Doge everywhere pic.twitter.com/BMACSVCD7U,1484945406,alicialiciii,6,0,0,0,tweet
822530251486097408,GOOD DOGE https://twitter.com/felandaris/status/822530176970084353  <quoted_status>and so will @SarahKFetter pic.twitter.com/nGF5zb5G3v</quoted_status>,1484941468,RowanRowden,9,1,0,822529684818853888,quoted_retweet
822524039021244418,so sad everyone thinks you're Hitler now.. not even doge will acknowledge you https://youtu.be/P8e-Pe-MNYo  ... seems so unfairpic.twitter.com/f93j5MHdaO,1484939987,jimmyfungus,25,2,23,822191394160869376,reply
822518815892250624,"A rainy dawn. The Doge's Palace, St Mark's Square and the pink street lights of #Venice. @500pxrtg #ThePhotoHour #travelphotographypic.twitter.com/nd6TChg9dM",1484938742,shsue,19,0,11,0,tweet
822518794782244866,The Best and Worst of #WWENXT 1/18: DOGE ROODE http://uproxx.com/prowrestling/best-and-worst-of-nxt-january-18-2017/  @WithSpandexpic.twitter.com/KKyRgZAlPX,1484938736,MrBrandonStroud,7,3,3,0,tweet
822509842073948161,"Gabe the dog, a legend has died today. I'm really sad about it. Best doge meme out there. rip  #gabethedogpic.twitter.com/vsQrPZGlra",1484936602,jealx_centaine,53,1,20,0,tweet
822508592989372416,"Lady Susan Floofingtonia of the East
(Doge pic provided by @darci_cole)pic.twitter.com/Bk24R4YAve",1484936304,BriannaShrum,6,1,1,787299222022344704,reply
822502691159113730,"Mars and Neptune - Doge’s Palace, Venice pic.twitter.com/eqAm6WJz0x",1484934897,CONCORDIER,11,0,5,0,tweet
822499348202156032,"""It's Friday, you ain't got no job, and you ain't got shit to do. I'ma get you high today."" pic.twitter.com/6VaGuLtARd",1484934100,ur_doge,6,0,8,0,tweet
822497293626576896,"Guys the doge behind the borking song memes passed away, I'm actually sad as fuck. Sweet dreams lil guy",1484933610,anteedotess,8,0,3,0,tweet
822463140612993028,you know it's going to be a long day when you've already caved and eaten a candy bar for comfort before 10:30 am.,1484925468,Traveling_Doge,11,0,0,0,tweet
822440154715590658,"When the greatest doge of all times pass away.
RIP GABE the dog pic.twitter.com/bMp0icyuFc",1484919987,Olaa95,4,0,0,0,tweet
822416058837585920,"Producer: ""Yo you okay with this? Sit for yes"" 
Doge: ~does not speak english~ *sits* 
Producer: ""sick we got consent"" https://twitter.com/tmz/status/821895469215289344  <quoted_status>'A Dog's Purpose' Producers Say German Shepherd Is Fine, Was Not Forced to Film http://dlvr.it/N8Dyw6 </quoted_status>",1484914242,caseyymcall,5,0,0,821895469215289344,quoted_retweet
