ID,Tweet,Time,User,Likes,Replies,Retweets,in_response_to,response_type
822165134818672640,Watching this box create litecoins out of thin air seems like magic. The sole purpose of this machine is to dig out buried LTC (and DOGE!)  https://twitter.com/SatoshiLite/status/821970435352842240  <quoted_status>Just received an Antminer L3 to mine LTC. 250 MH/s @ 400W is 2.5x the efficiency of the A4! And it's quiet. I'm impressed. @BITMAINtech</quoted_status>,1484854417,SatoshiLite,27,2,10,821970435352842240,quoted_retweet
822164230585520132,Happi doge = happi life pic.twitter.com/6nqwScDLht,1484854202,theresahoangg,43,1,9,0,tweet
822150036507267076,Upside down sleepy doge.   http://ift.tt/2iXDWXH pic.twitter.com/idjywRmGTI,1484850818,nimasprout,24,1,1,0,tweet
822145129028796416,I'm crying because I'm not there to comfort my doge and he's probably so scared,1484849648,anhthunguy,14,1,2,0,tweet
822132372326019072,When u look at a big dog cos AW BIG DOGE but the owner thinks ur like ahHH Big dog so tightens the lead and moves away n ur like nO SIR,1484846606,_meredithdavis,18,0,1,0,tweet
822115501799182336,"Much coding
Many errors 
#doge #learntocode #programming #errors #javascript #css #html #codingpic.twitter.com/ky0fvhGDo4",1484842584,HacksawAcademy,4,0,3,0,tweet
822110476016451584,I need a service doge for emotional support,1484841386,connorschmuck,6,0,5,0,tweet
822085225190686720,Curled doge pic.twitter.com/YYIGBKZnSx,1484835365,KieranOPoole,17,1,1,0,tweet
822085035666849792,Doge pic pic.twitter.com/584culAX1d,1484835320,halearnold00,14,1,2,0,tweet
822073763990630400,"Someday, someone will hug you so tight that all of your broken pieces will get back together. #puppylove #doge pic.twitter.com/OKE4Eay3lA",1484832633,babybonchan,9,1,1,0,tweet
822058348359151620,#Bitcoin #Penguin #Casino | BTC LTC DOGE Gambling | 200+ Games! Game #52: Three Card Rummy http://bit.ly/BitcoinPenguin pic.twitter.com/FV8ySkcJvK,1484828958,BitcoinAndBets,7,0,5,0,tweet
822055899925770241,doge ram pic.twitter.com/wxplXghNlv,1484828374,EntropicEmerald,23,0,3,822044935193001984,reply
821975496737116160,"Nigeria Warns Banks of Bitcoin, Ripple, Monero, LiteCoin, DogeCoin & Onecoin https://www.cryptocoinsnews.com/nigeria-warns-banks-bitcoin-ripple-monero-litecoin-dogecoin-onecoin/ pic.twitter.com/ww4Pi9xNOj",1484809204,CryptoCoinsNews,3,0,15,0,tweet
821970125041434624,I love my doge,1484807923,nicopena24,8,0,8,0,tweet
821960054828126208,"From now on, my fan base will be referred to as the ""Doge Empire."" Long live the empire. pic.twitter.com/iYJaikHobf",1484805523,Wolfsterrr,9,1,0,0,tweet
821958293069303810,Now it is time for snuggle doge pic.twitter.com/pbmT8LP2rS,1484805102,_Lynesta,6,1,0,0,tweet
821953407246368768,Director of that doge movie is catching these hands right quick bruh,1484803938,colinalsanders,13,0,1,0,tweet
821952103744577536,"real talk, if anyone knows of or hears of a female dog that would like to mate with my beautiful doge, hmu cuz who doesn't want jake puppies pic.twitter.com/KUKeCN3qNk",1484803627,notsoshaiiii,4,0,1,0,tweet
821944491422662660,thanks for the retweet love your vids (and your doge),1484801812,LochieG_,12,0,0,821929000037650433,reply
821928836011061249,Somebody lost their doge D: keeping him for the night to take to Dallas Animal Services tomorrow. He really likes @vinnycoyotepic.twitter.com/8gzgBPtpT0,1484798079,Skyy_Husky,15,4,0,0,tweet
821924256019779588,my heart hurts for this doge https://twitter.com/roseoddity/status/821875171992674304 ,1484796987,CamrynTynan,7,0,0,0,tweet
821922636091494400,PROTECT your #Cryptocurrency http://bit.ly/2jK0zQI  #RT#bitcoin #dash #zcash #dogecoin #Crypto Hardware Wallet - Personal Security Devicespic.twitter.com/lfSOzF1bWq,1484796601,Luvmunkey,2,1,3,0,tweet
821919475008176131,"Americans are so weird, guy went from saying send any amount 2v2, to any amount 1v1, to dodging both u fucking doge @Feriously_",1484795848,Fragguh,8,1,0,0,tweet
821914951468126208,Hbd to one of my doges I can't remember which ones birthday is today #whoops I swear I have a third doge but she doesn't come near me:/ pic.twitter.com/AsLZQyedcZ,1484794769,reilly_baker33,9,0,1,0,tweet
821912608668205056,doge pic.twitter.com/yl1gR42lR1,1484794210,paigeeerinmason,15,0,2,0,tweet
821911918495629312,I WAS SO EXCITED FOR A CUTE DOGE MOVIE BUT NOW I JUST WANNA CRY https://twitter.com/roseoddity/status/821875171992674304 ,1484794046,frameework,7,0,2,0,tweet
821901564780515328,"The internet has ruined me.  I just saw the word ""dodge"" and my first thought was ""oh they misspelled 'doge'"" :(",1484791577,iamkatygoodman,38,2,2,0,tweet
821899868746743812,A man and his doge pic.twitter.com/gGRxgUfzFi,1484791173,CoachDeCarlo,6,0,0,0,tweet
821892804632686592,"Is Apollo part wolf, doge, & bear? Possibly, yes. pic.twitter.com/lC9h8hvKsD",1484789489,IzzzyIsaac,4,0,1,0,tweet
821883950205378560,IDK HOW WELL U GUYS CAN SEE IT BUT I JUST DOWNLOADED A DOGE PATTERN ONTO MY HYPERION AND I WANT TO CRY  (((srry for the shitty video))) pic.twitter.com/BW6aCM1m7A,1484787378,cozzakenzi_,31,1,2,0,tweet
821881822271442944,"The ""what in tarnation"" doge is my new favorite meme.",1484786870,euripean_union,3,0,1,0,tweet
821874328883105792,have you ever seen a more beautiful doge pic.twitter.com/MK5aqsTkHE,1484785084,_tessa_kathleen,12,0,1,0,tweet
821872394474110976,"SLEEP EM UP a sleppy doge
 https://twitter.com/andreagrimes/status/821872144401342464  <quoted_status>Fizzy  all the day on the heating pad pile I made for her since the cats refuse to cuddle pic.twitter.com/zwudFlhoZk</quoted_status>",1484784623,fizzysahounddog,14,0,3,821872144401342464,quoted_retweet
821872310550462467,Redeem DOGE for Free! Scan the QR code below http://coinok.pw  #doge #dogecoin #faucet 2017-01-18 19:10pic.twitter.com/mqejRxC3WK,1484784603,coinok,0,0,0,0,tweet
821872075958689792,880.14_bce___891.55_bts___900.74_krk___3.83__฿0.0044_bce_lc___3.90__฿0.0000_krk_lc____$0.00021_doge http://dlvr.it/N8CfTf ,1484784547,bitrific,0,0,0,0,tweet
821872062306353153,i had dream of this but i have to doge the zombies but it was little different in my dream is it was dirt of ground,1484784543,Pro12Noahcool,1,0,0,817825808895148032,reply
821871321923600385,es un doge? :),1484784367,ELovexperience,0,1,0,821870319321366528,reply
821871036761247744,"""DOGE""",1484784299,JxeyGraff,0,1,0,821863417170526208,reply
821870947951058947,the slippery slope from drag shows to radical ethnonationalist politics,1484784278,the_doge,0,0,0,821058660977799168,reply
821870453849362432,youre just a DOGE,1484784160,LeaderOfThisGym,0,0,0,0,tweet
821870381262925826,"""OKAY"" Doge face",1484784143,JxeyGraff,0,1,0,821863417170526208,reply
821870068623613952,A list of #FREE #bitcoin #dogecoin #ethereum #litecoin at http://eccryptolist.blogspot.my ,1484784068,ElizaRyenne,0,0,0,0,tweet
821870038617468928,Current approx. value of 1M DOGE in USD: $204.3343 values from vircurex + coinbase at 01/18/17 18:55 #dogecoin,1484784061,dogecointicker,1,0,0,0,tweet
821869962264449024,Suarez and now this?!?!?,1484784043,The_Nick_Doge,0,0,0,821869906400571395,reply
821869906400571395,Ok what's going on? Today is f-ing nuts @Nick28Tpic.twitter.com/uxLJoJQ4Ar,1484784029,The_Nick_Doge,0,1,0,0,tweet
821869785130549248,Current value of DOGE in BTC: Vircurex: 0.00000023 -- Volume:  Today's trend: stable at 01/18/17 18:55,1484784001,dogecointicker,1,0,0,0,tweet
817211940934221825,Sleepy Doge  pic.twitter.com/ZGPPGJwF09,1483673484,RayNarvaezJr,1987,14,125,0,tweet
817383558788640768,"Not sure it's intentional, but this production studio has doge-looking memes on the wall :) pic.twitter.com/vsgZVekZNJ",1483714401,dantdm,2023,115,119,0,tweet
817516924515086336,Hullo i r doge n i lik tew science pic.twitter.com/PdX0darGGE,1483746198,_ChrisDoesStuff,91,3,17,0,tweet
817486659298045952,Doge riding shotgun and open roads is all a guy needs,1483738982,orantes_jc,4,0,0,0,tweet
817448274986725380,The doge meme is almost 4 years old and I instantly feel old,1483729830,Chiibemon,29,1,3,0,tweet
817446564474003456,"Here, I'll make it easy. I live in a basement, I have a cat and a fridge full of wine from the $15-and-under bin, and I still own dogecoin. https://twitter.com/WLTaskForce/status/817431533183238144 ",1483729423,caro,17,0,1,0,tweet
817423167492911104,"Doge's Palace (Palazzo Ducale), Venice, the courtyard via @monica_gre RT @BeautyfromItaly @mariamuser #travel #Italypic.twitter.com/pvSQtEli0M",1483723844,MakMakay,62,1,25,0,tweet
817415982108942338,"Boneclinks Mail Day 1/6/16 - Santa Doge, Romantic Calendar, and Helene Fischer!: http://youtu.be/q_nBiGN1vgw?a  via @YouTube",1483722131,TwitBoneclinks,9,0,1,0,tweet
817410062775947266,"Doge's Palace, Columns of San Todaro #Venice #Art #Venezia #Arte

Grazie a te/voi! :-) @cavaleriani @EnzaAltieri @adrimarcotulli @dorailarepic.twitter.com/IvmbtKFwFq",1483720720,StefanoRocca9,30,1,18,817392226196160513,reply
817396614285426688,it's like Mexican Christmaspic.twitter.com/53IVEd6dnu,1483717513,honky,5,0,0,817378691839836161,reply
817386664729444352,you a real asshole if you dont let ya doge sleep in your bed,1483715141,bksplash,18,0,5,0,tweet
817384647487275009,why has this made my day. why am i such an easy target for doge memes pic.twitter.com/NQ52GVBnZq,1483714660,InesFelton,8,1,1,0,tweet
817369873022074883,Are you the true Doge? — The true king of Pride Rock http://l.ask.fm/igoto/45DKECN75V62DDAUPY6IQO6P5KFDZPYTRXQ47BFRBGS2J7FI2AT5AJKQFZEMCRRQL667WFQFIVXDKFAU34N7A55YPPSKNTBAUYOADFKYCASCGMX5GWID6KPLQSVKBSDZSKQY2H2QZTGX7K4GJSNBWTLK67BSL4ET2LHV77K3QK236UUDLFOUVQHX5FR2P3XGTIUKEOQF7U====== ,1483711138,KestinHoward,57,0,0,0,tweet
817365756245667841,Doge pic.twitter.com/MHpiHVsD9g,1483710156,D_Woods24,6,0,0,0,tweet
817320675857858564,Cate vs. Doge pic.twitter.com/1n8Dfmox9l,1483699408,AndDoggos,2,0,2,0,tweet
817264066280361986,Savannah the type to say doge because the word dog is too mainstream and not hipster enough,1483685912,trent__sh,6,0,1,0,tweet
817256994536984576,I just got my first #digital #drawing pad today. This is a shitty #doge . Better art to come in the future #digitalart pic.twitter.com/O6969meb5h,1483684226,iam_conley,11,0,2,0,tweet
817256655695941636,"I love #bitcoin #Volatility is awesome!! #Money money money 
#fintech #litecoin #dogecoin #virtualcurrencypic.twitter.com/pqdZztye1n",1483684145,coollikeme,3,0,6,0,tweet
817236351309361153,When your doge gets a new bestie :'( pic.twitter.com/7Y1QbxLH3u,1483679304,midocaaa,12,1,0,0,tweet
817223917894893570,This is my doge Leia (derp face) and her best friend Leila (flower collar). They are the cutest Corgis you've ever seen don't @ me. pic.twitter.com/JbLKAj0YJW,1483676339,ohilyssa,59,2,0,0,tweet
817221379611365381,"but if you care about doge memes, you care about something. You can't logically have both.",1483675734,MitchellMuffins,3,1,1,817220849451364352,reply
817220849451364352,@kdanbaybe your avi makes me think you've either dedicated your twitter to doge memes or given up on caring about anything.,1483675608,MitchellMuffins,2,1,1,0,tweet
817218278913228801,"Roger Ver: ""[Bitcoin] is competing against the very best cryptocurrencies...Dash, Monero, Zcoin and Dogecoin"" http://bit.ly/2jadCGZ ",1483674995,zcoinofficial,7,0,3,0,tweet
817216221498183680,"Pathetic, man.  That's why we stopped watching you.",1483674505,Weiner_Doge,8,0,1,817213215973244928,reply
817211940934221825,Sleepy Doge  pic.twitter.com/ZGPPGJwF09,1483673484,RayNarvaezJr,1986,14,125,0,tweet
817205968152850432,the doge is back pic.twitter.com/nGRxe3gLue,1483672060,danixdink,7,0,1,0,tweet
817195378600615936,doge,1483669535,RyanMendez,18,2,0,817118197857931264,reply
817194973636530176,"Holy what, Batman. Just discovered that my 2048 game has a ""Doge"" setting AND IT IS GLORIOUS. pic.twitter.com/syKBz968nq",1483669439,jasletaw,3,0,0,0,tweet
817193826653716481,Doge sandwich pic.twitter.com/LGLjp2a58K,1483669165,rivaLxfactor,60,3,1,0,tweet
817186505705848832,I don't need to be the first person in the office. I'm going to sleep in a little more and hang out with doge and coffee in the morning.,1483667420,meau,4,1,0,817186286352158720,reply
817184306179244032,I mean I might’ve outkicked my coverage but the fact I have one at all is a surprise? Shit. I thought I was an alright doge,1483666895,geauxcrimson,8,3,0,0,tweet
817182674683068416,here are doge pics to hold everyone over pic.twitter.com/nUW11vfq4G,1483666506,islandboyluna,8,0,0,817181221180555264,reply
817182160302075904,Let's make the moon Dogey again! - http://bit.ly/2hYduwo  #doge #dogecoin,1483666384,MuchCryptoNews,1,0,2,0,tweet
817181949940748288,BEEP BOOP IM A DOGE pic.twitter.com/rAL3MD9S15,1483666334,8Bit_Works,21,2,7,0,tweet
817179901778268160,Al got a real life doge and I am jealous. https://twitter.com/traumaties/status/817111066798911488  <quoted_status>:) pic.twitter.com/PNDyHW41Zs</quoted_status>,1483665845,henrymandorla,4,0,0,817111066798911488,quoted_retweet
817178794079481858,"Tbt me, blonde, tan, doge pic.twitter.com/zYRwKBKYGY",1483665581,foxynooblet,76,8,0,0,tweet
817175286848614400,My doge and her donuts pic.twitter.com/PE6TepZUSp,1483664745,_princeSEXUAL,7,3,1,0,tweet
817171366268940288,I leave for 2 seconds and my mom gets a doge pic.twitter.com/eRbjd2mKOr,1483663810,_andidandy,2,0,0,0,tweet
817165130068701185,Thinking about stealing my neighbors doge  pic.twitter.com/PDSBLzBDhV,1483662323,nanothedesigner,8,0,1,0,tweet
817164874883153921,(I say as literally everyone has befriended sol badguy),1483662263,doge_king,0,0,0,0,tweet
817164771434885120,I still can't believe Marie is befriending Sol Badguy of all people,1483662238,doge_king,0,0,0,0,tweet
817163898105319425,A fantasy based on realitypic.twitter.com/OZfAWD8EZd,1483662030,doge_king,0,0,0,0,tweet
817163571067047936,Ey we're the same hat! Doge zodiac represent ,1483661952,Eemajin,1,0,0,816770869464879106,reply
817162587448152066,"Astrology would be a lot more believable if they threw some shade occasionally like ""Leo: probably a bitch, gives up anal on the first date""",1483661717,big_red_doge,1,0,0,0,tweet
817162026028068864,doge! pic.twitter.com/Hh7yrYOUl6,1483661583,UppityTwit,3,0,0,0,tweet
817161659433230336,King Doge Awakened....Neat pic.twitter.com/SM9uUYQO8c,1483661496,TensaZangetsu59,1,1,0,0,tweet
817161268113141760,Redeem DOGE for Free! Scan the QR code below http://coinok.pw  #doge #dogecoin #faucet 2017-01-05 19:10pic.twitter.com/AQUB4nYQYI,1483661403,coinok,0,0,0,0,tweet
817160534675992576,おはありい！,1483661228,_4lto,1,0,0,817159598838718465,reply
817160391180566529,rock p h cries doge why thats transportation memer,1483661194,009comic_bot,0,0,0,0,tweet
817160131855208453,"Day 5. Alright, can't pick between FFX's battle theme, Man With The Machinegun, FFIX, VI... They're all so good D:pic.twitter.com/J7m2LEBoh6",1483661132,Ghost_doge,1,0,0,0,tweet
817159908231704576,sexy glamrock doge.,1483661078,sexy__halloween,0,0,0,0,tweet
817159742640549888,I just got an extenshin that replaces ads with doge ads. best desicion of my life,1483661039,TheDogeRealm,0,0,0,0,tweet
817159375844503552,faithful doge stock photos #tentacles,1483660951,Gluegames,0,0,0,0,tweet
817159113717280769,"Doge + Katamari Damacy
Doge Damacy",1483660889,Just2ThingsBot,1,0,0,0,tweet
817158995580370944,Current approx. value of 1M DOGE in USD: $201.35 values from vircurex + coinbase at 01/05/17 18:55 #dogecoin,1483660861,dogecointicker,1,0,0,0,tweet
817158879561666562,"#DailyUps | $BTC - $QBK: 41.98%
$BTC - $SC: 26.09%
$BTC - $QTL: 22.37%
$BTC - $DOGE: 21.05%
$XMR - $XDN: 19.70%",1483660833,CryptoPressNews,2,0,1,0,tweet
817158778596405248,"@LittleMix YOU SLAY ME, I mean in the style of doge; much slay, such good pic.twitter.com/DxKJZRJEWv",1483660809,babylonkota,0,0,0,0,tweet
817158742395338752,Current value of DOGE in BTC: Vircurex: 0.0000002 -- Volume: 216625.14803009 Today's trend: stable at 01/05/17 18:55,1483660800,dogecointicker,1,0,0,0,tweet
820653678789062657,"Cute Lookin' Doge , The Doge Can Hml ",1484494058,ItsFeliciaaa_,2,1,1,820648482155495425,reply
820737464323162113,"*blinks*
*doge is no longer there*
makes one question, is doge ever truly there? I think- yes. Always. Window doge is true",1484514034,dog_rates,137,1,8,820736545179181056,reply
820767868644184065,Who wants another Doge edit on Sith??? https://m.youtube.com/watch?v=jo90ruDHlyc ,1484521283,SithQuix,3,2,2,0,tweet
820725524683071488,dog>doge confirmed?!,1484511188,UncleKoolaid,2,1,1,820724658572001280,reply
820764762183086081,sometimes you just gotta lay with your doge,1484520543,ilove_hotmoms,19,0,3,0,tweet
820740527352123392,"#BitcoinPenguin #Casino: Instant deposits & withdraws | Anon accounts | BTC, LTC, DOGE Games http://bit.ly/BitcoinPenguin  https://twitter.com/BitcoinRTs/status/752925576588042240/photo/1pic.twitter.com/a7727Ql2Sr ",1484514764,BitcoinAntani,6,0,1,0,tweet
820729129209315333,"Doge's Palace Illuminated at Sunrise, Venice, Italy, March 2014 #Venice #Italypic.twitter.com/55ROvPYZDu",1484512047,anshar,34,1,6,0,tweet
820726770857115654,"Feeling doge af, come say hi 
@NobleProGaming
 http://Twitch.tv/tkao94 pic.twitter.com/v3TvPi1m7k",1484511485,Whiffany,6,0,7,0,tweet
820725440872665093,I'm on doge watch in Las Palmas  pic.twitter.com/sClHjP61NH,1484511168,OMGgemma,10,0,0,0,tweet
820722406423691265,Pancho. Such doge. pic.twitter.com/qTgpnbk48b,1484510444,qottonete,9,0,1,0,tweet
820714411396661249,"It okay, doge.  I too am afeared of kitchen beepings. https://twitter.com/KMSzpara/status/820678890729472000  <quoted_status>My poor doge is scared of the beep on my new electric kettle. pic.twitter.com/USXGhIeRAQ</quoted_status>",1484508538,Lanthir44,5,1,1,820678890729472000,quoted_retweet
820709187306954753,hey doge pic.twitter.com/btf831ZfyE,1484507292,neenawh,21,1,2,0,tweet
820697331645448192,Trendy doge pic.twitter.com/fPBvyJpKxo,1484504466,MatthewsON12,20,0,1,0,tweet
820678890729472000,My poor doge is scared of the beep on my new electric kettle. pic.twitter.com/USXGhIeRAQ,1484500069,KMSzpara,12,2,0,0,tweet
820671333730287620,This crazy doge turned 12 today  pic.twitter.com/tyBn8pqLfK,1484498267,SarahFalzone2,21,0,0,0,tweet
820658308625399808,What's a Doge? You'll find out on the legendary #Venice tour http://bit.ly/2iugqOp  via @tompalladioink #takewalkspic.twitter.com/AyjS5n8pKc,1484495162,Walks,7,1,4,0,tweet
820638936439525376,"Happy Birthday, Doge!  (ง ΄✹ਊ✹)ว
#祝_犬千代BD
#恋の乱LBpic.twitter.com/75RZado4Kr",1484490543,SunBofu,54,0,24,0,tweet
820617611532713985,"Trade #XMR #ETH #POT #SYS #DOGE #PEPECASH #XCP #DASH #BLK #PPC #EMC #LTC #NMC #ZEC at http://TuxExchange.com  !
#bitcoin
#blockchain
#Cryptopic.twitter.com/wmVsWLLN0V",1484485459,bitpython,2,0,4,0,tweet
820585670578237440,"If I pull the hat off will you die?
- It will be extremely painful 
- You're a big doge 
- pic.twitter.com/ZxZrS64BhV",1484477844,Srsim,4,0,1,0,tweet
820564799541145600,If I don't adopt a doge this year then I have failed 2017,1484472868,bellejorden,16,0,0,0,tweet
820556901087789056,this doge is bout 2 drop a rad album ppl pic.twitter.com/54CbXMqPh4,1484470985,turtIeneckflex,4,0,0,0,tweet
820556819303112705,This doge is acquiring some serious celebrity of late. https://www.instagram.com/p/BPQAgwTDzfn/ ,1484470965,frozenreeds,3,0,0,819842570922721281,reply
820555152742453249,just more pics of my doge feat. things in his mouth pic.twitter.com/GVhn6Sp2cl,1484470568,breakfastqueeen,7,1,2,812016498050994176,reply
820553132128292864,Using his ear as a eye mask. Clever doge pic.twitter.com/1jkI4N8Ut0,1484470086,Stryker_89,5,1,0,0,tweet
820548223156658176,"My doge is shiba 

Doge name is Zeus 

He look like anger fox pic.twitter.com/i1dqEU7hGV",1484468916,Tsunderecum,8,0,1,0,tweet
820546030567571459,Snek chicken doge pic.twitter.com/aOls2DjkpF,1484468393,KishanPersaud,12,1,4,0,tweet
820535155089698816,"when you send him a pic of the cutest doge ever and he says ""let's raise one "".... LORT. ",1484465800,stephaniee_n13,11,0,0,0,tweet
820518949796204544,SMOL PUPPER DOGE FRIEND!!!! NO BIGGER THAN MY LOWER LEG!!!! AAAAHHHH!!!! pic.twitter.com/TfeQZnJzcM,1484461936,bae_warden,24,6,0,0,tweet
820516957443260417,Doge news pic.twitter.com/QXwX5G75rQ,1484461461,Brhoom_Alshamsi,1,0,1,0,tweet
820508143096659968,apparently doge thinks i'm a pillow pic.twitter.com/axnau6Q7ye,1484459360,FcknWizard,5,1,0,0,tweet
820503780248711168,There's nothing that warms my heart like watching my doge sleep running/barking/tail-wagging. Keep dreaming girl. Keep fucking dreaming.,1484458320,jnapp43,10,0,0,0,tweet
820503739500875776,"Sorry for the doge retweet flooding xD 
I can't help it.
<3 shibe4lyf.",1484458310,AnyaEverdeen_AE,2,0,1,0,tweet
820497099397599232,"my sister and i just picked up her advanced birthday present from dad, which is a smol pupper doge!!!! the tiniest pom-chow chow omggg",1484456727,bae_warden,18,3,0,0,tweet
820496788008341504,@ohVladdy @Lochage_ This is a little disturbing coming from doge,1484456653,Murdar0,3,1,1,820466747740303360,reply
820485973918224385,I choose doge with corn pic.twitter.com/6EDzfETfFF,1484454074,cinthiaegyo,2,0,3,0,tweet
820480590663340032,the doge meme has a special place in my heart,1484452791,Alexisweltz,4,0,1,0,tweet
820466533684178945,Baby doge pic.twitter.com/kkq3U3A4wk,1484449439,drunkiim,17,0,0,0,tweet
820433382651740161,"It's wet and messy but we got the patio blocked off enough for doge times!  @ Alameda, California https://www.instagram.com/p/BPQ_xOZhLbV/ ",1484441535,andreagrimes,3,1,0,0,tweet
820425871551041537,Crying @ #Supervet (again) because an elderly man travelled from Switzerland for Noel to treat his doge. Drove through 6 countries! pic.twitter.com/dQvxZTr30I,1484439745,LeanneWoodfull,24,2,2,0,tweet
820422921793441796,After some #indiedev took a break to enjoy some snow #hiking with the doge.  pic.twitter.com/MdNIpUjyCh,1484439041,Deniz_Ozkaynak,3,0,2,0,tweet
820422759641649153,Redeem DOGE for Free! Scan the QR code below http://coinok.pw  #doge #dogecoin #faucet 2017-01-14 19:10pic.twitter.com/BKUF2YP5pa,1484439003,coinok,0,0,0,0,tweet
820422641832042501,"depois do abdome negativo e da bochecha negativa, a nova tendência do inverno é o pinto negativo.",1484438975,chloe_doge,0,0,0,820419275420798976,reply
820422562832232448,@Green_EyesJr do you play? Add me doge,1484438956,Aias_25,0,1,0,0,tweet
820422303926325248,*Plays you relaxing acoustic acoustic music. *,1484438894,tired_doge,0,1,0,820400906323820544,reply
820421861150494726,who wants some dogecoin?,1484438789,Qu3ntin0_ebooks,0,0,0,0,tweet
820421754309013504,Обмен валюты Dogecoin DOGE на NixMoney USD http://bestcurr.com/dogecoin-doge-to-nixmoney-usd/ ,1484438763,xeongalaxy,0,0,0,0,tweet
820421673828524032,朝マルシェむかうー！,1484438744,natsuki_doge,0,0,0,0,tweet
820421633005518848,doge est  alexandre,1484438734,jeteconnaishihi,0,0,0,0,tweet
820421426830278656,inclusive está nevando nessa powhan,1484438685,chloe_doge,0,0,0,820419275420798976,reply
820421351995535360,XD lol  I dare myself for every tweet I have to use a doge GIF pic.twitter.com/6YKbvbuWBx,1484438667,Doge4L,3,0,0,820416721592795137,reply
820421311382093826,tem uma tequila rolando então reduziu a atividade do isocórtex. Alocórtex desinibido.,1484438657,chloe_doge,0,0,0,820419275420798976,reply
820420787635159040,"Love your mother,love your father,love your doge,love @thatPoppy",1484438533,SoundSolider123,0,0,0,0,tweet
820420488446939136,Current approx. value of 1M DOGE in USD: $199.7136 values from bter + coinbase at 01/14/17 18:55 #dogecoin,1484438461,dogecointicker,0,0,0,0,tweet
820420480079368193,Dogecoin – From joke cryptocurrency to Bitcoin rival http://newsherald.info/dogecoin-from-joke-cryptocurrency-to-bitcoin-rival ,1484438459,braimahake,0,0,0,0,tweet
820420235274530816,Current value of DOGE in BTC: Vircurex: 0.00000025 -- Volume: 21000.0 Today's trend: down at 01/14/17 18:55,1484438401,dogecointicker,0,0,0,0,tweet
815768372340080640,Doge emotionally supports us all pic.twitter.com/YhIMUirV3e,1483329310,Uptomyknees,407,10,80,0,tweet
815981505440845824,Happy doge is happy. Stream soon! http://Twitch.tv/schviftyfive pic.twitter.com/smsD6KLgX6,1483380125,SchviftyFive,149,9,10,0,tweet
815819459239636996,Doge wishes u @ashrafnasir95pic.twitter.com/5ZnigKUTnl,1483341490,elluqqie,1,1,2,815818834720370688,reply
816060219247697920,"So this happened today, Brooke and Doge got married while old ash was attention seeking in her underwear and Doge managed to catch some..idk pic.twitter.com/sFzOtyzCsB",1483398892,Ashwinitv,11,2,2,0,tweet
816056597248176129,met @Soro_6 new doge td pic.twitter.com/yOGk0oI8hh,1483398029,michsciolaro,13,0,1,0,tweet
816055779950268417,Doge pic.twitter.com/y5N7JKNtoN,1483397834,_elliemcauliffe,10,0,0,0,tweet
816046690595643392,There's more propaganda in BBC fiction than there is in the 'so called BBC News.',1483395667,decent_doge,4,0,2,816036779606376448,reply
816034664615997445,"this is coming from a human being using the doge meme in 2017, be quiet.",1483392799,TheCampingCats,23,4,0,816029898997383169,reply
816027606470508544,"Used to hate doge clothes, but look how cute !!! pic.twitter.com/K6njNjnYzK",1483391117,bowles_izzy,12,0,0,0,tweet
815994627031502848,Doge party pic.twitter.com/GCX3Spntxe,1483383254,ATLelise,11,0,0,0,tweet
815993802653630465,bihari braj mein Ghar mein basa doge awesome video gurudev..we all are feeling blessed in this new year..thank you gurudev,1483383057,RaiYashika,32,0,0,815993374100586496,reply
815979390593069056,Dr Doge is taking his duties very seriously today. Soon I'll be smothered in a blissful pupper face blanket. pic.twitter.com/Rh9xnzxr4U,1483379621,Local24Chelsea,5,0,1,0,tweet
815971606593990656,i just played 'doge' in words with friends for funsies and discovered it was a real word ,1483377765,sar_fig,5,0,0,0,tweet
815952412317925376,@Rogue_winz Since you love doge so much ╮(￣⊿￣)╭ pic.twitter.com/NUXoJaBUrA,1483373189,XiaoPandas,16,0,2,0,tweet
