ID,Tweet,Time,User,Likes,Replies,Retweets,in_response_to,response_type
866443495136821248,Current value of DOGE in BTC: Vircurex: 0.0000003 -- Volume: 16319.78111112 Today's trend: down at 05/21/17 19:55,1495411201,dogecointicker,1,0,0,0,tweet
869284973726973953,DOGE HERE HOW CAN I HELP YOU TODAY HOOMAN pic.twitter.com/Taj1fT9H8d,1496088662,jfwong,985,8,409,0,tweet
869137156475805696,I need a doge ;_; or a lobo...,1496053420,graffiti_rabbit,3,2,0,0,tweet
869305251630915584,$PIVX $xrp $nav $doge $btc and New buy tip $xmy / $myr #myriad #myriandcoinpic.twitter.com/4dzVZwBkO5,1496093497,thomas_lub,3,1,1,0,tweet
869286322950750209,"It seems $XRP has completed its downtrend phase.

$btc $ltc $xrp $str $zec $etc $eth $dash $xmr $doge $dgb $sc $maid $pivx $sys $gnt $xdn https://twitter.com/nahuelpat89/status/869281633819652098  <quoted_status>$XRP compressing. Fasten your seatbelts!  $BTC $LTC $ETC $ETH pic.twitter.com/PZOWMAbfbN</quoted_status>",1496088984,JoniCrypto,6,1,1,869281633819652098,quoted_retweet
869245056376479744,My Portfolio Distribution as of this morning $ETC $RDD $XRP $LTC $XLM $STR $DOGE #altcoins #bitcoin #cryptocurrency #trading #daytradingpic.twitter.com/vtpaqst61b,1496079145,DaleyBTCNews,5,6,0,0,tweet
869342459830177794,"I find their balls amazing, only millions dead and it's 'Ah THIS TIME it will work'

Maybe Nazis should coin 'Not Real National Socialism'",1496102368,decent_doge,9,2,2,869170351049240576,reply
869333176614866944,GONNA HECKIN BORK BORK NON FRIEND DOGE pic.twitter.com/gYi4n3PaEV,1496100155,Nixanadoo,6,0,1,0,tweet
869331678136872965,Looks like things are taking of at @TradeSatoshi #bitcoin #litecoin #dogecoin #ethereum #Ripple #moneropic.twitter.com/QMd3KJLfJv,1496099798,Incakoin1,6,0,6,0,tweet
869323876941144064,If you have a doge come through dunkin but don't buy anything I just wanna give your doge a donut,1496097938,mattiefaskell,24,2,0,0,tweet
869319375190446085,"1. Had the chance to see this in person today, Bellini's portrait of the doge Leonardo Loredan (1501). pic.twitter.com/yDMxZEvs9p",1496096864,cobbpasha,15,1,1,0,tweet
869318787685797888,@coinmarketapps V3.1 launched for  #bitcoin #ethereum #ripple #etc #dogecoin #nem #dash ==>>  https://play.google.com/store/apps/details?id=coin.market.app.com  <===pic.twitter.com/oKlIJnzB8z,1496096724,BitcoinFeeds,3,0,4,0,tweet
869299359216750596,ahmiyat doge tou zaleel ho jao ge.. tbh,1496092092,SpiralPastaa,12,0,5,0,tweet
869291265019523078,"blockchain is in its early years
compare #dogecoin to what the internet was in the 90s
 https://www.youtube.com/watch?v=29pKi6O3mFo ",1496090162,DogerainApp,2,0,2,0,tweet
869289673822269440,.@CassiusRed @Devil_Doge @swift_exit blade breakers are backpic.twitter.com/WqTK0mcpLa,1496089783,PudgeKitten,14,5,3,0,tweet
869273509998014464,"Closed $DOGE short with a nice profit, upward momentum appears to be building, going to try to enter another short higher up w/ confirmation",1496085929,Cryptopoker_,4,2,0,0,tweet
869267303183118339,Visual representation on $DOGE. @22loops vs @ThisIsNusepic.twitter.com/Jlo1GSCfsO,1496084449,crazy_crypto,28,1,6,0,tweet
869255815085137921,This is doge. May I take your order? pic.twitter.com/fVSym4TMTE,1496081710,VicStoddard,42,1,12,0,tweet
869255642254528512,Here is a video of my doge just living his life. pic.twitter.com/KzvFXZRiR9,1496081669,vivalastina_,36,1,2,0,tweet
869253440588918784,YOU GOT A DOGE! EMOTES OF HIM NOW! pic.twitter.com/fLHFvZc80R,1496081144,MattDethridge,17,1,0,869252209350815744,reply
869244851564498944,What a noble doge,1496079097,Foxtrot44,107,1,1,869009493287292930,reply
869218743519522816,"Japanese Kawaii Hoodies Women Sweatshirts With Ears Cute Doge Muco
#cute #kawaii #Hoodies #Sweatshirts #anime #doge
 http://goo.gl/5zNsy5 pic.twitter.com/VY7OqmPfdE",1496072872,shoopallinone,1,0,1,0,tweet
869206694118797316,"xmr higher marketing than zcash?
btc #1 on technology? 

How did doge end up infront of monero? lol",1496069999,IfranStallet,7,0,0,869046697992650753,reply
869198197939417092,"Probably the worst reason not to invest, but it's hard to take $DOGE seriously with that horrible logo. ",1496067973,Concept211,3,0,0,0,tweet
869173381446414336,Conehead doge has an alarm at strange trucks #DailyDogepic.twitter.com/9cjVqanMp6,1496062057,Epwnaz,16,2,1,0,tweet
869164718627401728,"Ab kya reason doge 
Hope u will realize ur mistake..of not giving ravish's story  upar se bakwas reason dkr character end krna",1496059991,shashu_suvi,11,0,3,869164378435850240,reply
869158793577287681,This bot help you identify potentially prepump stage of coin in crypto market/exchanges! $BTC $LTC $ETH $ETC $XRP $STR $DOGE $ZEC $DASH $XMR,1496058579,EmHamdiem43,2,0,3,868590267657371648,reply
869140384512974852,They could have taken the two especially with the bond between them its just as easy with 2 3 4 or even 10 doge believe me i know,1496054190,SueMcCartney1,11,1,12,868962278464520193,reply
869132684991361024,"Yes, up the #DOGE",1496052354,DanRea1990,3,0,0,869075856844615680,reply
869131110281867264,Spent the morning at Doge's Palace in #venice hearing about the special and secret #archives for the Council of Ten #history,1496051979,NicolaCLaurent,8,2,0,0,tweet
869119714844438528,"Super news with $ETC and booking flight tickets on BitTicket
 https://affiliate.bitbay.net/35975 

Source:
 https://www.cryptocoinsnews.com/bitticket-uses-ethereum-classic-to-book-tickets-on-a-blockchain/ 
$DOGE $BTC $XRP $STR",1496049262,MarkHannaBTC,4,0,9,0,tweet
869093042585690114,hey guys and welcome to my ted talk on memes. uhhhh troll face haha trololol who knows that one? haha me gusta haha wow such doge,1496042902,graffitirunaway,4,1,1,0,tweet
869092922406391808,"This list is a joke sorry, please do more research next time. Placing Monero below Ripple, DASH and Dogecoin is embarassing for the author.",1496042874,Resveratrol_inf,12,1,2,869046697992650753,reply
869085956158173184,$DOGE is the future,1496041213,ThisIsNuse,6,0,0,869075920333754369,reply
869070470871564288,"$DOGE showing all the other shitcoins how to do marketing. It's all about them memes. #altcoins #BTC
 https://www.huobi.com/topic/index.php?a=eth_report  pic.twitter.com/6bVeF6R4Nq",1496037521,VeyBtc,12,1,6,0,tweet
869070025923203072,When dogecoin is higher than monero....,1496037415,SuMastodon,10,0,0,869046697992650753,reply
869047078781046784,Doge appreciation tweet pic.twitter.com/pSxGK9aaZ9,1496031944,joycesavillo,10,0,0,0,tweet
869046660206387200,"i think the current iteration of the way people talk about dogs (rate your dog, doggers & puppos) is just doge/shibe but 2017",1496031844,spaceysquid,9,0,0,0,tweet
869039388516270080,"A very important moment at #fanime
After pic doge came to lay on me and allowed me to scratch him ♡♡♡ pic.twitter.com/CjJrXvIjL2",1496030110,madeinplute,8,0,0,0,tweet
868995825120288769,"Protect your $BTC $ETH $ETC $DASH $DOGE $STRAT $ZEC & $XRP with the best ""value for money"" hardware wallet https://goo.gl/YgRA7h pic.twitter.com/XX2RtqARis",1496019724,CryptoIndexes,8,0,4,0,tweet
868990378174693376,"U can have my doge, she is a good doge when she wants to be pic.twitter.com/0waMP8LhMj",1496018425,haleyruane,33,0,0,868985881763356672,reply
868988019503759360,1 DOGE Price: Bter 0.00000121 BTC #doge #dogecoin 2017-05-28 20:31 pic.twitter.com/NEWYA9erK4,1496017863,coinok,0,0,0,0,tweet
868987880378683393,Cuke til ya puke. (dont puke),1496017830,speckled_doge,1,0,0,868985784572952577,reply
868987858622742528,WHY MAN WHY DOGE DIDN'T HAVE TO DIE,1496017825,PoBoyCraiz,0,1,0,0,tweet
868987730612584448,Guys my doge pic.twitter.com/RNTLC1D33g,1496017794,bobsnoelle3,5,0,0,0,tweet
868986526385848321,How to Stress out a Doge. Post-Walk https://www.pscp.tv/w/a_oQTjFlZFFuTEpkUkdZam98MXlvSk1CZW5sam94UY7mr0_AiCgykmcy9V4bpUN-sqrew2FBcAPSjX41yA_E ,1496017507,CaduceusFawkes,1,1,0,0,tweet
868985591953858560,"Sell both and buy more Litecoin, Monero, PIVX, Digibyte, Dogecoin, ...
Oh right, I already did! Bitcoin is the №1 hyped #Shitcoin! Wake Up!",1496017284,_Moonwaterz_,1,0,0,868932676333469697,reply
868985298738458626,"Takuma Sato should race in the DogeCar

#dogecoin pic.twitter.com/6kvh7zFoe0",1496017214,Cryptoid870,3,0,2,0,tweet
868985132757209088,Da more i get along wid hooman da more i trust my doge  https://www.instagram.com/p/BUp-jLdgATo8ij5i0adSX7OGUPJsvkVN3-TPJU0/ ,1496017175,clarizapaule,0,0,0,0,tweet
868983658300010496,workin like a doge pic.twitter.com/fbEirJAnxB,1496016823,notianupton,0,0,0,0,tweet
868983556458115073,Happy Birthday roach doge love our talks @nickroccipic.twitter.com/SLfRlDX62J,1496016799,Brian_Zapior,1,1,0,0,tweet
868983330192150528,"Swimmie swimmie 
-
-
-
 #doge #shibainu #shiba #shibalove #shibe #shibasofinstagram #shibagram #shibastagram # http://ift.tt/2raKSTN pic.twitter.com/LSMdDUKuQd",1496016745,animalaugh,2,0,0,0,tweet
868982731228803073,Redeem DOGE for Free! Scan the QR code below http://coinok.pw  #doge #dogecoin #faucet 2017-05-28 20:10pic.twitter.com/6qnRWmeF4E,1496016602,coinok,0,0,0,0,tweet
868981694744985600,"I do this on occasion. Mad skillz, doge",1496016355,chadkimball1,1,0,0,868814780387270656,reply
868981450552619008,Me ha gustado un vídeo de @YouTube ( http://youtu.be/faIs2Yxgen4?a  - Let me teach you how to make Easy Money with DOGE coin at,1496016297,revilandres21,0,0,0,0,tweet
868981181735469056,Happy birthday to one of my best buds!!...u roach doge.... hope it's been great pal @nickroccipic.twitter.com/hxC5K7BIh3,1496016233,sam_alvez12,3,1,0,0,tweet
868981060717211648,Mike Pence is our Elphias Doge #comeymemo,1496016204,HParallels,0,0,0,0,tweet
868980466581250048,Current approx. value of 1M DOGE in USD: $1127.52 values from vircurex + coinbase at 05/28/17 19:55 #dogecoin,1496016062,dogecointicker,1,0,0,0,tweet
868980212943290368,Current value of DOGE in BTC: Vircurex: 0.0000005 -- Volume: 88246.0 Today's trend: up at 05/28/17 19:55,1496016002,dogecointicker,0,0,0,0,tweet
864437489204944897,"Ripple is the Doge of 2017.  
$XRP $DOGE #MarkMyWords",1494932932,Mansa_Godson,16,5,6,0,tweet
864624614009450496,like him or not he's the most popular candidate in the country and Medium posts that devolve into doge-speak mean little in the face of that,1494977546,onesarahjones,4,1,0,864624142338973697,reply
864623479399776257,Shiny Fennekin no shiny charm after 578 eggs @mysticumbreon94 @ yourfriedbreadpic.twitter.com/4Zj7FOnHTS,1494977276,doge_lit,8,2,3,0,tweet
864611704008826880,"I had to add Doge to this. He's making me feel so happy right now 
#illustrationpic.twitter.com/uOM002Yizg",1494974468,Aliya_Huet,7,0,0,0,tweet
864593791306661888,Come trade cryptocurrencies like Ethereum and PEPECASH @tuxexchange http://tuxexchange.com  #bitcoin #monero #decred #doge,1494970197,tuxexchange,9,0,3,0,tweet
864567893769551872,"I can't be bothered to get dressed, so... I may be streaming as a doge today  pic.twitter.com/uQHZdXZbcb",1494964023,Tigress_X,7,0,0,0,tweet
864553266490654720,Good morning-!!! Here's a pic of my doge sleeping while I'm petting her lmao pic.twitter.com/bvyAMUS4rX,1494960536,YNJTB,17,0,0,0,tweet
864551698781622273,@dog_rates I found these rare Slovak Doge and they want to be rated just like all the American Doggos pic.twitter.com/LU1FmfeaHo,1494960162,BingKnows,60,0,4,0,tweet
864535969848074240,"direct quote from mrs goode at lunch: ""what's a doge meme?""",1494956412,madysonrenae,12,0,2,0,tweet
864526140320382976,"GAMEPLAN: Eat, take the doge out on a nice walk, and then....

#injustice2 time!! Hoping to start the dirty 12 hour at 4pm ESTpic.twitter.com/ElgFrJoniT",1494954068,sheshn94,7,2,0,0,tweet
864522643399221248,welcome to the adventures of Plurtoise & Riddim Doge pic.twitter.com/Dzy0vNvmCh,1494953234,_SilvaaaaSurfer,34,0,10,0,tweet
864486825045315584,Doge pic.twitter.com/RkYJQEASBB,1494944695,bobbychallton,10,1,0,0,tweet
864466886876069892,thomas tbh you used to spam distorted doge memes in every call on 3am so let's not talk about killing jmma for now,1494939941,Jonasfullbobafe,25,2,1,864445255239819264,reply
864448903071932416,"rare footage of me in combat. 
-full doge tactical suit
-rilakkuma shield
-belt from walmart pic.twitter.com/hnlg8mKajw",1494935653,EggrolI,7,0,0,0,tweet
864442267926495233,Hey hopic.twitter.com/TpLd6w4IhK,1494934071,amigo_doge,53,3,5,0,tweet
864415103080218624,Am sad doge pic.twitter.com/xZLWe7ejee,1494927595,Bumi_Bandias,53,3,3,0,tweet
864388094069485568,Doge *was* love. BibleThump. @Vulajin [was made to] choose The Hero over the Hero's doge; or those nameless npcs. Finishing time is 3:30:29,1494921155,RPGLimitBreak,7,1,2,0,tweet
864363855819923456,"Koj the doge doesn't struggle, only thrives",1494915376,trapcoan,6,0,2,864342558343704577,reply
864356732037873665,So much wow! #toimistokoira #doge @aucor @tsipilaipic.twitter.com/3nH7rOixfm,1494913678,JaaJanne,28,1,1,0,tweet
864352240722509825,I take that back. The amounts in the trump/doge are pretty high https://www.cryptopia.co.nz/Exchange/?market=TRUMP_DOGE ,1494912607,bitburner,3,0,4,864201641393766400,reply
864343865469288449,alex and doge from this morning in the rain pic.twitter.com/FJ7C7OPgkb,1494910610,hherbncloudd,69,5,3,0,tweet
864343852429320192,The latest UK Common Law Party! http://paper.li/UKCLPARTY/1427360223?edition_id=0f5bfe20-39f4-11e7-ac2b-0cc47a0d164b  Thanks to @phoenixsrainbow @decent_doge @Yt22Mill #trump #nottingham,1494910607,UKCLPARTY,1,0,2,0,tweet
864340260171337728,AM I GONNA CRY MORE GRATES DON'T WRECK ME AGAIN DOGE,1494909751,Camileon_01,4,1,0,864271789446369281,reply
864334454445060096,me n doge #NewProfilePicpic.twitter.com/Gu7GQI9XbF,1494908367,ihatealexlopez,15,0,2,0,tweet
864332300368130048,SO MANY VINES but v precious doge yes scream 2 me,1494907853,ANIMOSlTY,2,0,0,857769646794997761,reply
864323178671337472,"something like this.. $XRP

Ripple (XRP) : Vol 7475.02659254BTC (24h) 
Last Price : 0.00018106 Btc

#BTC #ETH #Doge #Ripple #xRP #BLOCKCHAINpic.twitter.com/5yk9796g4I",1494905678,Crypto_Lover321,2,0,0,0,tweet
864315573966184448,doge no. Best wishes in your future endeavors.,1494903865,msucraig09,4,0,0,864288223438278656,reply
864315147690532865,"It's an offshoot of Bitcoin, like dogecoin etc. FWIW Flynn, Assange, Russian oligarchs and hackers love Bitcoin, not just for $.",1494903764,brendancoots,6,0,4,864308631206076417,reply
864308125045710850,I'm about as happy as a doge with 3 dads,1494902089,mattwheelchair,3,0,3,0,tweet
864302671427010560,"FOUND: bigg doge
- marunong tumawid
- walang leash
- laging may chaperone
- grass doge?? pic.twitter.com/kPFi6jSmKR",1494900789,qbrielp,22,1,0,0,tweet
864296804233379840,My doge just met Baby Z I think my life is finally complete,1494899390,Zillalicious,6,0,0,0,tweet
864294100505436163,I have a doge,1494898746,ayyybaylayyy,2,1,0,0,tweet
864285423236939776,Clutch pedal adjusted for the new 4 puck and headlight delete done ft. doge. pic.twitter.com/9eznw3YKUM,1494896677,TheRealFnSharma,2,0,0,0,tweet
864285085364875265,"If you're not scared, you should be. #TrumpMustGo",1494896596,Colonial_Doge,6,1,0,0,tweet
864285077940948992,Does anybody want to watch my sweet doge for me for 6 months  I'll pay you 100 each month  pic.twitter.com/K4fThvEOkV,1494896594,biphmm,9,1,0,0,tweet
864283763903053824,I'VE GOT 2000 SUBARU AND REM ICONS KEVIN AND NOTHING TO LOSE. DONT TEST ME.,1494896281,dragonhxrted,2,0,0,864282127386509312,reply
864281949631905792,Doge pic.twitter.com/xiJw0aqXsY,1494895849,Und3ad_Red,9,1,0,0,tweet
864280168260661248,"I'm ded have some wips.

I'm Tired as heck so can't focussed. But yeeeeeepic.twitter.com/ZfzVc4Eft7",1494895424,tired_doge,5,2,0,0,tweet
864279639396564992,Doge friend pic.twitter.com/5U8KtI4Vvd,1494895298,emdoubleyewjee,2,0,0,0,tweet
864279540591452161,A meme in the makingpic.twitter.com/BJofcJTNoF,1494895274,doge_king,2,0,0,0,tweet
864279228077842432,"nice, that's what i was wondering. thank you!!",1494895200,garchompteeth,1,0,0,864270702110572544,reply
864279002407731200,"if they're entirely original, then we'll accept them. We won't accept gijinkas that are tied into canon storylines",1494895146,doge_king,1,1,0,864270702110572544,reply
864277807366627328,"I added a video to a @YouTube playlist http://youtu.be/weeI1G46q0o?a  DJ Khaled - I'm the One ft. Justin Bieber, Quavo, Chance the Rapper,",1494894861,Thefurious_Doge,0,0,0,0,tweet
864277796088143872,Thehumanfaucet Vote for us on http://FreeCrypto.co  http://ift.tt/1Rgwb7E  #dogecoin keep voting #Bitcoin #dogec http://cur.lv/qp5nf ,1494894858,CryptocrawlLV,0,0,0,0,tweet
864277558279405572,"Full review of The Doge Ship with setup, how to play, and thoughts about the game. http://youtu.be/mJtsQpXVniU?a ",1494894802,archgamingnet,0,0,0,0,tweet
864276977209020416,1 DOGE Price: Bter 0.00000069 BTC #doge #dogecoin 2017-05-15 20:31 pic.twitter.com/QNsw4cAkIa,1494894663,coinok,0,0,0,0,tweet
864274153456709632,"The novice is manuevering the mullah to confound the doge, because the elder suborned the chatelaine.",1494893990,CourtIntrigue,0,0,0,0,tweet
864273240843321344,"X somehow managed to doge the first 'rope' with his teleportation abilities, but the other two caught around his legs and he --",1494893772,StolenPersona,0,1,0,863607294180958210,reply
864273060731465728,Apple's approval process is extremely backed up due to conference they're running soon. real shame we have to wait so long to get ios ver up,1494893729,jaxx_io,0,1,0,863182060734820353,reply
864272355081760768,USB Scrypt miner 144kHz - Litecoin/Dogecoin - IKETC 8GB Flash Drive - ASIC http://rover.ebay.com/rover/1/711-53200-19255-0/1?ff3=2&toolid=10039&campid=5337568308&item=182576320107&vectorid=229466&lgeo=1 ,1494893561,DogecoinFaucet,0,0,0,0,tweet
864271687931617280,Redeem DOGE for Free! Scan the QR code below http://coinok.pw  #doge #dogecoin #faucet 2017-05-15 20:10pic.twitter.com/rL54nzWH63,1494893402,coinok,0,0,0,0,tweet
864271509656928256,"""even softer g sound we borrowed from French, as in 'rouge' and 'garage' (the straight up Italian ""doge"")""",1494893359,tenebris,0,0,0,864189269530771457,reply
864270963579473920,I added a video to a @YouTube playlist http://youtu.be/mJtsQpXVniU?a  REVIEW: The Doge Ship with Setup and How to Play,1494893229,archgamingnet,0,0,0,0,tweet
864270702110572544,@doge_king i have a stupid question-- can pokemon gijinkas be apped to fsl if they aren't canon? i didn't see it in the rules but i am blind,1494893167,garchompteeth,0,1,0,0,tweet
864270021232611332,"worrisome, huh? does that mean you @SenBobCorker are worried?  How worried?  Like really worried?   Really, really worried?  Help me out.",1494893005,Weiner_Doge,0,0,0,864239104141262848,reply
864269441411973120,Cryptogame playmoney Strategy And Trick Use It With Btc Eth Ltc Doge Goo... https://youtu.be/bkEaehetiIY  via @YouTube,1494892866,amrani037,0,0,0,0,tweet
864269421027577857,Current approx. value of 1M DOGE in USD: $738.2256 values from vircurex + coinbase at 05/15/17 19:55 #dogecoin,1494892861,dogecointicker,1,0,0,0,tweet
864269167561654272,Current value of DOGE in BTC: Vircurex: 0.00000042 -- Volume: 125636.53922547 Today's trend: up at 05/15/17 19:55,1494892801,dogecointicker,0,0,0,0,tweet
864219173215404032,Looks like my doge seed is coming into full blossom pic.twitter.com/pyoddH4s9G,1494880881,Matt__Tap,247,0,45,0,tweet
864240133889036288,still part doge,1494885879,koalxcxnt,1,1,1,864174928609894400,reply
864259926478266370,"Doge might bless us with her presence during Dark Souls tonight. Be on in a few mins
 http://twitch.tv/epwnaz pic.twitter.com/lguBzmT26l",1494890598,Epwnaz,3,1,1,0,tweet
864245002460950530,"Viacoin just got listed on @nova_exchange 
Tradeable with Bitcoin, Litecoin & Dogecoin 

Also tradeable on Poloniex, Yobit & Bittrex 
$VIApic.twitter.com/PjygkmuB2N",1494887040,viacoin,25,1,15,0,tweet
864237864149630977,My dog Steve needs surgery It is very expensive and I can't afford it Please help if you can he's a good doge :) https://gofund.me/4tncd3-help-steve-get-better?pc=tw_co_share_w&rcid=b431af44b30e45bdb8b01b3e47261fe1 ,1494885338,carterbraun1,4,0,9,0,tweet
864211011603058688,When Japan gets pika ash and shiny koko global gets a doge that we can get normally pic.twitter.com/eukDBic4q7,1494878936,alexmario97,195,6,15,864209138057752576,reply
864203371057754114,strange looking doge https://twitter.com/petedoherty/status/864200725680836609  <quoted_status>pic.twitter.com/gLwn7MSerU</quoted_status>,1494877114,kitk4tnicole,11,0,0,864200725680836609,quoted_retweet
864185906705641472,"We’re pleased to announce that we are now accepting donations in avocado toast, dogecoin, and ol’ fashioned American dollars. https://twitter.com/TIME/status/864166012689817600  <quoted_status>Millionaire to millennials: Stop buying avocado toast if you want to buy a home http://ti.me/2r9pZdV </quoted_status>",1494872950,thebafflermag,52,1,6,864166012689817600,quoted_retweet
864183487745728514,Thought I'd be nice and take my fat doge for a walk but he decided to poop while an elementary hay ride was going by. Never again,1494872373,maryadams___,22,1,0,0,tweet
864181649709318145,"Trying to make my Doge meme.  Not quite there, but one day... pic.twitter.com/1wnG1LLluN",1494871935,disastercake,30,3,3,0,tweet
864158292905410560,Doge walking https://www.pscp.tv/w/a-h_vjFkclFlWk5NcUdiS2J8MXpxSlZBa1lBandHQhfhvaYAdjZkaZvLrvyBtVGD8bgvgKT0LcLR56G4isGL ,1494866366,AFilthyYamYam,8,2,0,0,tweet
864157415725518849,Doge appreciation tweet.. pic.twitter.com/FsudxO3aTd,1494866157,k3wlbwoyy,8,2,2,0,tweet
864144899142287360,"The Doge's Palace #Venice #Italy
#travel #photography #Adventure #travelphotography
 https://erthx.pl/2riA31y pic.twitter.com/A4Dq2lr0RI",1494863173,earthXplorer,26,2,20,0,tweet
864141946150821889,"Just got woken up by an extraordinarily whiny doge today (′・ω・`)
What's wrong now ",1494862469,Lennethxvii,10,0,1,0,tweet
864119200587100161,Long doge pic.twitter.com/ut0viGcHEe,1494857046,KieranOPoole,12,2,0,0,tweet
864085234857500672,he looks like the doge meme https://twitter.com/smiledarnyou/status/863913932762886146  <quoted_status>idk what to call this look but pic.twitter.com/tqh6wNfxxE</quoted_status>,1494848948,purpIeuniverse,94,0,17,863913932762886146,quoted_retweet
864068964791353345,Cool doge https://twitter.com/minobahmanix/status/864064717031002112  <quoted_status>@danimansuttii someone loves putting their head out of the window pic.twitter.com/6ucu1sVX5n</quoted_status>,1494845069,danimansuttii,25,0,0,864064717031002112,quoted_retweet
864061743391281152,"$COVAL breaking the Bullish Falling Wedge 

NEXT target ? 

$nxt $neos $str $doge $maid",1494843347,Inside_Crypto,9,0,10,0,tweet
864061619399217153,Apparently BB-8 is tasty... #StarWars #Doge pic.twitter.com/ewFeSJNYrI,1494843318,AdorkableMC,12,0,0,0,tweet
864029453084745728,"#BTC ETF Appeal expected soon
NHS ransomware attack #bitcoin
@Poloniex gets another DDoS
#dogecoin  social stats

 https://www.cryptocompare.com/email-updates/daily/2017/may/15/ ",1494835649,CryptoCompare,2,0,3,0,tweet
864026596860153856,"Phoenix: *uses reality marble*
*Courtroom appears*
Noctis: I'm not surprised by anything anymore",1494834968,doge_king,5,1,0,0,tweet
864011036671832065,"knocks unconscious with a rolled up newspaper

i apologize for the inconvenience 

drags him awaypic.twitter.com/kvbBcdqaFA",1494831258,HntroftheHntrs,2,0,0,864006860348637184,reply
863992956986019840,"Dogecoin has crushed Zcash in @bobbyclee's poll! https://twitter.com/bobbyclee/status/862909821162475520  In fact, if I'm reading this right, it also beat ETH, LTC, etc. <quoted_status>(Poll 4) Last 4 choices... will have run-off poll later. Vote now!
Please #Retweet!</quoted_status>",1494826947,zooko,5,2,0,862684819779502082,quoted_retweet
863990556996755457,Thanks for chillin  may or may not be back with more WoW after doge walk,1494826375,Casual_XO,7,0,0,0,tweet
863970950450229248,bad doge ,1494821701,iCrazyTeddy,35,1,4,863965977691787265,reply
863966082733932544,@mysticumbreon94  what should  I  name itpic.twitter.com/00Mj7M9uQt,1494820540,doge_lit,5,0,3,0,tweet
863952275156455424,"Very good doge https://twitter.com/ksatnews/status/863948087223398401  <quoted_status>Police dog takes bullet for partner, saves his life http://bit.ly/2pMhCRv  #KSATnews pic.twitter.com/I5wFNc2xvx</quoted_status>",1494817248,Richard_Tarbell,7,0,0,863948087223398401,quoted_retweet
863950852591112195,can everyone stop bullying pogo he's a good doge,1494816909,Iarissapierce,3,1,0,0,tweet
863946144786853888,"Trading infographic : Cryptocurrency Trading News: #bitcoin, Litecoin, Dogecoin Rises; http://bitcoinagile.com/DD1EEC/trading-infographic-cryptocurrency-trading-news-bitcoin-litecoin-dogecoin-rises-auroracoin-drops-joblovingcom-your-number-one-source-for-daily-job-opportunities_stream pic.twitter.com/86f3USPNc4",1494815786,bitcoinagile,1,0,1,0,tweet
863942800156610560,"In the meantime, cute doge pictures! pic.twitter.com/K93Y47NhiG",1494814989,ShaDouBe,5,0,6,0,tweet
863937732413972480,"Top Airport Parking near Denver International Airport, began accepting Bitcoin, Dogecoin and about 50 other types of digital payments....",1494813781,365MSI,1,0,1,0,tweet
863936820110909440,Smite allow you to predict and doge more than LoL. Hunters have real talent in positionment and movement prediction.,1494813563,Meoowglie,2,0,0,863928379162075137,reply
863932921677307905,I spent all day watching movies with doge and I couldn't be happier,1494812634,GoldenDonQ,3,0,0,0,tweet
863932563169185795,Silly doge pic.twitter.com/c8X1MPOF5D,1494812548,xanaxdee,11,4,2,0,tweet
863932296264642561,my sister @vanessaahaines just sent me my new favorite pic of my doge pic.twitter.com/mAIpwcweue,1494812485,bullpendepth,9,0,2,0,tweet
863926533634883584,im bringing back doge memes,1494811111,AkaBlakeM,3,0,1,0,tweet
863924630892855296,Kinda rough but here is a smol doge pic.twitter.com/iy4I7sZZLV,1494810657,Allosaurex,21,1,2,863916254888943621,reply
