ID,Tweet,Time,User,Likes,Replies,Retweets,in_response_to,response_type
859122345646014465,This doge pic.twitter.com/jyKiHIPNqY,1493665703,ActaBunniFooFoo,71,7,2,0,tweet
859189113060249600,I literally did not sleep at all last night and I also can't sleep for the next two nights bc of finals if I die tell my doge I love him,1493681622,aleexpalumbo,4,1,0,0,tweet
859153805698584576,Athletic Doge pic.twitter.com/LaJLRyQjjG,1493673204,princeofdoges,6,0,3,859152757860728832,reply
859131764580732928,"Trade #cryptocurrencies Safe, Fast and with 0% maker fee at http://TuxExchange.com 
Free #doge to try!
$BTC #bitcoin #altcoins #blockchainpic.twitter.com/kfTNwTLdt1",1493667949,bitpython,2,0,4,0,tweet
859100053243396097,"Easy 2x-3x?
HUGE opportunity to buy alts now that BTC is mooning!
Wondering which ones?
$STEEM $STR $DOGE $NXT $AMP $NLG
You're welcome $BTCpic.twitter.com/JkhOQxpvrO",1493660388,cryptodelphi,9,0,7,0,tweet
859097009826930688,Only the Winkelvoss twins. No serious investor bothers with BTC as there are way more lucrative crypto currencies around like Dogecoin,1493659663,rowan007,30,3,1,859075800389357568,reply
859090093512044544,"Much Doge, Many Pin, Amaze, Such Shiny, Do Want http://buff.ly/2oS0rNi  #Doge #EnamelPin #PinGamepic.twitter.com/K4J5PMeZMH",1493658014,PowerUpPins,5,0,2,0,tweet
859079668850348032,My new darkweb market biz idea only accepts dogecoin. https://twitter.com/clickbyclick/status/859079246815383553  <quoted_status>Why you should run a #cashless #business http://buff.ly/2pzchjf  via @TurbineHQ</quoted_status>,1493655528,AdamSinger,4,1,0,859079246815383553,quoted_retweet
859071655565561856,"in my head i know its dodge
but my heart says it's doge pic.twitter.com/SVxF7hnFmw",1493653618,wereprincex,4,0,0,0,tweet
859062541758148609,"$Doge
Rebuy in the 40's, sell into wick. 
You Dig ? pic.twitter.com/YunHb8dqDM",1493651445,Mansa_Godson,13,1,3,0,tweet
859056228571467776,because people wanted a picture of my doge pic.twitter.com/UOwGS06a6M,1493649940,Thebuddha_3,150,10,0,0,tweet
859022176699207680,"$Doge Daily Double Top. 
Rebuy if Break of DT or Return to Mean / S&R pic.twitter.com/BCPW1o0oqh",1493641821,Mansa_Godson,4,1,0,0,tweet
859013869062291456,Doge what..? Are you.. trying to trip me? Staying warm? Playing hide and seek..? I don't even... #DailyDogepic.twitter.com/JjCQzkeYm8,1493639840,Epwnaz,11,1,1,0,tweet
859004072904593408,I am giving away Cryptos !! Retweet with your dogecoin address to get random dogecoin !!  #bitcoin #dogecoin #faucet #altcoin #blockchain,1493637505,ParabolicAlt,7,2,5,0,tweet
858966021771845632,Close toed shoes & goggles?? 10/10 v safe chemist doge https://twitter.com/tarahoward75/status/858373649442586624  <quoted_status>One of my teammates has a dog in her Chem lab.. he's also required to wear goggles during lab pic.twitter.com/Wqfrm7oIhW</quoted_status>,1493628433,hotlikeasanna,25,2,4,858373649442586624,quoted_retweet
858937369512222720,brah my doge is so q pic.twitter.com/BnCaQbgtts,1493621601,jiniggie,16,1,0,0,tweet
858922730430791681,If you thought the US electoral college was complicated... This is how Venice used to elect the Doge. pic.twitter.com/Ae3z178uyV,1493618111,DuncanWeldon,43,4,19,0,tweet
858913546846875648,look at this q-tip doge pic.twitter.com/HCsjr1m19h,1493615922,earthxbound,9,0,1,0,tweet
858860545235075072,My little brother is playing a doge-based video game... We as a society need to open our eyes before the memes consume us all,1493603285,MartyImScareddd,13,0,4,0,tweet
858859108774096897,That's a good doge. pic.twitter.com/R9nQJOuW8x,1493602943,stephen_morrell,32,2,14,0,tweet
858856264025112577,"Wow
so pinchable 
such doge
#TeamShibapic.twitter.com/PVzOKEYNG5",1493602264,TheTylt,23,1,6,0,tweet
858850970259902464,Redeem DOGE for Free! Scan the QR code below http://coinok.pw  #doge #dogecoin #faucet 2017-04-30 21:10pic.twitter.com/7KZgI2UN1v,1493601002,coinok,1,0,0,0,tweet
858849021233942528,Dogecoin Cryptocurrency 1490 (1.49K) DOGE Directly to Your Digital Wallet  http://rover.ebay.com/rover/1/711-53200-19255-0/1?ff3=2&toolid=10039&campid=5337568308&item=132170826913&vectorid=229466&lgeo=1 ,1493600537,DogecoinFaucet,2,0,0,0,tweet
858848948668305408,I don't agree with a few of these and some are too simply and roughly put but this is pretty good. https://twitter.com/BeninCitizen/status/657266321860775937  <quoted_status>A list of terms explained.</quoted_status>,1493600520,speckled_doge,2,0,0,657266321860775937,quoted_retweet
858848699589378048,Current approx. value of 1M DOGE in USD: $670.7136 values from vircurex + coinbase at 04/30/17 20:55 #dogecoin,1493600461,dogecointicker,1,0,0,0,tweet
858848446203035648,Current value of DOGE in BTC: Vircurex: 0.00000048 -- Volume: 20000.0 Today's trend: stable at 04/30/17 20:55,1493600400,dogecointicker,1,0,0,0,tweet
858847465839050752,"4:20!!!!!!
SNOOP DOGE",1493600167,jckilla039,1,1,0,848984553251319808,reply
858845583657889792,Youre adorable.,1493599718,Devil_Doge,1,1,0,858750452741132289,reply
858845323296358400,Doge with bangs pic.twitter.com/rzcCuWWGtV,1493599656,leki_rivero,18,1,5,0,tweet
858841723606364160,The what sort of functionality would you like to see added to ... - http://bit.ly/2pMu5bM  #doge #dogecoin,1493598798,MuchCryptoNews,1,0,1,0,tweet
858841719474982913,"Space station Permilla welcome you : Moon travelers, your next stop. - http://bit.ly/2pMxGGN  #doge #dogecoin",1493598797,MuchCryptoNews,1,0,1,0,tweet
858839514021851136,My doge! https://twitter.com/guisselleeee/status/858798517099409408 ,1493598271,ralpherson_15,1,0,0,0,tweet
858839309096542208,"When you trying to be productive is sewing but your doge says ""silly hooman, I are most important. Pet me!"" pic.twitter.com/Xrkj5Wa4Tn",1493598222,KissCassCosplay,3,0,0,0,tweet
858836874005291010,"The @Nationals scored 23 runs today so I can definitely get an A on my PChem final tomorrow, right?pic.twitter.com/vWfEJveaqv",1493597641,Colonial_Doge,2,1,0,0,tweet
858836708309082112,Angerey doge! pic.twitter.com/MnWoho5j9q,1493597602,sugarchristian,2,0,0,0,tweet
858835204357705728,"What does US Constitution have to do with it? POTUS has sole, unchecked discretion to launch nukes. No one can stop him.",1493597243,Weiner_Doge,1,0,0,858734307279605761,reply
858834607134912513,a doge pic.twitter.com/6lCZ5GtjzV,1493597101,koreinkorein,58,0,4,0,tweet
858833598715019264,"My mom doesn't understand Doge or ""beyond turnt""",1493596860,matthewzmyndak,1,0,0,858195368747581440,reply
858833476761645056,Noooo :oc,1493596831,Devil_Doge,0,0,0,858804891858370560,reply
858833345513259009,Current value of DOGE in BTC: Vircurex: 0.00000048 -- Volume: 20000.0 Today's trend: stable at 04/30/17 19:55,1493596800,dogecointicker,1,0,0,0,tweet
859755378984091648,0 nolege for exam tomorrow. doge,1493816630,fwelep,4,2,0,0,tweet
859911167678046208,Scream and Doge pic.twitter.com/fQ9L0Jul20,1493853773,_tbhbrandon_,9,0,0,0,tweet
859888477885931521,Doge use GIGA DRILL BREAKER pic.twitter.com/VnOCdla3gI,1493848363,UnMiguExpectadr,4,0,2,0,tweet
859877995443609600,I hope none of you get that fuckin swimsuit. There I said it.,1493845864,big_red_doge,18,0,1,0,tweet
859865087670181892,Taking the doge for a run pic.twitter.com/vptFkI7Cx3,1493842787,jaaaarvis_,14,0,0,0,tweet
859856123511291909,"*woof, woof*

What a beautiful day!!  #Doge #Kelpiepic.twitter.com/ZDltM4AmAi",1493840649,DashDoggo,8,0,2,0,tweet
859851025943072768,Doge challenge accepted #Overwatchpic.twitter.com/mcWcQ2Sld3,1493839434,DingItTV,13,1,5,0,tweet
859850695691821056,"Eyyyy!! On the @INTOTHEAM partnered streamers page next to @insomGG  it's an honor, sir! 

Also fat doge doe  pic.twitter.com/45GkhEra5v",1493839355,kidkerrigan,13,3,1,0,tweet
859841740852908039,#Bitcoin #Penguin #Casino: http://bit.ly/BitcoinPenguin  | BTC LTC DOGE Gambling | 200+ Games! Game #108: Tens or Better 10 Hand pic.twitter.com/zUbh4j5l30,1493837220,BitcoinAndBets,7,0,9,0,tweet
859836585587740672,"doge very such tryings
   omg help tech svcs
 not go so weller

#AccidentallyWavedAllFines
#MaybeNotAnAccidentpic.twitter.com/nXfQLQ4gVJ",1493835991,Dogebrarian,9,0,2,0,tweet
859834143877865476,I wish I was as happy as my doge is 24/7. #goals #loutheblacklabmix pic.twitter.com/D5y65UNzuk,1493835409,whitey3499,6,0,1,0,tweet
859792385064259585,"First dogecoins, now doge guns pic.twitter.com/UwQ76CmEax",1493825453,BestGamezUp,5,0,2,0,tweet
859783523732865026,here's a glorious picture of my doge pic.twitter.com/UZGZeUI93m,1493823340,danna_engracia,10,1,0,0,tweet
859778753274105856,May Wowee the doge lift your spirits! <3 pic.twitter.com/A07awxpcoP,1493822203,quinrex,15,1,1,859596542453338112,reply
859737250984337414,You know what they say about small doges and big balls?pic.twitter.com/4A6mEdI80C,1493812308,amigo_doge,46,2,6,0,tweet
859697284723994624,My picture for today is this very small lion on a column where the ‘Doge’ of the Nicolotti used to be crowned at S. Nicolò dei Mendicanti. pic.twitter.com/QX8wSVqgji,1493802779,SteveKills,9,2,4,858939049519833088,reply
859670953764294656,"a dogecoin is worth more than a venezuelan bolivar.

fucking outdated meme currency is worth more than a real country's money pic.twitter.com/6cU7ISPPry",1493796501,BasedDrWorm,574,34,439,0,tweet
859657277795700736,only one doge pin left! very last. much popular. many sold out. Wow http://buff.ly/2oPZQAD pic.twitter.com/fMqn26Nlxb,1493793241,_helloharriet,6,0,0,0,tweet
859646204833140738,"Don't miss your chance! 5% bonus live until 23:59 UTC 7 May

#encryptotel #bitcoin #litecoin #dogecoin #cryptocurrency #ethereum #btcpic.twitter.com/sYiacJHEui",1493790601,Vindyne8,16,0,15,0,tweet
859618748831084546,"Turns out im gonna be kidnapping this gay pom  too
Huuuu smol blep

Lol more doge pics coz i cant draw much for awhile ;w; pic.twitter.com/3BhgHjYvBF",1493784055,lou_quorice,12,1,0,0,tweet
859618110457958400,Doge doin doge things pic.twitter.com/nMJoGeqM5H,1493783903,nicolemn333,5,0,0,0,tweet
859618034218139649,Doge Souls. pic.twitter.com/xxZkLrGxHk,1493783884,jyoomu,3,0,0,0,tweet
859609545252917250,Corgis are the pt cruiser of the doge world,1493781861,coupercarson,8,1,2,0,tweet
859596768178253829,Segwit activation on Litecoin to affect Dogecoin? - http://bit.ly/2p3RYXs  #doge #dogecoin,1493778814,MuchCryptoNews,1,0,0,0,tweet
859596761345798145,Wow such little knowledge among those who should know. We are still early adopters! - http://bit.ly/2p3Y1er  #doge #dogecoin,1493778813,MuchCryptoNews,1,0,0,0,tweet
859591057520152577,"Also, kiba is life doge now",1493777453,TyTheWiseGuy,1,0,1,859590535358464000,reply
859587036667412481,Everyone this is Maxx my doge 3 years ago. Looks like it's about shave time. #Maxx #Doge #ThunderBuddypic.twitter.com/9k4JP54oGD,1493776494,Khryztoepher,4,1,0,0,tweet
859582733240107009,"office doge got the cutest raincoat today and yes it's yellow 
so I yelled",1493775468,Remmy_Sharia,3,1,0,0,tweet
859581728100429824,i remember first time i smoke i was 12 with @E_Money_DaDon i was surprised he was like i first hit a blunt at 12 we was in Yaya doge charger,1493775228,lilsaksfifth,3,0,1,0,tweet
859580471700852737,Looks like a little doge! https://twitter.com/savtrappin/status/859569629190135808  <quoted_status>pic.twitter.com/s8NFnflvKa</quoted_status>,1493774929,trueheroperson,3,0,0,859569629190135808,quoted_retweet
859578434019893249,Pupdate: my old boy chased three deer and is feeling very sproingly and I'm still just </3 how are you so old doge?,1493774443,ruthbrarian,9,2,0,859576165044031490,reply
859574846887514112,Doge so happy pic.twitter.com/8UIhtdtkj0,1493773588,awwwthatscute,10,0,1,0,tweet
859571447961964546,"FREE ONLINE GAME, CRYPTO-CURRENCY, PVP BATTLE @ http://naekowatson.com  - #BITCOIN #DOGECOIN #DOGE #BTC #GAME #INDIEGAME #BROWSERBASED #EARN",1493772777,JaemezWatson,1,0,1,0,tweet
859569255955681281,That explains a lot. Although I thought a certain floofy doge was attached to him at all times!,1493772255,davoerlo,3,0,0,859534782203666432,reply
859568242301468673,how many dogecoin do you have? via /r/dogecoin http://ift.tt/2pudaJK ,1493772013,RedditDogecoin,1,0,1,0,tweet
859567380481155072,Please go follow the doge @daisythedog336,1493771808,FomsDesigns,2,0,1,0,tweet
859567152474587136,If you argue about a 7 cents price issue at the grocery store you're the worst kind of person,1493771753,big_red_doge,7,1,1,0,tweet
859562399346679808,doge pic.twitter.com/71xtReQVPX,1493770620,maz97,4,0,0,0,tweet
859562225484406784,The neighbor doge is a hoe escaped out the house and won't stop toppin Harry,1493770579,Tim_caraballo,3,0,0,0,tweet
859558694811566080,WE HAVE ACQUIRED A DOGE AND HIS NAME IS WALTER AND I WOULD DIE FOR HIM pic.twitter.com/hXYlku1ISD,1493769737,aaaaaannperkins,5,1,0,0,tweet
859558378925809664,Current approx. value of 1M DOGE in USD: $620.6802 values from vircurex + coinbase at 05/02/17 19:55 #dogecoin,1493769662,dogecointicker,1,0,0,0,tweet
859558202614132736,". @eric_lombrozo owns doge.
 In 6 hours I mined 778 Satoshis!
To date, I've mined 305940 Satoshis!
My current hashrate is 56.2 GH/s!",1493769619,21ButtBox,0,0,0,0,tweet
859558125279395840,Current value of DOGE in BTC: Vircurex: 0.00000042 -- Volume: 51480.93 Today's trend: down at 05/02/17 19:55,1493769601,dogecointicker,0,0,0,0,tweet
865185135788007425,Transferred 100000 $DOGE = USD $150 worth in under 3 min. Transaction Fee: 5 $DOGE = less then $ 0.01 cent - > #bitcoin stop the #fail trainpic.twitter.com/Glaljumjfu,1495111185,spiller_crypto,1,0,1,0,tweet
865336194779033606,When you come home to your own doge after petting your friends doge pic.twitter.com/KJCnsJBzWx,1495147200,katieesplin,35,0,6,0,tweet
865321484952236033,"The word ""doge"" is so much better than ""dog""",1495143693,katieesplin,13,0,0,0,tweet
865273824740356097,"Doge is just stood here, frozen, continually farting and ignoring my protests. #DailyDogepic.twitter.com/wDgKEoNGwa",1495132330,Epwnaz,12,2,0,0,tweet
865273668439613441,Some evening funsiespic.twitter.com/HFb03bmiUB,1495132293,amigo_doge,43,2,5,0,tweet
865233639436582913,Happy #JuanaAppreciationDay to @juanaines_ you wonderful doge person ~(^-^)~,1495122749,WeirdNameProd,11,1,1,0,tweet
865216611388731392,"#InsaneCoin now traded at #Cryptopia #Exchange! $INSN vs $BTC, $LTC, $DOGE, $UNO: https://bitcoingarden.org/forum/index.php?topic=11065.msg154612#msg154612  tnx @Cryptopia_NZ @insanecoinpic.twitter.com/iNvGOPhc5g",1495118689,BitcoinGarden,17,0,27,0,tweet
865207093091069952,"Earn #BITCOIN #Litecoin #Dogecoin NOW! http://buff.ly/2qTxqq1 
#bitcoinrush #fintech #crypto #bitcoin #news #data",1495116420,Bitcoin_Rush,10,0,6,0,tweet
865204697589743617,doge if true https://twitter.com/dlberes/status/865202061297713152  <quoted_status>The default dog emoji in Android O is a Shiba http://emojipedia.org/google/android-o-beta/dog/  pic.twitter.com/svxeZFZUwq</quoted_status>,1495115849,NickBaumann,9,0,3,865202061297713152,quoted_retweet
865203423200849920,"What are these fuzzy gifts?  #doge #doggo 
 http://ow.ly/LuPz30bPoYh pic.twitter.com/K0OdHUoou3",1495115545,DingItTV,19,0,7,0,tweet
865198833772486657,Library Doge http://ift.tt/2qvaITM pic.twitter.com/eUKqj6x8y8,1495114451,katemoross,10,0,0,0,tweet
865181831762780160,OC doggo #goob #doge pic.twitter.com/5rBafYHPJP,1495110397,Stickmanwww,16,0,2,0,tweet
865170728366120961,Cutie patootie pic.twitter.com/dOqA6P4eZp,1495107750,amigo_doge,27,1,1,0,tweet
865065267490992130,"Yo #Dogecoin-ers, you know what to do. https://twitter.com/bobbyclee/status/864155784631926785  <quoted_status>The Battle of Digital Currencies! Which should @YourBTCC offer?
Semi-finals, poll 2 of 2: #Vote now and show your support!
Please #Retweet!</quoted_status>",1495082606,ummjackson,7,3,5,862684819779502082,quoted_retweet
865065196112539648,All Hell will break loose once $DOGE breaks 100 sats!!!,1495082589,anondran,27,3,9,0,tweet
865024104528830468,BUT SOMEONE CAME IN WITH THEIR CUTE LIK DOGE AND LET ME HOLD IT idec how fuckin crazi i look LOOK AT THIS LIDDLE GUY pic.twitter.com/kW1gjaTas6,1495072792,mollybastow,14,1,0,0,tweet
865017460851978241,Tired doge #OllieDuckFeetpic.twitter.com/aye5e9uwn2,1495071208,Ballpit_Gangsta,24,1,0,0,tweet
865011856628342785,Am i extra if i buy a dog stroller for my doge....,1495069872,_liljdawg,11,2,0,0,tweet
865007517952126982,$DOGE is now the only Altcoin under 100 sats on Poloniex pic.twitter.com/LD1QZ8oLjh,1495068837,Suns0fKayotees,9,2,3,0,tweet
865006531053469700,U should rest. Like this doge pic.twitter.com/O3Sjg7sawu,1495068602,Sugarb3ar1984,1,0,0,864995991262564353,reply
865005802091823106,Get u a doge with long hair cuz when they wake up from a nap they will have bed head and its really cute ok,1495068428,jess_spann,1,0,0,0,tweet
865005209860296704,Ever wonder why $BCN and $DOGE have an occasional good run when you know they are worthless? They're a temporary safe haven for profits.,1495068287,_ranewman,1,1,1,0,tweet
865004906435887104,New shibe here! I want to get some Dogecoins but I have no idea where to start! via /r/dogecoin http://ift.tt/2pYdQnD ,1495068215,RedditDogecoin,0,0,0,0,tweet
865003323836964865,Hopefully it's sunny tomorrow I wanna get #blacked at the dog beach with my doge,1495067838,jalen513,1,0,0,0,tweet
865003038359945216,Used Damian’s teleport to doge Darkseid’s ult then hit mine man that felt badass.,1495067769,gothamspoilers,0,0,0,0,tweet
865001749362262020,1 DOGE Price: Bter 0.00000079 BTC #doge #dogecoin 2017-05-17 20:31 pic.twitter.com/3B8hayElzs,1495067462,coinok,0,0,0,0,tweet
865001522853064713,"Things that make me happy while I work: playoff hockey, my doge and a cold beer 
Don't forget to check out the @ADMusicMGMT website pic.twitter.com/EYqdwH2yKD",1495067408,AlexKappy,1,0,2,0,tweet
865000803186102272,"A majestic Doge has appeared and is streaming some TOP 500 Overwatch gameplay!! Come watch and enjoy!! 
@D3toxLIVE https://www.twitch.tv/d3toxlive ",1495067237,Candy_Crane,3,0,1,0,tweet
865000732566540288,"RIP Jeffa

he was a good doge",1495067220,BraMistress,1,0,0,864979074019713024,reply
864998411421925376,Doge pic.twitter.com/c40MIyKtFh,1495066666,RealMisticYT,1,1,0,864870686711357444,reply
864997155269787649,I'm a hausfrau now and I think the doge is A-OK with that pic.twitter.com/HgW2T3jLUV,1495066367,VeroniqueEtc,2,0,0,0,tweet
864997007177461760,"When you don’t want to go inside, but it’s hot, so you sit in the shade #dog #犬 #mameshiba #豆柴 #dogs #labrador #mix #shiba #shibainu #doge pic.twitter.com/bUrt19Vhtl",1495066332,pixel_tera,4,0,1,0,tweet
864996878508843008,I just spent 10 mins looking for the perfect #doge gif to respond to a text with. So I've obviously hit the low point of my day. pic.twitter.com/23vYSSfKdT,1495066301,jesswithcamera,1,0,0,0,tweet
864996464598110208,Redeem DOGE for Free! Scan the QR code below http://coinok.pw  #doge #dogecoin #faucet 2017-05-17 20:10pic.twitter.com/pHgYul7PnS,1495066202,coinok,0,0,0,0,tweet
864995273650589696,Wazak ahahaHAHA THANK YOU BONIMON DOGE I MISS YOU!!!!! ,1495065918,vnssnvrr,1,0,1,864895079873368065,reply
864994685495816192,No way am I clicking on something that shocked you.,1495065778,ThreeGreen21,1,0,0,864961881534025728,reply
864994195911491584,Current approx. value of 1M DOGE in USD: $728.48 values from vircurex + coinbase at 05/17/17 19:55 #dogecoin,1495065661,dogecointicker,1,0,0,0,tweet
864993942118346752,Current value of DOGE in BTC: Vircurex: 0.0000004 -- Volume: 243118.79505859 Today's trend: down at 05/17/17 19:55,1495065601,dogecointicker,1,0,0,0,tweet
861725060427632640,"so I guess the dogecoin tipbot guy stole everyone’s coins after running an elaborate charade for years. 

 https://www.reddit.com/r/dogecoin/comments/69vycc/important_im_taking_dogetipbot_to_a_server_farm/ ",1494286239,ButtCoin,35,4,30,0,tweet
861445794288648192,Rip original doge god pic.twitter.com/pHqFDCsJP9,1494219656,PixelDoggo,35,7,24,0,tweet
861536739692818433,Stop with the sob story,1494241339,hobbit98k,27,3,0,861482434818326529,reply
861710440447041539,doge,1494282753,Monadomo,2,1,0,0,tweet
861727091087126528,imagine bankrupting yourself over a dogecoin tipbot. like how terrible at the entirety of life do you have to be to get to that point,1494286723,ButtCoin,24,1,7,861725060427632640,reply
861639372264931330,potential doge pic.twitter.com/HDwWxbMj7A,1494265809,enderofodin,3,1,1,0,tweet
861716143748272128,"I'm living a pretty good life right now. I have a car, a motorcycle, and guns. The only thing I'm missing is my a doge.",1494284113,Mr_Demamp95,6,2,0,0,tweet
861732358566883330,"AdzuH will not play me in a 1v1 $100 on his console when all he does is play 1v1s and he will probably win, that's a doge in my book. pic.twitter.com/tl5QBq1Au4",1494287979,Fragguh,21,3,0,0,tweet
861728091042832384,Gud day 2 b doge pic.twitter.com/ozciLcGAZj,1494286961,emilymadly,8,2,0,0,tweet
861719112208318464,Happy bday to me and @LacieLaPlante 's doge :),1494284820,TinyViking82,9,6,1,0,tweet
861708437092225024,Me and doge are napping  pic.twitter.com/nrwCmCp5E5,1494282275,Rozoken,29,0,0,0,tweet
861707105186852865,And they were all devoured. The end.pic.twitter.com/MkxLH9zOGC,1494281958,ZakFluff,25,4,4,861561657407004676,reply
861701800503779331,"spot le doge
 https://twitter.com/gooddogsgame/status/861680740207144960  <quoted_status>soon @GoodDogsGame will be visiting the City of Puppy-Love.

Play Now! http://hyperurl.co/gooddogs  

Ils sont tous bons chiens
#gooddogs #France pic.twitter.com/MhtSlZYLgL</quoted_status>",1494280693,matt___nelson,45,1,0,861680740207144960,quoted_retweet
861672031871545344,I just witnessed my doge try an eat her paw like it was a chicken wing #BTSBBMAs ARMY SQUADpic.twitter.com/Tw4aHKgh7z,1494273596,cherryjaemins,22,1,150,0,tweet
861664083426324484,I stg everytime my doge scratches on my door it sounds like she's throwing her entire body against it #BTSBBMAs ARMY SQUADpic.twitter.com/B9Bm0we92j,1494271701,cherryjaemins,58,0,273,0,tweet
861662359223455746,when old notecards aren't as helpful for studying for the final as you'd hoped...pic.twitter.com/eWLun8rUjx,1494271290,Traveling_Doge,15,0,0,0,tweet
861610678175412224,"Yo #crypto people, point me at a viable proof of stake implementation #dogecoin could potentially piggyback off?",1494258968,ummjackson,10,5,4,0,tweet
861570836871905281,"Oh snap, just got home from a long night and these were waiting for me. They're freaking awesome, thanks @_mrsteak !!pic.twitter.com/OD2NGp3WTY",1494249469,Ghost_doge,121,1,12,0,tweet
861532748632215552,have fun traveling in space with doge pic.twitter.com/ZZlfJEO3uR,1494240388,kochamfob,84,0,4,861530000083869696,reply
861529839815335936,ARMY SQUAD #BTSBBMAs Yes it's absolutely freezing and you decide to hog all the blanket you infuriating doge,1494239694,cherryjaemins,21,0,140,0,tweet
861525837681700864,@megturney when you gotta hold your title as 'megs favourite doge' pic.twitter.com/1xl51Dbn3D,1494238740,ForYouIStellify,145,0,7,0,tweet
861523484773691393,How to face a Monday: 1 liter can energy drink and Doge as desktop background :D Hope you all will survive the #MondayDepression !pic.twitter.com/g4QyyssPSJ,1494238179,Aspira_Cosplay,11,4,0,0,tweet
861516226186629121,if you are looking for profits rather than buzz enter $DOGE and $MAID train,1494236449,Inside_Crypto,11,1,6,0,tweet
861508396452900864,"safest coin to buy NOW and hold for next weeks on margin ?

$ETH
$LTC
$DOGE
$MAID",1494234582,CryptoHelvetia,7,0,6,0,tweet
861497003838144512,"When $STR and $XRP will pause being volume protagonist i suggest liquidity will water those markets: 

$AMP
$BCN
$BCY
$DOGE
$DGB
$NXT 

YES?",1494231866,CryptoHelvetia,11,1,6,0,tweet
861486640136466432,SURPRISE PUB DOGE pic.twitter.com/8gyq681iI1,1494229395,hawleyrose,6,2,0,0,tweet
861478151641153539,"Who's gonna win the race this month, the Chikun $LTC or the $DOGE? pic.twitter.com/5SJhkfh84E",1494227371,onemanatatime,23,5,4,0,tweet
861457564684496896,"With $nem $xem $xrp $xlm on rise who is getting into rich list? 
$btc $eth $ltc $etc $dash $pivx $gno $xmr $gnt $rep $strat $ZEC $doge",1494222463,mandyb675,4,1,2,0,tweet
861445794288648192,Rip original doge god pic.twitter.com/pHqFDCsJP9,1494219656,PixelDoggo,35,7,24,0,tweet
861433869769334784,enjoy this picture of frank smiling at a doge pic.twitter.com/2rHnSZdylQ,1494216813,2X202_ST5,4,1,0,0,tweet
861431399672418305,infinite doge is the fractal glue that prevents reality from combusting into utter chaos,1494216224,lvkepvrker,4,0,0,861410102783471616,reply
861424784420118528,my doge you should have been put out of your seat last year,1494214647,Retrovertigo,5,0,1,861420264399097856,reply
861417848882810880,"@OriginalFunko My doge loves it, thanks for making him into a Funko. pic.twitter.com/c1syrpg88n",1494212994,SuperiorEditMan,5,0,3,861416966313193473,reply
861404188089225217,"SHOUTS to these G6's

Evolve
Yackin
Medx
Goof
Doge
Yivo
Lean
Billy
Bams
Bowlcut
Cv
Masai
Sxy
Nicholas
Madison ivy
Elsa jean
Marry queen",1494209737,BO1godfather,13,8,6,0,tweet
861390679414648833,"Comrade Doge, best Doge. pic.twitter.com/zjrdmoEEW5",1494206516,DrewzeyTV,23,1,1,861388787200348160,reply
861390501198561280,Couple pics from the fur meet yesterday. @Matt_Doge pic.twitter.com/h0CmkrQsrN,1494206474,NikkitheHusky,16,1,1,0,tweet
861390103008161792,Here is a small pupper named Mookie in a green hat. Luna showed him the ropes of being a doge today #RescueDogspic.twitter.com/83hx8rZfmC,1494206379,malloryconlon,8,0,0,0,tweet
861389730394644481,"When Cryptos are Pumping.
@Steemit
#CryptoCurrency #DogeCoin
 http://buff.ly/2pokOTr pic.twitter.com/0aCM5AVY1y",1494206290,steemit,44,1,116,0,tweet
861382513150787588,Water doge pic.twitter.com/AuqJ7VM4ES,1494204569,That_ol_Boy,14,0,0,0,tweet
861370096106786818,"$NAV next pump target ??  $doge $bts $xrp $btc
@BittrexExchange  (stay safe )",1494201609,CryptoHelvetia,6,0,46,0,tweet
