ID,Tweet,Time,User,Likes,Replies,Retweets,in_response_to,response_type
867983594685210625,@DigiByteCoin @dogecoin $DGB/$DOGE trading pair is great.  Let's rally against the pullback :D,1495778389,Kismet_llc,4,0,1,0,tweet
867981891785314304,"@DigiByteCoin $DGB technical beakout watch! Flip Target:$0.035(ish)

DOGE pressure is building but the chart says DGB first.   Let's see!",1495777983,Kismet_llc,8,2,1,0,tweet
867976826907262977,Help! 2 years ago I added over 1M doge to paper wallets. I checked blockchain to see if there ... - http://bit.ly/2s1COUB  #doge #dogecoin,1495776776,MuchCryptoNews,1,0,1,0,tweet
867974236278628354,Ayyye its @HauntingHomo Sleepy gal.pic.twitter.com/ETJVCvCWkz,1495776158,tired_doge,10,1,0,0,tweet
867973365423669248,"Have to admit, miss ko na po ang doge. Miss you dogeeee",1495775951,HavaYIANNAs,3,0,0,0,tweet
867969137041055744,"It's May 26, 2017 at 08:00AM, good morning people, ready for a new and #wild day?! #bitcoin #litecoin #dogecoin #monero #usd #btc #nxt",1495774943,LbotCrypto,1,0,0,0,tweet
867968927564877826,that would be scary almost. Like chilling on a balcony and a doge crawls up to give you a fat smooch,1495774893,scentlessmusic,3,1,1,867965218348978180,reply
867952323322028033,A fan made an #IntoTheDead meme. And it makes me so happy. I will never not love doge. ~Vix pic.twitter.com/vXIbKU6zIQ,1495770934,PikPokGames,8,1,4,0,tweet
867951860551954436,I just want someone to buy my dogecoin.,1495770823,Peachibon,5,1,0,0,tweet
867951397760897025,Look at my cousins new doge he's so cute pic.twitter.com/O0A2nOSCpo,1495770713,_princeSEXUAL,3,0,0,0,tweet
867948519369261056,You've been visited by Crosby Doge. Please retweet for Penguins 2OT win. pic.twitter.com/GnCNAPWIOy,1495770027,nathannorrgran,7,2,15,0,tweet
867941788094390273,sulk doge pic.twitter.com/W9ovOAwPBS,1495768422,helveticade,3,0,0,0,tweet
867931383670468608,"Honestly I've tried, in my own way, to tell you guys. Later guys! #VeriCoin #Altcoins #Crypto #FinTech $VRC $VRM $BTC $LTC $ETH $DOGE $DASHpic.twitter.com/fNSmzNnFE4",1495765941,VeryVeriViral,5,0,2,0,tweet
867928160083386368,"stella is clearly capable of capturing numerous emotions, very talented doge model, 12/10 recommend pic.twitter.com/OPAIYgNs6x",1495765173,maramlewis,13,0,0,0,tweet
867915014018965504,"$PIVX  will bounce again after some retracement.

$btc $ltc $xrp $str $zec $etc $eth $dash $xmr $doge $dgb $sc $maid $pivx $sys $gnt $xvg",1495762039,JoniCrypto,10,0,4,0,tweet
867914474077814784,If you wanna see a handsome doge look no further https://twitter.com/john_hurley212/status/867911851576745984  <quoted_status>The most handsomest pic.twitter.com/WkmEtiCEvN</quoted_status>,1495761910,Jackledaddy,2,0,1,867911851576745984,quoted_retweet
867911074405679105,"This me, with Fizz Doge. Adorable dog! Want all treats! Lick your face! Sit and shake! TOUCH BUTT? KILL YOUR FAMILY",1495761099,andreagrimes,9,0,0,867908625272115201,reply
867908083330056196,i havent drawn anything in a few weeks so have a doge meme pic.twitter.com/6L9XWDWX4t,1495760386,fijianya,4,0,0,0,tweet
867906411497492480,[LIVE]Doge takes back the socks! All the farming as Doge takes back his socks from the ruthless enemies! http://twitch.tv/wgrates pic.twitter.com/ffk98ujB4k,1495759988,wgrates,8,1,4,0,tweet
867904098028453888,Was about to sleep & saw this :') https://twitter.com/WolfieEdits/status/867873969487130630 ,1495759436,Typical_Doge,1,1,0,0,tweet
867904031234109440,"Peanut, the doge from my snap, will be making an appearance https://twitter.com/RichlandHS2017/status/867839745619099648  <quoted_status>You can also bring your dogs!!! We watched the sun go up when we started this year, let's watch it go down as we come to a conclusion! pic.twitter.com/FJTXYgKqXP</quoted_status>",1495759420,paolelladean,2,0,0,867839745619099648,quoted_retweet
867894966944772097,RT MooncoinItalia: bitcoin and dogecoin BLEUTRADE #market  always First ! MOON !  #Mooncoin the future! #iot #blockchain  altrush,1495757259,Promturismo,6,0,8,0,tweet
867894807850602496,Boh. La meuf etait gênée mais vraiment sans plus...après je dis pas que c'est une vanne super tordante hein. ,1495757221,Psyko_Killa,0,0,0,867438469395750912,reply
867894435622694912,"またマニアックな
横須賀線しかとまりませんものねぇｗｗｗ",1495757132,NinjaExpress,0,0,0,867893263595745280,reply
867893957186867201,東戸塚w,1495757018,natsuki_doge,0,1,0,867893263595745280,reply
867893560674328576,"C'est faux. La femme a été humiliée pour toi, oui ou non?",1495756924,Psyko_Killa,0,0,0,867438469395750912,reply
867893367706968065,どこ？,1495756878,NinjaExpress,0,1,0,867893263595745280,reply
867893352607473664,"Si tu tue quelqu'un, c'est volontaire. La c'est une blague aux conséquences imprévisibles. Putain, réfléchis un minimum.",1495756874,Psyko_Killa,0,0,0,867438469395750912,reply
867893303861059584,Current approx. value of 1M DOGE in USD: $770.9344 values from vircurex + coinbase at 05/25/17 19:55 #dogecoin,1495756862,dogecointicker,1,0,0,0,tweet
867893263595745280,あの場所は呪われてるなwww まともに行けたことほとんど無い,1495756853,natsuki_doge,0,1,0,0,tweet
867893171723816960,昨日ノリでDoge買った人の心境、、 pic.twitter.com/SJhgz5uudI,1495756831,asahikokura0805,0,0,0,0,tweet
867893050391109633,Current value of DOGE in BTC: Vircurex: 0.00000032 -- Volume: 607887.47133091 Today's trend: down at 05/25/17 19:55,1495756802,dogecointicker,0,0,0,0,tweet
863084489886633984,I JUST SAW A DOGE DOG WIN REAL LIFE FOR THE FIRST TIME FROM A BUS WIDNIWNAHSDHDH pic.twitter.com/KeUH8FYUEq,1494610352,Kierabridget,286,10,19,0,tweet
863159641051586560,How to doge :'v ?? pic.twitter.com/zwPugP4FeP,1494628269,CinnanomW,12,7,0,0,tweet
863084798402846723,Doge pic.twitter.com/tOmLGKWYjA,1494610425,Ganza731,15,2,1,0,tweet
862870218045104128,Doge,1494559265,ChrisLiuner,1,1,1,862869248850489344,reply
863171147986292738,when @Burnbxx see a doge in a game pic.twitter.com/fpMcSnfLmi,1494631013,oudondo78,33,1,2,0,tweet
863158303832121345,"Pepe Cash and Dogecoin in @CBinsights newsletter. i wasn't joking with that doge moon shit. 



i wish i was. i hate the Internet. pic.twitter.com/5N6wgBVI9u",1494627950,Melt_Dem,12,2,4,0,tweet
863154233897607169,remember when 5sos were doge? pic.twitter.com/S3QURxaBB3,1494626980,aestheticcalm,6,1,5,863154165098455041,reply
863145080454074368,"$btc $eth $ltc $dash $pivx $ark $xem $dgb $rads $doge $etc

In times like these I am often reminded of this Jefferson quote:pic.twitter.com/l8y6TDbRTl",1494624798,7heAbolitionist,8,0,2,0,tweet
863132320110432257,One cute doge pic.twitter.com/MKh0OtWzen,1494621755,keebler_tv,4,0,1,0,tweet
863125064492830720,Thank you kind person for bringing a small dose of laughter to my otherwise dull boring and stressful day  #doge pic.twitter.com/FoJtIaFxz9,1494620026,cartoonjunkie1,166,0,9,0,tweet
863124700729421824,"Not our doge, but who can hate on 2 homies like this: pic.twitter.com/jyW4AxFTpS",1494619939,Tony_It_Me,10,0,2,863051664646955008,reply
863122912609435648,Watch what this doge does next... http://ow.ly/LQcu30by0XH ,1494619513,dogownersuk,13,0,6,0,tweet
863106675200450566," Dogmeat says Fallout Friday begins with doge kisses & butt scratches.

 http://twitch.tv/ladyaderissa  pic.twitter.com/btNnHMSur1",1494615641,LadyAderissa,21,0,6,0,tweet
863102405931540480,wth im so broke bec i keep spinning for doge but they aint giving me doge buuuut pic.twitter.com/5O0kdLxC9p,1494614623,sighz0,12,1,1,0,tweet
863099544174809090,Found a random Star Gazer Anubis skin for all you Anubis mains. RT + Follow to win the doge. Ends 18th May. pic.twitter.com/t2skra7npi,1494613941,BigManTingz_,16,1,65,0,tweet
863083154315366400,This doge at my work gives me so much life pic.twitter.com/Nes3rQtTK0,1494610033,TylerRugge,44,4,12,0,tweet
863063764429553665,"Just a short THREAD
Make it what you want, but it doesn't feel good
Bitcoin Surge, Digitalcoin and Dogecoin down
Gold,Silver to Bitcoin?",1494605411,SaysDana,7,3,4,0,tweet
862982795194486784,Dogecoin (DOGE) $133.94m passes ZCash (ZEC) $127.80m in market capitalization https://www.cryptocompare.com/coins/#/usd  via @CryptoCompare,1494586106,jonmatonis,11,2,6,0,tweet
862960493295808512,"Doge Marin Falier was beheaded at the top of these stairs on April 17, 1355 after trying to become Prince of Venice. pic.twitter.com/aArVvaqSc9",1494580789,SteveKills,10,0,5,861111197676052480,reply
862924680117800960,"Doge: Shadow let me back into the discord
Shadow: sHaDoW LeT mE baCk iNtO tHe DiSCoRd pic.twitter.com/RNF66tPOOw",1494572250,SlimTheGiraffe_,9,1,4,0,tweet
862918114710663168,Meet up with @RogueyZz life long companion. @Dark_Sided official Doge  pic.twitter.com/2U7VOzgIOm,1494570685,ZeeGees_AU,5,1,0,0,tweet
862912099135045632,My doge is now an influencer. Deal with it. https://twitter.com/MwaveAu/status/862908261057536000  <quoted_status>The only gaming chair approved by doggos: http://bit.ly/2pBdfsB   billiethedachshund pic.twitter.com/KJIb5mNHtb</quoted_status>,1494569251,shancake_,29,5,3,862908261057536000,quoted_retweet
862899479367823361,#Litecoin ??? BUY BUY BUY ! #LTC #XMR #XRP #STR #DOGE #DIGI #XBC #BitcoinPlus #Dash #NMC #PPC #POT #ZEC #ETH #BTC #BTS #MAID #NAV #FLDC #NXT pic.twitter.com/yKNeMwG2yT,1494566242,SexyBitcoinBabe,11,0,9,0,tweet
862899091491012608,Was de H*ck doge you got me spooked pic.twitter.com/8X5Npo8GhT,1494566149,litpuppymemes,2,0,0,0,tweet
862897712710258688,"Jeth and crew sport doge helms,the demand for new doge helms rise,server rewrite terminated indefinitely,conclusion Jeth = rootofallevil",1494565821,WingedDevil_AE,1,0,1,862661411662569472,reply
862894900534272000,I AM A SPACE DOGE! pic.twitter.com/7YcZiQeiQh,1494565150,wgrates,7,1,0,862774915111505929,reply
862881406803947520,"This was a fun thread/trade log, but i'm pretty much rolling up the carpet.

Large Bags: $GAM $DOGE $XEM $NXT 

Small: $PINK $HUC $RIC $DTB",1494561933,ThisIsNuse,17,5,1,845307709398433792,reply
862880266712367104,Follow ya boi to see pics of my love TOBY doge pic.twitter.com/xpMKT19qIP,1494561661,tosteezyformost,1,0,1,0,tweet
862870218045104128,Doge,1494559265,ChrisLiuner,1,1,1,862869248850489344,reply
862869289463758848,"flower hobi ft. his doge fans ""jdogs"" 
#BTSBBMAspic.twitter.com/pDp5hMhV7M",1494559044,rmdrayala,6,0,4,0,tweet
862869005958336512,"We took the love to @wgrates, so get on in here and watch a doge conquer the galaxy!!

 https://www.twitch.tv/wgrates pic.twitter.com/h5RPhPiCHM",1494558977,FromThe70sguy,3,1,0,862868351298744321,reply
862848396444487680,Send it to him in bitcoin... or dogecoin,1494554063,astroprofeddie,3,1,1,862847801943875586,reply
862842317165572096,Took me a second to realise you were talking about elite I thought you evolved to space doge!,1494552613,Amelyth,6,1,0,862774915111505929,reply
862833598608670724,"Doge Liedler Two 
is my indie band name
#TCMParty",1494550535,footenotes,2,0,0,862833320899387392,reply
862829904387162112,"Was hoping to get back home in time before his passing, but didnt make it  18 years Rocky passed today.  Rest in doge heaven pic.twitter.com/3k3uKhFAdF",1494549654,Sinqnew,5,3,0,0,tweet
862829126125838336,[LIVE] Doge goes on an adventure! Trip to center of galaxy and back again! Anyone know a good chat timer? http://twitch.tv/wgrates ,1494549468,wgrates,9,0,2,0,tweet
862828280117956608,Is this about the Top and Probe bannings???,1494549267,xColeSlaw,0,0,0,862827643535859712,reply
862827643535859712,"I'm told to metaphorically take the drivers seat in my life.
But the same people keep forcing me in the back.",1494549115,johnny_doge,2,1,0,0,tweet
862827425570443264,1 DOGE Price: Bter 0.00000074 BTC #doge #dogecoin 2017-05-11 20:31 pic.twitter.com/G020vrkuiv,1494549063,coinok,0,0,0,0,tweet
862827145042808834,Where do i get tickets?,1494548996,Devil_Doge,0,1,0,862263600966242306,reply
862825875955306496,smokin rapper weed wit my doge,1494548694,abrilamente,0,0,0,0,tweet
862824694600413184,"Doge T-shirt close up 
$25.00
➤ https://goo.gl/mTnc1I 
#doge #meme
Please retweet
via @outfypic.twitter.com/Yx3sl5cf0j",1494548412,turnt_panda,0,0,0,0,tweet
862824656457261056,(Camille voice) Konan it's doge,1494548403,BookOfKiku,0,0,0,0,tweet
862824372846944256,No love for big doge :/,1494548335,NateIronGa,1,1,0,862779925014560768,reply
862824355428003844,get in discord doge,1494548331,Fusixnz,0,0,0,862821428999196672,reply
862824229514948608,Was going to spend my Dogecoin on a bar of gold... via /r/dogecoin http://ift.tt/2ppYSeI ,1494548301,RedditDogecoin,0,0,0,0,tweet
862823728182439937,Such doge pic.twitter.com/NnIVU77DG3,1494548181,aspiringSalmon,1,0,0,0,tweet
862823048172507136,"dude listen here, if doge isn't playing, i no play",1494548019,Fusixnz,0,0,0,862821428999196672,reply
862822137433817090,Redeem DOGE for Free! Scan the QR code below http://coinok.pw  #doge #dogecoin #faucet 2017-05-11 20:10pic.twitter.com/020uKnp3G5,1494547802,coinok,0,0,0,0,tweet
862821755618045952,developping code of dogecoin via /r/dogecoin http://ift.tt/2r7INYm ,1494547711,RedditDogecoin,0,0,0,0,tweet
862820647738658817,To be fair he is a doge,1494547447,lizkelley,0,1,0,862817355008692224,reply
862820262328270848,"Ewww Kimey yawned in my face

She has stinky breath :U",1494547355,pepper_doge,0,0,0,0,tweet
862819898543624192,Totally forgot about Dogecoin.,1494547268,bxe1234,0,2,0,0,tweet
862819869066002433,Current approx. value of 1M DOGE in USD: $774.0852 values from vircurex + coinbase at 05/11/17 19:55 #dogecoin,1494547261,dogecointicker,1,0,0,0,tweet
862819679328362496,Rocking a 0.18ohm 5 wraps Fused Clapton around a 2.5mm bit in my DOGE 22mm on my Phantom tube mech mod! pic.twitter.com/ew3qL4yJ9W,1494547216,Phenix_Lodr,1,1,0,0,tweet
862819615184830465,Current value of DOGE in BTC: Vircurex: 0.00000042 -- Volume: 200654.54 Today's trend: down at 05/11/17 19:55,1494547201,dogecointicker,1,0,0,0,tweet
860265166201638912,OMG felicidades doge :),1493938173,ChrisLiuner,1,2,1,859840970086658048,reply
860158869233950720,I has doge again,1493912830,EuhedralCrystal,3,3,0,0,tweet
860101962070716418,I love #doge,1493899262,elleking135,6,2,2,0,tweet
860168297047760898,Am I the only one who pronounces Doge as [Dog-eh]? pic.twitter.com/7sGrEBpyel,1493915077,SheerSavagery,3,3,0,0,tweet
860246617726754816,Miss my doge so much  pic.twitter.com/emqvb5NmSg,1493933750,delaneydru,14,0,1,0,tweet
860225522936238080,"the doge meme died and came back as the infinitely worse 'heckin pupper', like some horrible new antibiotic-resistant disease",1493928721,Noontide108,14,0,0,860141818889072640,reply
860224560393793536,Happy May Forth! Cuddling with #StarbuckTheDoge who is the doge you're looking for. https://www.instagram.com/p/BTrus5sAZCZ/ ,1493928492,MnikaLee,24,0,3,0,tweet
860216519283888128,"Today has been *such* an excellent doge day. This is Charlie, followed by Bandit & THREE sleek whippets  #dogsatpollingstations #votegreenpic.twitter.com/WE6uR4B0Bh",1493926574,SBeattieSmith,24,1,3,0,tweet
860189086111457281,"#doge hits the bilateral ledger with #corda. such DLT, much wow @R3CEVpic.twitter.com/KGH8uJTv3A",1493920034,cschm1tz,9,0,7,0,tweet
860163169695797248,Cracking jokes or what! One who lost his memory remember moments he forget? Just to promote a song koi bhi scene daal doge kya! #kkb #zeetv,1493913855,Itswarnali,16,1,2,0,tweet
860118170425851904,"#DOGE/#BTC & #DOGE/#POSW trading pairs now available in our exchange!
 https://poswallet.com/exchange/doge_btc/ 
 https://poswallet.com/exchange/doge_posw/ 
$DOGE $POSW #Dogecoin pic.twitter.com/KUUoqCReIY",1493903126,XSNofficial,22,2,19,0,tweet
860117068334714881,"Wow
so pinchable 
such doge
#TeamShibapic.twitter.com/tHVZkN3Xee",1493902863,TheTylt,12,1,5,0,tweet
860113348498796545,Amigo riding shotgun and ofc brought along his fave ball for the ride pic.twitter.com/Gdhai4uWpY,1493901977,amigo_doge,28,1,3,0,tweet
860110549832663040,"Here's some pics of my Doge. She's almost 2 years old now, but puppy pics are the best pics. pic.twitter.com/0hCSJOZLEb",1493901309,anthonypit1,545,35,55,0,tweet
860093510879498240,Met a nice doge called Jed. He has a green collar #votegreen #greendogespic.twitter.com/Z5zqwVrA9V,1493897247,SBeattieSmith,9,1,3,0,tweet
860088067893362689,Yay first doge of the day! @SBeattieSmith @brennajessie_ #dogsatpollingstations @danheaped #activegreenspic.twitter.com/6UPhMlXqlk,1493895949,alysmumford,11,0,3,0,tweet
860016403251961857,I missed the end of TSM GAM but holy cow what a result. Play ins continue to be exciting! Can't wait to see what the Doge and crew do today.,1493878863,RiotQuickshot,125,0,2,0,tweet
860010705877032960,Nah it's an ALASKAN BULL WORM! https://twitter.com/imwiidinout/status/859956159473745920 ,1493877505,ur_doge,17,0,2,0,tweet
860006737314811904,"Parents in 2007: don't trust anything you read online!

Parents in 2017: Freedom Eagle dot Facebook says Hilary invented AIDS!",1493876558,big_red_doge,11,0,2,0,tweet
859998775229599744,"Don't miss your chance! 5% bonus live until 23:59 UTC 7 May

#encryptotel #bitcoin #litecoin #dogecoin #cryptocurrency #ethereum #btcpic.twitter.com/emC9mc6Doh",1493874660,Vindyne8,15,0,15,0,tweet
859994563133550593,"Yes, was pretty disappointed you sold because it was sure there will be a good pump ! $Doge To the moon ! pic.twitter.com/tJHsfdEFpR",1493873656,Bobo82Cur,2,0,0,845307709398433792,reply
859993641993068544,When you try to get a cute photo but doge is just too excite. #Choumori https://www.instagram.com/p/BTqFrxlFEBb/ pic.twitter.com/3dRHDpiMDE,1493873436,heatherfofo,35,3,1,0,tweet
859993340665667584,my bro gave me a doge coin purse last year and i've been using it to store my tampons so whenever i bring it to the bathroom it's just like pic.twitter.com/pluAIL8wu1,1493873364,ROBINS,19,1,1,0,tweet
859979669109604354,Foam swords are cutting-edge technology! Get a signed one from our cast - LIMITED perk! *Wow Doge approved #AllForS2 http://igg.me/at/A4OS2 pic.twitter.com/vCiSsaXzqL,1493870105,A4OSeries,22,0,9,0,tweet
859977537052606464,$DOGE up > 200% over the last 3 months... much wow!  pic.twitter.com/6bzmYnDQsC,1493869597,cburniske,15,2,3,0,tweet
859976085013798912,How can I just sit here and not pet this doge @dog_ratespic.twitter.com/oKBazNcKbN,1493869250,StarkSuicide,3,0,2,0,tweet
859973429948231680,"McCree Doge by @Outside_the_Vox 
Love this cute dog!
#cosplay #McCree #overwatchpic.twitter.com/SC4aK52YVN",1493868617,miccostumes,7,0,3,0,tweet
859966172552450052,"Just got into bed in the dark and stroked a pillow thinking it was doge.
I need to sleep now.",1493866887,Epwnaz,10,0,0,0,tweet
859966083255685120,"Charts I'm liking right now. $FTC, $AMP, $LTC, $DOGE, $XLM Almost every chart I looked at today looks ""Over Bought"" or ""Pumped""",1493866866,BitcoinDood,8,0,0,0,tweet
859958299667701762,@altbalaji aj #KTBM ka new epi de do pls!  or at least bol do kab doge. ,1493865010,SaeedNeerob,9,0,5,0,tweet
859954163236646912,ALL READY FOR THE MOON PARTY? $xrp $doge $ltc are breaking out  with you or without so get yours before the real PUMMP PARTYpic.twitter.com/JG3ojxxWMG,1493864024,cryptomocho,7,0,0,0,tweet
859949285772754944,It's time for a supply cap. via /r/dogecoin http://ift.tt/2pzluaZ ,1493862861,RedditDogecoin,0,0,1,0,tweet
859943896155119619,Such WOW! Just realized that we are almost at the peak of hour market cap at the moment! To ... - http://bit.ly/2p7D1Ub  #doge #dogecoin,1493861576,MuchCryptoNews,1,0,1,0,tweet
859943400191254529,"DOGE. @KevinHearne's mighty snorflehound, Sophie, glimpsed in flits and shadows.pic.twitter.com/M6QUSlfUTE",1493861458,ChuckWendig,74,3,8,0,tweet
859942300641894400,Unsuccessfully trying to get Pixel off my legs #dog #犬 #mameshiba #豆柴 #dogs #labrador #mix #doglover #shiba #shibainu #doge #cute pic.twitter.com/KZsRYISUBg,1493861196,pixel_tera,5,0,2,0,tweet
859935527721676802,This is a family website but once I get your deposit I will send you the full welcome packet. Send to superlegit@gmail.com,1493859581,King829,2,0,1,859912584924934144,reply
859930540736004096,My Dogecoin Correlation Indicator keeps my FOMO in check.,1493858392,_Kevin_Pham,5,0,0,859806058482515969,reply
859928401003646976,"Shiny Growlithe at 53 encounters! Jolly nature and has HA. Welcome to the family, Flame Doge. pic.twitter.com/X6Ld4H7Azn",1493857882,ShinyHunterAri,3,0,0,0,tweet
859925656737632256,"She's staying with me for a while 
#doge @ North San Jose, San Jose https://www.instagram.com/p/BTpmxuJjik0/ ",1493857227,WestQueenCircus,1,1,2,0,tweet
859923215233298432,HEY @VirtueNLHQ I HEARD YOU SAY CATS ARE BETTER! FUCK YOU BITCH CATS SUCK PUSSY! FUCK CATS NIGGA DOGE GANG!,1493856645,xducki,3,0,1,0,tweet
859923148044677120,Passing on condos unless we get desperate,1493856629,BigDavidMullins,0,1,0,859912584924934144,reply
859923035012333569,Redeem DOGE for Free! Scan the QR code below http://coinok.pw  #doge #dogecoin #faucet 2017-05-03 20:10pic.twitter.com/RxsQUKrAUo,1493856602,coinok,0,0,0,0,tweet
859922972198481920,A nice condo in an up and coming work/live district,1493856587,King829,0,1,0,859912584924934144,reply
859922635047800832,THE ULTIIMATE,1493856507,doge_king,1,0,0,859922577048969217,reply
859922496321077248,"Dogecoin Bubble Indicator:""Ether is barely outperforming dogecoin, it's a sign that ether is not the real story here"" http://bit.ly/2pF5S4n ",1493856474,_Kevin_Pham,2,1,0,0,tweet
859921509183303680,Offers my energy to the spirit bo-- I mean MFRP,1493856239,deer0sum,3,0,0,859892538999808000,reply
859921175589249024,です！！！！！！！！！,1493856159,kino445m,0,1,0,859914177757958144,reply
859920973654626304,Claim your #Dogecoin at #MoonDoge http://moondoge.co.in/?ref=ab34174b6cf1 pic.twitter.com/BLjdSs9thD,1493856111,ElizaRyenne,0,0,0,0,tweet
859920884085161984,ROBLOX #6: GET EATEN ... by DOGE? + Fart Dragon Taming!  (Fast Food on Wheels is Yummy Nummy!) https://youtu.be/lP81VsfcZLE ,1493856089,blackisbeauty75,0,0,0,0,tweet
859920763511427072,Current approx. value of 1M DOGE in USD: $708.101 values from vircurex + coinbase at 05/03/17 19:55 #dogecoin,1493856061,dogecointicker,1,0,0,0,tweet
859920719043452929,1390.01_bce___1503.25_bts___1513.60_krk___19.65__฿0.0141_bce_lc___21.50__฿0.0000_krk_lc____$0.00069_doge,1493856050,btcprice,0,0,0,0,tweet
859920509806366720,Current value of DOGE in BTC: Vircurex: 0.00000046 -- Volume: 1335.610426 Today's trend: up at 05/03/17 19:55,1493856000,dogecointicker,1,0,0,0,tweet
860892419704983553,ARYA NEEDS A BABY DADDY ANY DOGE VOLUNTEERS,1494087722,JacobWhitesides,3075,394,661,0,tweet
860911081434349573,"Me: ""There's no way you can lay down inside that chair""

Doge: ""Hold my beer..."" pic.twitter.com/56EKEk2aK0",1494092171,ObeyNicks,306,8,118,0,tweet
860979347792048128,"@Epwnaz for you! Or doge!
 http://imgur.com/gallery/81EXq ",1494108447,StitchingKitten,2,2,0,0,tweet
860848466997649408,My doge likes to sleep beside me cuz she loves me pic.twitter.com/HAmONhlhW5,1494077242,bxdtothebone,7,1,2,0,tweet
860937736747876357,$doge $xcp $xrp gona moon this week and,1494098526,cryptomocho,3,3,1,0,tweet
860941315361701888,What if $BCN is next $DOGE?,1494099379,Crypto_Coconut,6,2,1,0,tweet
860692831425482752,$DOGE market maker trying to shake out the competition. pic.twitter.com/hgiogZ2cqZ,1494040136,ThisIsNuse,45,3,7,0,tweet
860994389908234240,$doge is mooning right now with their total supply so I can't see why $bitb can't do the same in the near future & #BITB is a better #crypto,1494112033,cryptotrader85,7,3,3,860992516643934208,reply
860979190916685824,Its time again to walk the damn $doge pic.twitter.com/2TthDEvdJD,1494108409,alexander_haar,6,0,4,0,tweet
860974246117478400,Doge pic.twitter.com/ro5bLegrYg,1494107231,hiygay,14,2,0,0,tweet
860970785573416960,Chivas for muy $doge $xcp Gup position cherrspic.twitter.com/x22FfvPPit,1494106406,cryptomocho,5,1,1,0,tweet
860950893272997889,#dogecoin finally popped! How high will that $DOGE climb! pic.twitter.com/kKJTKu3424,1494101663,BitcoinDood,14,0,4,0,tweet
860945081896808448,Finished commission for @JustinWuffyWags with doge model by @tephrosapollyon! Thanks for commissioning! <3 http://www.furaffinity.net/view/23423822/ pic.twitter.com/i4P4kIyJE0,1494100277,Corvidius,46,2,10,0,tweet
860940966001332224,"My advice for now: $doge first target 83, second target 123 target",1494099296,Snappaz,5,0,1,0,tweet
860934227365289984,$DOGE pic.twitter.com/VnMtzphTEs,1494097689,onemanatatime,25,0,2,0,tweet
860923496016355328,"THAT WUZ A HECKIN GÜD WALK. 
#Menchi #doge #walkiespic.twitter.com/XvjnbI1xuE",1494095131,willsdarklady,4,2,1,0,tweet
860921748799270915,"#Menchi is on a mission.

#walkies @JessicaCalvello #doge  pic.twitter.com/fdjDFC9iPY",1494094714,willsdarklady,10,0,0,0,tweet
860921657879298049,My pup is in boarding while I'm in Paris and is hanging out with a doge. pic.twitter.com/DSxonAaOGr,1494094693,PezRadar,35,4,2,0,tweet
860912521670209540,Rehearsals with this group of friggin sweethearts for tomorrow night at The Ship. No set by doge unfortunately #sleeperyears #doge pic.twitter.com/uPvftB0G6H,1494092514,ian_foster,7,0,4,0,tweet
860904479864102912,[LIVE]  Doge flies to Colonia in @EliteDangerous! Join us on this EPIC journey as we try to make it in 1 stream! http://twitch.tv/wgrates pic.twitter.com/VA5VSPSMN5,1494090597,wgrates,10,0,6,0,tweet
860892419704983553,ARYA NEEDS A BABY DADDY ANY DOGE VOLUNTEERS,1494087722,JacobWhitesides,3076,394,661,0,tweet
860866679001239552,My dog is precious. That is all. #shibainu #doge #dogsofinstgram #dogstagram #lazymorning https://www.instagram.com/p/BTwStCtAh9A/ ,1494081585,BrittanyLaudaVO,15,2,2,0,tweet
860863297809154050,Doge pic.twitter.com/KynFdWEdJ6,1494080778,Cmashy13,16,0,0,0,tweet
860862212994473985,the water is cold...!!! so cute! #beautiful #photo #doge @DJCandari @KarineKareen @Gabriel_Mann @JillOhannesonpic.twitter.com/T3cO5QN89C,1494080520,PatieAzelot,3,0,1,0,tweet
