ID,Tweet,Time,User,Likes,Replies,Retweets,in_response_to,response_type
826155358272028675,"Once $DOGE pumps, that's when you know the #altcoin markets are in full throttle.",1485805761,CryptoHustle,25,0,8,0,tweet
826132081176694786,"Well @a_tiny_fox says ""Time to go get some balls!"" Then @edani_22 ""Bring some back for the Doge, he likes balls in his mouth. #PAXsouth2017",1485800211,wgrates,23,0,3,0,tweet
826130389462818818,One of my fav coworkers  had this for me when I arrived back to work. I'm crying. Smol!Doge to go in my purse!  pic.twitter.com/oOFdUA9ucd,1485799808,SuchFun_AreWe,4,1,0,0,tweet
826124959504281600,"Soon to be released Crypto Exchange #TIDEX Check them out http://tidex.com  ZERO FEES @Tidex_Exchange $WAVES $BTC $LTC $ETH $DOGE $DSH https://twitter.com/sasha35625/status/826113219244744704  <quoted_status> http://tidex.com  trading fees will be zero for foreseeable future, by the way. they will offer a new service model for crypto</quoted_status>",1485798513,fire_nze,3,0,5,826113219244744704,quoted_retweet
826119888183947265,"Opinion Polls also said Hillary winning chance 98% & Trump 2%
Rest is History
Aap jitna paise doge waise opinion poll manufactured ho jayega https://twitter.com/aashishsy/status/826119142856024064  <quoted_status>@RanaAyyub The opinion poll says that SP-Cong alliance is likely to get 187-197 seats, BJP 118-128 and BSP 76-86 .#ABPSurvey</quoted_status>",1485797304,rishibagree,70,5,38,826116386187534336,quoted_retweet
826101744635613184,I have created a separate folder for #Shivik now!! Pata nahi aur kitna photos hamare joli peh aap dal doge  #JNDSDpic.twitter.com/Gd2WKPmGzW,1485792978,vitharv_forever,9,0,1,0,tweet
826096071961088001,"When in doubt

Wolf out.",1485791626,Devil_Doge,25,1,15,0,tweet
826068803494739968,Its always a good day when theres a doge on my twitter timeline,1485785125,PzCoop,9,0,2,0,tweet
826068730132185093,#Bitcoin #Penguin #Casino | BTC LTC DOGE Gambling | 200+ Games! Game #59: Texas Hold`em http://bit.ly/BitcoinPenguin pic.twitter.com/Pfkc5oWbNP,1485785107,BitcoinAndBets,5,0,10,0,tweet
825997282696892416,"hey cutie, wanna kiss? #doge #wowpic.twitter.com/DLuWtB2gSU",1485768073,wowdogethedog,13,0,1,0,tweet
825938141072617473,Agreed pic.twitter.com/S3w1J1LJYo,1485753972,Doge_Master,11,0,1,825930129885032448,reply
825935814572007428,"20 minutes into :O and chill Heterosexuality is a captain america, dorito man. Heterosexuality is doge. Heterosexuality is lesbians.",1485753417,TumblrSimulator,56,1,23,0,tweet
825929424684118017, http://bitcoinsuccess.blogspot.co.id  faucet collection #ethereum #bitcoin #blockchain #dogecoin #xapo #satoshi #FinTech... by #BitSuccess,1485751894,CInvestisseurs,1,0,1,0,tweet
825921804883484672,found i perfectly cut flower on the ground infront of my door...creepy...so i gave it to my doge. pic.twitter.com/9Brs20N1ho,1485750077,alexxhankins,8,0,0,0,tweet
825916350098976773,aw my dad and my sis are opening up to the doge so much D'x,1485748777,jahh_mezz,2,0,0,0,tweet
825906714402758657,[TopFriends] @GhostSkunk @ChaseNocturne @speckled_doge @ArcticBigness @RoboMaximillion via http://affinitweet.com/ pic.twitter.com/MG77bLxIcB,1485746479,ZakFluff,4,1,0,0,tweet
825905980441579526,My crazy doge http://twitch.tv/psychoticowl pic.twitter.com/udhSUI4s9I,1485746304,_PsychoticOwl,4,0,0,0,tweet
825905489741496320,Just posting because I miss my doge pic.twitter.com/M6ufywEyuI,1485746187,kctritschler,7,0,0,0,tweet
825900356412571648,The #DogeCoin Daily Is Out! http://paper.li/DogeIsDead/1390413361?edition_id=a1ba9a70-e697-11e6-9402-0cc47a0d1605  #ganadinero,1485744964,DogeIsDead,2,0,1,0,tweet
825896025407754241,"I thought you were irrelevant, how comes your Twitter is still up?",1485743931,Typical_Doge,1,0,0,825875132803588097,reply
825888828288299010,"Woke up, heard doge, looked over to her usual spot and nothing. Looked under my bed and there she was snoring away pic.twitter.com/2a57DnddnL",1485742215,asianmigomi,8,0,0,0,tweet
825875391059488770,I feel so bad for this doge.. you're going to pet him till he's bald https://twitter.com/cole_elkins/status/825871251969363968  <quoted_status>Rewarded him for being a good boy. pic.twitter.com/1qBPFBxsUx</quoted_status>,1485739011,sean_marzec,2,0,0,820823703311314944,quoted_retweet
825875199832817665,"S/O and thank you to @HL_Linkoln for letting crash and even making breakfast, you the man! You have improved quite a bit! Also, doge <3 pic.twitter.com/UgsjthlINE",1485738966,GNOXssb,8,3,0,0,tweet
825870245835452417,"Mein Setup straight out of bed. :D
#rbtv #wwe #royalrumble #doge pic.twitter.com/EfSa8MX6Sm",1485737785,RealAngel85,5,0,0,0,tweet
825869275994927106,*waits for Trump supports to google what xenophobia is*,1485737553,big_red_doge,3,0,0,825869146835603457,reply
825869146835603457,"If you still believe Trump was really the right person for the job, you're probably a xenophobic illiterate that isn't able to read this.",1485737523,big_red_doge,5,1,0,0,tweet
825858383970521089,@Eland_V we already got this child and we want a husky or German shepherd for second doge pic.twitter.com/2F9pLGRhCh,1485734957,dudeitsneps,3,0,0,825851021456977921,reply
825857617130045440,"James ""Peeved Doge"" Mattis",1485734774,JJEmpire64,2,0,0,825828458274123777,reply
825857440650559489,Thanks @Kierabridget my entire notifications are filled of doge memes :),1485734732,badbihbutera,2,0,0,0,tweet
825856262218903552,doge! pic.twitter.com/45xh72Vh7D,1485734451,newyork808,2,0,0,825806076436099072,reply
825856199434309633,"goodnight, my sweet doge pic.twitter.com/c1B4gu9UNK",1485734436,xryuuchii,0,0,0,0,tweet
825856050687389696,Current value of DOGE in BTC: Vircurex: 0.00000022 -- Volume: 1525.53 Today's trend: stable at 01/29/17 18:55,1485734400,dogecointicker,1,0,0,0,tweet
818855520819875840,Not sure if it's the  but I'm not the only old school #Dogecoin #shibe back ...They are reforming teams on Reddit. Much rebrand?,1484065344,bitcoinbegger,5,5,3,0,tweet
818938844133412873,doge pic.twitter.com/GzNDqASQBh,1484085210,touchmyclem,21,1,2,0,tweet
818925186066116613,Prince meets baby Doge @AND_IM_GONE pic.twitter.com/rvFfVuP12g,1484081953,iCrazyTeddy,359,3,27,0,tweet
818720826061180928,"""Hey guys Dare Doge here."" pic.twitter.com/UeHezWo6gY",1484033230,joshpygmy,10,4,3,0,tweet
818960537195253760,look at this ridiculous C19th doge that I have inexplicably fallen in love with. pic.twitter.com/VRgsO2IH7V,1484090382,girlhermes,5,4,0,0,tweet
818947332515528705,Cutest doge ever. Such butt. Much attack! pic.twitter.com/IGDocCkZcm,1484087234,MattDethridge,23,2,4,0,tweet
818947281617616898,Doge pic.twitter.com/4kMtRxi22T,1484087221,aluxjamez,33,1,0,0,tweet
818927934085865473,"21/20

Good doge https://twitter.com/Fichty_/status/818926185694580736  <quoted_status>Salut hardur tu peux noter mon chien sur 20 ? pic.twitter.com/BrbNwyLd4r</quoted_status>",1484082609,Hardisk,49,8,7,818925726833459201,quoted_retweet
818921257282445312,"As long as doge is fine, ill go live once i get home. You havent seen the end of me today",1484081017,Faux_Freedom,23,2,0,0,tweet
818904260469551104,LIKE if these never get old. Corgi vs. Lemon #Doge #HappyTuesdaypic.twitter.com/aCrEvsdAgJ,1484076964,BeerRightNowSF,14,0,9,0,tweet
818901279196020738,"Everyone at 1015 is sick, even doge",1484076254,ColeMetzler,5,0,1,0,tweet
818871661743263745,"At the least, a new doge+baby meme pic. At the most, the cutest picture ever taken on earth. pic.twitter.com/SH2lcSlt0M",1484069192,awwwthatscute,14,0,4,0,tweet
818865130754703360,Much nap. So excite. Sleepy doge. http://ift.tt/2icF2uL pic.twitter.com/EGOqKdtSJy,1484067635,wistia,4,0,0,0,tweet
818863560323399681,"Since I've met tori, the quantity of dog content on my twitter has risen close to 300% @frecky13 #TheDawgMother #Doge",1484067261,ChiknTurtlToast,11,0,1,0,tweet
818844933368979457,"Doge's Palace (Palazzo Ducale), Venice, the courtyard via @monica_gre |@BeautyfromItaly @mariamuser #Italy pic.twitter.com/U134H9hspt @MakMakay",1484062820,chinneolhungdim,3,1,4,0,tweet
818826476523028481,remember doge? no one talks about doge anymore .. much sad pic.twitter.com/jIBn57Ut52,1484058419,Alyvandy,8,0,1,0,tweet
818823289095278592,Check out this awesome tutorial on how to stream as Doge with OBS setup by McTrousers! https://www.youtube.com/watch?v=suuCZhT4H28&t=215s  ^.^,1484057659,FaceRig,7,0,2,0,tweet
818733376320442368,the only thing that can stop doge is a full communism with a high noon,1484036222,TumblrSimulator,36,0,16,0,tweet
818694199222538240,Pig and mag doge pic.twitter.com/UfKzqY7u8B,1484026882,traviskobab,8,0,1,818679443908542465,reply
818692336209297409,".@filmfare Real Nahi Bikau Hai..
Paise Doge Toh Award Denge.. Warna NOTHING !!
@jiteshpillaai 
FILMFARE AWARDS ON SALEpic.twitter.com/U6jy0DUFDa",1484026438,AkkiGulshan,25,1,41,0,tweet
818672520438120448,okay now that i'm done crying over doge memes to the point where all my friends are concerned i'm gonna go to sleep,1484021713,kenzielawlerr,2,0,1,818649809909334018,reply
818668388792881153,Spending my nights playing Roblox pic.twitter.com/bazYZXgWqS,1484020728,Typical_Doge,2,0,0,0,tweet
818665533780398080,Sleepy pupper fell asleep under stuffed doge. Exceptionally good girl. 14/10 pic.twitter.com/5gHK7Kjn2g,1484020047,poling97,8,0,0,0,tweet
818664463951794178,"#MCM Forever! Thank you for bringing me my four favorite things yesterday! Those roses, that pizza, our doge, and that   #InLovepic.twitter.com/Fnuek7o2Pg",1484019792,CecytheCow,25,2,2,0,tweet
818663443557400577,My awkward doge can't figure out how to sit on couches pic.twitter.com/MksFzMcXcS,1484019549,Meg_Howell,14,0,0,0,tweet
818663271377018883,Doge w corn on his head https://twitter.com/garyfromteenmom/status/818522826969907201  <quoted_status>choose your fighter pic.twitter.com/1O5t2HqFcb</quoted_status>,1484019508,NOTHINGSXWRONG,2,1,0,818522826969907201,quoted_retweet
818662903418998786,Well that's it from me @danspeak_ Head to http://mavsmoneyball.com  for post game goods and my twitter page to see mostly tweets of my doge.,1484019420,mavsmoneyball,4,0,0,0,tweet
818658499026567169,@HellaKittey woulda beat the shit out that doge,1484018370,Metalfacedan,4,0,1,818652998972932098,reply
818653739091365888,S/O to my doge @LouisNiemerg for coming to see me before he goes back to college #kewlkewl,1484017235,Evan_schlink,4,1,0,0,tweet
818653155844096001,How on earth Trump can fire 89-year-old #CharlieBrotman after announcing ELEVEN INAUGURATIONS is beyond me.,1484017096,Colonial_Doge,75,8,39,0,tweet
818652550144495616,and doge pic.twitter.com/zaBGBL0dEF,1484016952,taydert0t,35,1,0,818652328156725248,reply
818652179007356928,"My dad walks in to the kitchen

""I'm a DFF. A doge friend forever""

And then walks out.",1484016863,mcdoge,13,0,0,0,tweet
818638792085082115,Doge finds 7 bones in the yard with @Kintinue in 7 ways to die! https://www.twitch.tv/wgrates  @wgrates Monday Night Twitch Live!!!,1484013672,HuntikFan1017,2,0,0,0,tweet
818633852570566656,My famous doge <3 https://www.hit.com.au/news/national/these-were-the-most-popular-dog-and-cat-names-in-2016/ ,1484012494,shancake_,2,0,0,0,tweet
818628171742330880,me doge pic.twitter.com/vLCUbWfCAL,1484011140,mikiteapls,9,2,1,0,tweet
818626621808644096,"Yeah, I don’t know why DOGE was necessary for this article either.. https://twitter.com/PressStartAU/status/818626553852461056  <quoted_status>7 Things Nintendo Needs To Fix To Make The Nintendo Switch Successful http://press-start.com.au/features/2017/01/10/7-things-nintendo-needs-fix-make-nintendo-switch-successful/  pic.twitter.com/ExplDvapgf</quoted_status>",1484010770,shancake_,8,2,0,818626553852461056,quoted_retweet
818623936321769474,Please kick their smug asses @UnlimitedTide @doge_e_fresh @rizolltizide,1484010130,ThatBoysGood,4,1,1,0,tweet
818620045999927297,Brb redeeming @One_T_pic.twitter.com/Hkwe4M0WQ7,1484009202,b4_zod,2,0,0,818612027287539713,reply
818616610646695936,Cute video of doge takes quite the turn. pic.twitter.com/Bj0Tngz1yn,1484008383,TheNo1Alex,50,2,0,0,tweet
818610743553691648,hey guys #doge #wowpic.twitter.com/CArKDiVAD2,1484006984,wowdogethedog,8,0,3,0,tweet
818610687861751814,pic.twitter.com/Z2oiksQgmh,1484006971,Cassetticons,1,0,0,818609958535237632,reply
818610602121699328,"Because THEORIES. RANTING. SHIPPING FASCINATIONS.

Axel x Roxas forever, as the only two quality KH characters.",1484006951,Wahsune,0,0,0,818609777907355648,reply
818610177519812608,Why would you do this,1484006850,speckled_doge,0,1,0,818609777907355648,reply
818609958535237632,BROTHA NEEEEEEEEEEEEEROOOOOOOOOOOOOOOOOOOO,1484006797,doge_king,0,1,0,0,tweet
818608603141701632,"we need to find a doge friendly event, Bebop wants more malware hunting canine companions",1484006474,timstrazz,1,0,0,818606755030695936,reply
818608546749157378,Current approx. value of 1M DOGE in USD: $218.0184 values from vircurex + coinbase at 01/09/17 18:55 #dogecoin,1484006461,dogecointicker,1,0,0,0,tweet
818608304930758656,866.81_bce___897.32_bts___905.01_krk___4.16__฿0.0048_bce_lc___4.48__฿0.0000_krk_lc____$0.00024_doge,1484006403,btcprice,0,0,0,0,tweet
818608293639659520,Current value of DOGE in BTC: Vircurex: 0.00000024 -- Volume: 1320901.32911228 Today's trend: up at 01/09/17 18:55,1484006400,dogecointicker,1,0,0,0,tweet
823770174654476289,r u a stinky doge pic.twitter.com/3N83GsVkVV,1485237089,Josue_xx_,2,1,2,823769617646632960,reply
823899167923773442,Finally a shoutout for dogecoin! #blockchainweek,1485267843,Ben_Hannigan,2,2,0,0,tweet
823835587702464512,Adventure Quest Doge?,1485252684,LostTimez,2,1,0,823835442717962240,reply
823790944604614657,"Courtyard of Doge Palace, Venice via @JenniferLiving7 #travel #Italy #artpic.twitter.com/Cqo6nb9tch",1485242041,BeautyfromItaly,146,3,82,0,tweet
823880194121486338,Here is a picture of my doge having pub lunch  pic.twitter.com/wbKbeJ8Ie1,1485263319,BeccaRoseTweets,155,2,10,823878691222650881,reply
824021469348773888,The bridge of sighs in #Venice is part of the Doge's Palace tour. Learn more: http://bit.ly/2koQlBw  #travel #italy #TravelTuesdaypic.twitter.com/zHuYiFJ1vv,1485297002,yellowvantravel,24,0,11,0,tweet
824015725249568769,RT if you go from comatose to bitch in 3 seconds flat. pic.twitter.com/9pHS5BB69H,1485295633,doge_king,23,1,44,0,tweet
824013041612324865,My doge is very smoosh pic.twitter.com/1gOUfTc01l,1485294993,Lunalovebadxo,80,1,2,0,tweet
824010616344104960,I surprised my brother with a doge shirt and apprently he cried when he got it i love him so much pic.twitter.com/zjaG7VbpN8,1485294414,MaddyBarron98,9,1,0,0,tweet
823970256532176896,Mud still foolishly hoping article 50 isn't triggered. #doge #wowpic.twitter.com/4uN9o4T8WN,1485284792,wowdogethedog,9,0,1,0,tweet
823968578303037440,Doge. pic.twitter.com/8RXd6DkP2Y,1485284392,J_Sanchez16_,8,0,4,0,tweet
823967030567124997,"If I don't check at least 5 forms of social media as soon as I open my eyes, did I really even wake up?",1485284023,big_red_doge,15,0,1,0,tweet
823965704772788229,"doge b seeings senior ALA councilmembers amaze complain 
    bout snek people brarians 

 pls no wow generalize 
friendly noodles #alamw17pic.twitter.com/wgk4L9SDko",1485283707,Dogebrarian,7,0,2,0,tweet
823965155889442817,I would never do such a thing. Thus I am the better doge,1485283576,Bumi_Bandias,23,1,2,823657641993977857,reply
823956533985812480,My pupper is borking like a crazy doge. Please let this be a sign that the mailman is delivering my PC parts! pic.twitter.com/cMvE3YEIGF,1485281520,TradeChat,53,3,0,0,tweet
823932707751268354,Pfp for dat random doge.... Can someone tag the bch pls jkjk tag the doge pls @DefaultSyn pic.twitter.com/2zadCXmz60,1485275840,enricogill692,9,1,2,0,tweet
823930602458120192,#Bitcoin #Penguin #Casino | BTC LTC DOGE Gambling | 200+ Games! Game #54: Meme Faces http://bit.ly/BitcoinPenguin pic.twitter.com/j0gqaMsFvA,1485275338,BitcoinAndBets,10,0,8,0,tweet
823918486686679040,Doge pic.twitter.com/TPVvm4RRyb,1485272449,abiyorke,14,1,0,0,tweet
823904742720081920,Super Happy Shibe #doge #wowpic.twitter.com/LSha5RY063,1485269172,wowdogethedog,8,0,2,0,tweet
823886852621012992,"Gonna post doge every morning now because who doesn't need cute fluff demons?
Day 1 is mid-yawn cuddles wat is your face r u ok
#morningdogepic.twitter.com/8DmCYHRcHa",1485264907,Epwnaz,63,3,8,0,tweet
823880194121486338,Here is a picture of my doge having pub lunch  pic.twitter.com/wbKbeJ8Ie1,1485263319,BeccaRoseTweets,155,2,10,823878691222650881,reply
823820654160072705,"Might be the best thing ever, @wgrates you lewd doge  pic.twitter.com/Q4ygIetDJl",1485249124,xEvilaOfficial,9,3,0,0,tweet
823816930272415746,this is an absurdly strong lineup for a single weekpic.twitter.com/O5IR3MzsLW,1485248236,doge_king,4,0,4,0,tweet
823810523137310722,I've decided I need a doge.,1485246709,hamontecha,8,0,0,0,tweet
823805966739185665,"According to @CoinMarketCap , GNT just eclipsed @dogecoin in market cap. Such wow. Really!",1485245622,golemproject,45,2,24,0,tweet
823797267828088832,"ITS DOGE DIMMADOME, OWNER OF THE DIMMSDALE DIMMADOME pic.twitter.com/RmdE41CTrp",1485243548,TravusHertl,22,2,6,0,tweet
823790944604614657,"Courtyard of Doge Palace, Venice via @JenniferLiving7 #travel #Italy #artpic.twitter.com/Cqo6nb9tch",1485242041,BeautyfromItaly,146,3,82,0,tweet
823787429048057857,Get ready for the Ballo del Doge 2017. Reserve now: http://lux.ht/2jgyAXv  #hoteldanieli #CarnevaleVenezia2017 pic.twitter.com/vVYA7CYh5I,1485241202,HotelDanieliVCE,3,0,2,0,tweet
823787297720004608,"Much doge, such live
 http://Twitch.tv/artStar_x pic.twitter.com/RVZKmeByDG",1485241171,LynnieNoquez,33,0,1,0,tweet
823772765580881921,"Oh doge, if you only knew what was on the other side, you water-hating fool. #StarbuckTheDoge https://www.instagram.com/p/BPouWDEAAEm/ ",1485237706,MnikaLee,19,3,0,0,tweet
823770174654476289,r u a stinky doge pic.twitter.com/3N83GsVkVV,1485237089,Josue_xx_,2,1,2,823769617646632960,reply
823739628742123521,this is my friend's shiba inu. aka doge pic.twitter.com/KqIpJsM1c6,1485229806,swannyszn,4,0,1,823737431883206656,reply
823738010185461760,Host and ghosted @NixxyPlays after getting some work on this little lit af doge #crossstitch #wip #thisisfinepic.twitter.com/gMPiq9MuO4,1485229420,MotoRuxin,9,1,1,0,tweet
823725461284847616,My doge enjoys the cowboy bebop OST v much.,1485226428,MISCHlEF,8,0,0,0,tweet
823722005681704960,omg the doge hat i own the're not making them anymore,1485225604,S0CKY,7,2,0,0,tweet
823704522266591232,"Finished a good bit of the doge pillow!
Ty all for today
We raided @MotoRuxin 
 http://twitch.tv/motoruxin 
#CrossStitch #TwitchCreativepic.twitter.com/JLW8jcoWop",1485221436,buubuukitteh,7,0,2,0,tweet
823703365074976770,Petulant child doge pic.twitter.com/yvyW9iZiQZ,1485221160,Epwnaz,14,5,2,0,tweet
823691625884975110,Can I get a shout out?! @JEGSPerformance @CorsaPerf @SRTporn @Doge_cahger @driveSRT @srt @Moparunlimited @OfficialMOPAR @mopar pic.twitter.com/utpnRXwIqG,1485218361,joshark501,11,0,2,0,tweet
823683288950652928,Whose doge? pic.twitter.com/cwCt7Zzdh2,1485216374,iCrazyTeddy,367,11,17,0,tweet
823681754678456320,"Very Doge! ""Borzoi"" http://dp.la/item/3d9dcf1af801ae9becd220723749000c ",1485216008,HistoricalDogs,0,0,0,0,tweet
819989103127228416,"Kinda want a 6 speed doge dart, but kinda still delivering pizzas",1484335611,Drewsky165,2,2,0,0,tweet
819926300500590592,I agree that I am not that funny and witty... Neither handsome nor rich.. But that doesn't mean ki mujhe rt nahi doge.. ,1484320638,Capturing_lives,7,4,12,0,tweet
820039052611227651,What in tarnation doge is what is getting me through this week,1484347520,grayson_travis,11,1,0,0,tweet
820028728570851328,"I'm not a big fan of selfies, so here is me as a doge with my new hair colours. pic.twitter.com/5QkXwPztH6",1484345058,AnimatedErica,21,2,1,0,tweet
820021300387282944," http://TuxExchange.com 
Free #doge for new users
25 #SYS per 0.05 #BTC volume
0% maker fee
#btc #bitcoin #blockchainpic.twitter.com/DkcHS0pr1x",1484343287,bitpython,5,0,3,0,tweet
820011227304828928,thankful for my wonderful doge who will lay & cuddle with me when i'm sick  pic.twitter.com/gDX6h0IHEH,1484340886,quingarbett,9,0,0,0,tweet
820001150107676672,This doge is making this Friday slightly better mon pic.twitter.com/6yUz8H55SM,1484338483,myclue,11,2,1,0,tweet
819970651318616065,"doge b such cryings little
   what do w/o Uncle Joe?
  one of bestest politicians
feel lostness w/o him pic.twitter.com/GX4fpd3uZz",1484331212,Dogebrarian,25,0,0,0,tweet
819964821546422272,"5 years ago on this day, from her home she called me and said ""ghar me koi nahi hai, mere liye ek kilo seb la doge plzzzzzz?""",1484329822,zZoker,16,3,8,0,tweet
819959774108385280,WHAT BREED IS THIS DOGE https://twitter.com/sophie_aitkennn/status/819295048995061770  <quoted_status>Look at his permanent smile like I just can't pic.twitter.com/Yzka3lpdDm</quoted_status>,1484328618,fabuloushannahh,231,4,10,819295048995061770,quoted_retweet
819956100795695111,My new favorite meme is upset southern doge,1484327743,klynnhendrsn,11,1,2,0,tweet
819951836895543297,I can't believe Shiba Inu's haven't gotten their name legally changed to Doge yet smh,1484326726,igotsour,10,0,9,0,tweet
819924054484336640,This is equally as ridiculous as college kids needing a safe space cuz TRUMP was wrote in chalk on their sidewalks. But I’m just a dumb doge https://twitter.com/APSouthRegion/status/819620378658177026  <quoted_status>A #Georgia police officer says 'Black Lives Matter' was written on his box of @krispykreme doughnuts. http://apne.ws/2iLRDqc  pic.twitter.com/DSxeDXNILJ</quoted_status>,1484320102,geauxcrimson,9,1,0,819620378658177026,quoted_retweet
819911733091385344,#Bitcoin #Penguin #Casino | BTC LTC DOGE Gambling | 200+ Games! Game #50: Red Dog Poker http://bit.ly/BitcoinPenguin pic.twitter.com/uYXOtQPykj,1484317165,BitcoinAndBets,3,0,5,0,tweet
819898049807917060,What's a Doge? You'll find out on the legendary #Venice tour http://bit.ly/2j7r3IX  via @tompalladioink #takewalkspic.twitter.com/LMbEr7oWrT,1484313902,Walks,5,0,2,0,tweet
819861946019168256,There's nothing better than coming home 2 your doge n transforming your mood to the best thing on earth because your dog is fucking adorable pic.twitter.com/OLvhXKM9Ym,1484305294,JohnHaisman4,22,1,0,0,tweet
819841393711607808,"#London #snow doge is here to save you all from #Snowmageddon!

#SnowWatch #NoSnowpic.twitter.com/nNAFhiqhFO",1484300394,snowwatchLDN,3,0,8,0,tweet
819823724308340736,Good morning pic.twitter.com/xvqDXzV1iw,1484296182,amigo_doge,57,1,8,0,tweet
819793453718519809,Super #doge Much Skill Best Stickie https://twitter.com/TheWorldOfFunny/status/817503412543688704  <quoted_status>When you have to do something cool because your crush is watching https://vine.co/v/ixYLZOe9h0w </quoted_status>,1484288965,bcSharonZ,6,0,2,817503412543688704,quoted_retweet
819773598457991169,"Really @Twitter @verified, this doge @GustlTweets has his own gifs!! #DogCelebspic.twitter.com/86azDm98rS",1484284231,deedeedott,34,0,4,0,tweet
819766477662265346,Mini doge https://vine.co/v/5MgepdVO6wx ,1484282533,dognkitty,18,0,5,0,tweet
819764200524365825,#DogCelebs is trending! That's why @Twitter should get @GustlTweets @verified! He's the official #LAKings doge.,1484281990,deedeedott,8,0,2,0,tweet
819757756257169408,"Meds: 
Comfy bed: 
Stuffed doge for cuddles: 
Tired and fighting sleep out of the need to verify that it is okay to sleep this early: ",1484280454,mxdarkwater,7,1,0,0,tweet
819756115177205760,doge pic.twitter.com/yojXloZFra,1484280062,matt_studer,2,0,1,819604035300945922,reply
819753284881686533,free ethereu every 20 minute https://goo.gl/78O6jm  #ethereum #bitcoin #blockchain #dogecoin #crypto #satoshi,1484279388,b2o101,3,0,1,0,tweet
819752182937423879,@ShinsukeN Glorious Doge Roode pic.twitter.com/0LYM56xA16,1484279125,JJWilliamsWON,8,0,2,0,tweet
819746892695433217,The what in tarnation doge meme is the best thing to ever happen to me,1484277864,marissa_hedrick,9,0,4,0,tweet
819744822105772032,"once, in a land far away, there was a doge. And it go woof. And that's why you should feel better. pic.twitter.com/kYZXo7cmav",1484277370,Bearpocalypse13,3,1,0,819743017053523968,reply
819739199737708544,New shiba pin looks so meta on my 3 Doge Moon shirt pic.twitter.com/VkMbxvMWTQ,1484276029,ThornwolfArt,6,0,0,0,tweet
819737046130556928,Home is where the wifi connects automatically (Salty Doge),1484275516,eliseengle,14,0,0,0,tweet
819731271005913088,"$DGB on the right, $DOGE on the left:
Wtf are we waiting for?!
#MOONpic.twitter.com/0ahr5sqECn",1484274139,altcoinsking,11,4,2,0,tweet
819721356313063424,I know everyone says this about their pets but this small doge is the smartest and cutest around town. Come at me and him,1484271775,uh_kahsh,4,0,0,0,tweet
819718482111696896,When did the PoTUS become a fucking ad agency. This shit should be illegal. https://twitter.com/realdonaldtrump/status/819541997325316096  <quoted_status>Thank you to Linda Bean of L.L.Bean for your great support and courage. People will support you even more now. Buy L.L.Bean. @LBPerfectMaine</quoted_status>,1484271090,big_red_doge,3,0,1,819541997325316096,quoted_retweet
819711200317603840,Officially enlisted as of today ,1484269354,big_red_doge,19,0,0,0,tweet
819705736175325185,my new fav Doge  pic.twitter.com/9FHRL5NcXA,1484268051,DJTektrix,5,1,4,0,tweet
819703153276788736,"Deresute categories explained:
Cute: doge
Cool: that photo of a dog leaning over a doghouse all ""sup""
Passion: sexy hotdog halloween costume",1484267435,johnnylandmine,2,0,1,0,tweet
819702992513499137,brother has doge on stream  pic.twitter.com/l8svToXLmV,1484267397,AllysGotGame,5,0,0,819681176466100224,reply
819698601983098880,"Oh god, kisne jail dala @TeamBaniJ ko? They made you stand for several hours toh jail mein daal doge? Haramzaadon

I Stand By Bani https://twitter.com/vjbanifc/status/819697123751067648 ",1484266350,dilpreeeeet,63,4,37,0,tweet
