ID,Tweet,Time,User,Likes,Replies,Retweets,in_response_to,response_type
632702607014805504,Rainbow Dash is not cute. Sorry not sorry.,1439683031,CaptainBlitz_,2,3,2,0,tweet
632702774564769793,"I hope The Incredibles 2 is about grown up Dash, Violet, and Jack Jack, and the next generation of super heroes",1439683071,2Girls1Rico,3,0,6,0,tweet
632701669755719680,@Ryyyyyyyyyyyy69 @ethanflick he looks like dash here  pic.twitter.com/PVpYmg4QEb,1439682807,bethiegorggence,10,0,1,632700593123909632,reply
632698700410699776,Tune in Today 5-7pm pst #viberoom on BeatJunkieRadio @djnack @DJLADDA @djbounz @djgonz @djnvs @TXScratchLeague #dash pic.twitter.com/FXYYli1ySc,1439682099,BEATJUNKIES,13,0,10,0,tweet
632697715080720384,"i hate it when u see a fanfiction on ur dash and its got some weird exotic name like stfu up ur not "" pandora or amethyst"" ur names deb",1439681864,existentiaIly,26,1,7,0,tweet
632697614081892352,David Marshall had a dash of lemonade with his Rosè cos he had training in the morning,1439681840,AntonyCatris,5,1,0,0,tweet
632694755730812928,when jim morrison is on ur tumblr dash *sniff* fukck mey up,1439681159,maybeimtheone,4,0,0,0,tweet
632693607003107328,The dash cam car will be auctioned to help this family deal with infant cancer & medical expenses. #9newspic.twitter.com/H8zxwWkkge,1439680885,9Storytellers,3,0,3,0,tweet
632692876888141824,.@JWPeezy4 doubles in @eddyalvarez90 and the Dash extend their lead to 5-0 in the 5th!,1439680711,WSDashBaseball,7,0,3,0,tweet
632689076857118720,"Final line for Carson Fulmer: 3 IP, 0 H, 0 BB, 2 K.  Dash lead it 4-0 in the 4th with @jakecose on the mound",1439679805,WSDashBaseball,18,0,13,0,tweet
632688503139102722,My dash is covered in Tom Hardy gifs and I am suffering. I must see legend.,1439679668,ghostsjogging,6,0,0,0,tweet
632686093314457601,i saw a cute mushroom on my dash n i couldn't resist.... pic.twitter.com/MAux6aHlXn,1439679094,chesikitty,3,1,1,0,tweet
632684429169807361,"/liking every single ""your bucky"" edit on my dash so i can reblog them",1439678697,soldieronbarnes,4,0,3,0,tweet
632683428148674561,The dash cam car is about to be auctioned for charity to help a little baby girl with cancer. #9NEWSpic.twitter.com/WQYjNJki8x,1439678458,9Storytellers,7,1,6,0,tweet
632682341920444416,Dame Dash pic.twitter.com/RNMazQDPM6,1439678199,justkxdding,7,0,1,0,tweet
632682018166415360,Doin this feature with Dash August 25 is the release of #VonDupreeEP releasing on https://instagram.com/p/6a8UhqFwqr/ ,1439678122,VonDupree,3,0,3,0,tweet
632678724874309632,[VIDEO] Cast of #StraightOuttaCompton x @Dash_Radio Interview with @JulioG1580KDAY http://youtu.be/qSOjdQw346I ,1439677337,SKEETV,3,0,5,0,tweet
632677423583227904,Clock on the dash says 3:35 there’s plenty of gas and the night’s still alive.,1439677027,LBryanLyric,8,0,1,0,tweet
632676644344369152,"'16 OF @AndrewSexton3 has the tools
- 87 mph exit velo 
- 6.59 60-yard dash
- 83 mph OF velo http://www.prepbaseballreport.com/profiles/OH/Andrew-Sexton-0792536841  pic.twitter.com/PnhRTqutvJ",1439676841,PBR_Ohio,8,0,1,0,tweet
632674482155593728,This guy hacked the Amazon Dash buttons to do what he wanted - using packet sniffing and some code. http://bit.ly/1MtZ5C4 ,1439676325,krelnik,3,0,4,0,tweet
632671913509322752,"Prerounding shouldn't be a chaotic mad dash to gather as much info as possible. It should be an organized, systematic approach.",1439675713,medschooladvice,12,1,6,0,tweet
632668514277568512,The #14UNTDP kicks off tonight's workout at the National Training Complex with the 60-yard dash. pic.twitter.com/2awIRQ6PPB,1439674902,USABaseballNTDP,9,0,3,0,tweet
632665872004321280,"#DashEmojis
: Dash at Salem
: 6:05p
: http://www.wsdash.com/broadcast 
: TuneIn
: RHP Carson Fulmer
: W-S is 1st in CL to 30 2nd-half wins",1439674272,WSDashBaseball,5,0,3,0,tweet
632655283093958656,Balloonists call this dip into Lake Boon #Stow  a 'splash and dash'.  #Hudson Balloon Fest: http://bit.ly/1JajWru pic.twitter.com/4XA038Z3Yj,1439671748,kmcgaghMWphoto,5,1,5,0,tweet
632650327385313280,"Well, look who's cutting a dash in Uncut's The History of Rock 1966 - it's only Reggie King! pic.twitter.com/4k3vd3gzGt",1439670566,MonkeyPicks,13,1,6,0,tweet
632649503775019009,"The best photos of my boy, ever. Thanks @MandyCaudill  superhero Dash is your biggest fan, @JDayGolf !pic.twitter.com/FDYmDPUem6",1439670370,ellielaneday,61,1,3,0,tweet
632649325580058624,pK join the lobby and goes who's rT even though they get smashed and there team mate dash boarded pic.twitter.com/6ae7YhpHRa,1439670327,TheGeordieGirl,5,0,2,0,tweet
632648937103622144,80% of today has consisted of Mario Kart Double Dash with @MavidDateyka,1439670235,AweemaWeise,7,0,1,0,tweet
632647536600223744,"Barber: what you want?
Dash: just fuck my shit up fam
Barber: say no more pic.twitter.com/wCYNDD7XJw",1439669901,dadxmemes,4,0,3,0,tweet
632643979868250112,@Prospects_IN sched 8/16: 8:30-9am Registration - 10am 60 Yard Dash - 10:15am IF - 10:45am OF - 11:15am Catcher Pop - 11:30am BP - 1:30 Game,1439669053,ProspectWire,4,0,8,0,tweet
632643140931989504,"Powerful dash cam video shows an Ohio State Trooper fighting to save a driver’s life
 http://shout.lt/9MwH pic.twitter.com/FrlEtfS8ik",1439668853,waff48,9,0,14,0,tweet
632639284525318144,"Nantz with the PRE-ROUND mention of Jason Day and ""his wife Ellie, and son Dash"" just made my day.",1439667933,NoLayingUp,48,3,1,0,tweet
632636968241876993,"Protip: When police won't release body/dash cam video, it's because it incriminates them. http://www.nydailynews.com/news/national/s-investigators-refuse-release-video-shooting-article-1.2326906 ",1439667381,jkfecke,2,0,3,0,tweet
632636160888606720,"Dash cam footage captures an Ohio trooper’s fight to save a driver: ""Don’t you die on me."" http://link.wreg.com/1MqqXp1?utm_source=twitter_3onyourside pic.twitter.com/9KosyWX8jM",1439667189,3onyourside,7,1,5,0,tweet
632634094271250436,And that might be one reason @senecapd are refusing to release dash cam footage showing #ZacharyHammond's killing http://www.nydailynews.com/news/national/s-investigators-refuse-release-video-shooting-article-1.2326906  #PT,1439666696,MaxBlumenthal,24,3,48,632633589927120896,reply
632633951711023106,"Happy birthday Dash, you've come a long way #throwback #FirstStepspic.twitter.com/9bVZyTX6bv",1439666662,AbbyMcleanxo,25,1,2,0,tweet
632633092444934144,Mad dash to Hole 18 at the #PGAChamp. From where are you watching? Share using #SapphireOnLocation.pic.twitter.com/L0EMfOuwXv,1439666457,Chase,7,1,2,0,tweet
632623804552843264,Took a break from digital and drew a Rainbow Dash on one of those scratch off art thingies pic.twitter.com/dWLAmpv5be,1439664243,Skitzchu,11,1,5,0,tweet
632622769281208320,Fun seeing Dash and Dot in action soooooo cool!!! #edcampwf #wfredbirdspic.twitter.com/xoSQFz1PZE,1439663996,denningschool,5,0,2,0,tweet
632611381892612097,"This is Dash, Shepherd Blend available for adoption at County Animal shelter on Gaines Street.#NBC7 #CleartheShelterspic.twitter.com/3sXYo6iozh",1439661281,GoodNewsSD,8,1,5,0,tweet
632609628703076352,Looks like a 4-car helmet dash at the front of this @NASCAR_Trucks race!,1439660863,TheOrangeCone,6,0,2,0,tweet
632608380708716548,Awesome demonstration on Dash and Dot at #EdCampWF.pic.twitter.com/7trDGOAhRa,1439660565,DrGregGoins,4,0,3,0,tweet
632608263750746112,A ball in the dirt inspires Frankely Gonzalez to dash in from third ... He does not score. Jordan Romero is not about that life. #AAABA2015,1439660538,shawncurtis430,2,0,3,0,tweet
632600554984767488,Stacey Dash went against black people & God revoked her Fountain Of Youth & Beauty membership so quick. pic.twitter.com/jiExF1eMyL,1439658700,Pleigher,8,0,12,0,tweet
632596472832356353,Filmmaking is a marathon and not a 100 meter dash Pace for success http://ow.ly/QlblL ,1439657726,livingspiritpix,2,0,4,0,tweet
632594891403599874,This #SweetSaturday is sweetest because of muses like you: @Dash_of_Crazy @SassyTexasGal @Samm_Lim @PwrFulWmn @BullsBabe005,1439657349,Night_Errant,3,2,2,0,tweet
632594428977266688,Never too early for water https://twitter.com/castro2359/status/632593231377625088  <quoted_status>It's not to early right pic.twitter.com/dV7fQH1AuS</quoted_status>,1439657239,kay_dash_,15,1,3,632593231377625088,quoted_retweet
632592514265051136,Quick dash back to hotel to change my Dress and drop my bit of shopping off before heading back to @WGOperaHouse for more Cat's tonight.,1439656783,SummerRoseApril,1,0,4,0,tweet
632589791637438464,"3 perfect! @dharblue: If i dash you 1million, you go collect?  #BeautifulThingbyHenryMarks""",1439656133,IamSuCreY,0,0,31,0,tweet
632589123115683841,"I like how Clorox is trying to recruit E1 members to Dash and saying Dash is ""better"" even tho there's proof of them buying subs & followers",1439655974,zehfr,4,0,2,0,tweet
632588769204568064,Incoming Freshman sensation point guard Mook Harris (brother of MVA Great Dash Harris) will be attending Montverde Academy!! #4,1439655890,MVABasketball,16,1,12,0,tweet
632587341614436352,Some cool pics from the Warrior Dash last weekend with @J1mmer_3 pic.twitter.com/sEXsc7uKBr,1439655549,AngeHeese,28,2,1,0,tweet
632582750797701121,Flybe Dash 8 Take off From Southampton International Airport http://youtu.be/lL99XcHLA8Q?a ,1439654455,Snapittakeit,3,2,2,0,tweet
632582725313130496,Warrior Dash with my girl  @wawa11196pic.twitter.com/6HzV4LlF6P,1439654449,1231nalee,5,0,2,0,tweet
632579846023983104,No respect for you if you dine and dash,1439653762,TheHenryJohnson,9,1,0,0,tweet
632578750564171776,"Oh heyyyy 
@933WMMR @PrestonSteve933 

My car's so clean the shiny dash made it blurry  pic.twitter.com/X0GxMESEhu",1439653501,katdeevers,19,1,1,0,tweet
632576448922980352,@wearesteds #Night@theNest tonight. How many teams are gonna have what it takes to score at the 40 yard dash this year? #edsup,1439652952,thbigstepnowsky,7,0,4,0,tweet
632574890994978816,Who is ready for Turn Back the Clock Night? The Avalanche take on the Dash tonight at 6:05 p.m. Gates open at 5 p.m.,1439652581,salemredsox,5,0,4,0,tweet
632565677635715072,"150815 #Ledapple 2015 MUSIC TALK ""DASH""
@steledapple http://youtu.be/DpRN6NFoOIM ",1439650384,Leda_trans,6,0,8,0,tweet
632565464435150849,"Time for some traditional Turkish ice cream, served with a dash of mischief. That big goop is chocolate ice cream!  https://instagram.com/p/6aF0MaBKNk/ ",1439650333,MeiyangChang,13,1,0,0,tweet
632563657805660160,Quick dash across town now to see @incognito107 and #DorianGray @YoungPleasance #edfringe #edfringe2015,1439649903,theatre_weekly,2,0,2,0,tweet
632562237278781440,Lots of the Warrior Dash outfits I'm seeing are pretty similar to my everyday wear. Questioning my fashion sense.,1439649564,shanfu,2,0,1,0,tweet
632561817403854848,"Let the cellphone & dash cam videos of police brutality, excessive force, an unjustifiable murder blow you into action.
#BetheChurch",1439649464,ZMDMcGregor,2,0,1,0,tweet
632561778656829440,Pay Yo Bills: Does Dame Dash Really Owe Uncle Sam Over $4 Million In Back Taxes? http://dlvr.it/Bs4wxG ,1439649455,Bossip,3,1,5,0,tweet
632561686088544256,@_KID911 @nilkarina_ her eyes sparkle with a dash of crazy,1439649433,Life_Overated,2,0,2,632557946216386560,reply
632560896649359361,"@dillondash GET IT BECAUSE THE INCREDIBLES KIDS NAME WAS DASH
DILLON DASH
OK bye pic.twitter.com/PAZJGEaJkV",1439649244,waIkinthewire,4,3,0,0,tweet
632557108899155968,"Art Post 14★ Dash
My favorite #Pixar movie is getting a SEQUEL! I couldn't help but start doing some quick drawings!pic.twitter.com/oA9pkaj9Wz",1439648341,Overlord_JC,28,0,9,0,tweet
632555182073614336,"Good morning! We are live on-air with Curtis Brown, long time sneaker industry leader taking it back to 2005. Tune in live @dash_radio",1439647882,nicekickslive,7,2,3,0,tweet
632554514277658624,"THE DASH - now available on iTunes!!!

 https://itunes.apple.com/us/album/the-dash-lp/id1030987865  http://fb.me/4qaFhSRRQ ",1439647723,realiamsleep,2,1,3,0,tweet
632550997366145024,"Every time I've taken the personality test, I've gotten rainbow dash and rarity as a runner up. They're my two favorite ponies xD",1439646884,candydashh,1,1,1,0,tweet
632549082595205120,"I present #BlackWomenDirectors Kathleen Collins, Julie Dash, Alie Larkin, Monica Freeman and Camille Billops. #Eyes.pic.twitter.com/DnOC84QUFU",1439646428,ReninaWrites,18,0,14,0,tweet
632548341319094272,My OCD sometimes makes me wait until someone else comes into the toilets so I can dash out without touching the door handle post hand wash,1439646251,ohchrissavidge,5,4,0,0,tweet
632546620152786944,Weekend Reading: Anil Dash: 15 Lessons from 15 Years of Blogging http://www.bradford-delong.com/2015/08/weekend-reading-anil-dash-15-lessons-from-15-years-of-blogging.html ,1439645841,delong,3,0,4,0,tweet
632542619734810624,@LoredoLucero It's a mug full of something steaming topped with a layer of thick vanilla cream and laced with a dash of strong bourbon.,1439644887,TheYankeeCandle,2,0,1,632541801119879168,reply
632541955478691840,God woke you up to do something. Control your dash !,1439644728,B_LoSkyWalker,3,0,3,0,tweet
632540067412713472,@francesbarber13 Lady Frances of Drumnadrookit; has a certain ring. Must dash off before Poundland sells out of favours.....xxxx,1439644278,maggivaughan,2,0,4,632536541437386752,reply
632539068555993088,Off they go! The 2nd annual Desert Dash 5/10K has begun. This event benefits the Medical Center Hospital... http://fb.me/6LXti5Jlg ,1439644040,newswest9,2,0,1,0,tweet
632533672403468288,Making cocktails with the tears of my enemies and a dash of lime,1439642754,polychromatik,8,0,4,0,tweet
632532204862607361,Vertical 180 tap dash by @anwarhaniff pic.twitter.com/4oLRlE7THk,1439642404,swtpbuh,1,0,1,0,tweet
632531490304327680,"@consilialegal we're training for the York 10 miler, Abbey Dash and Leeds colour run! Why not join us @RunYorkshire @age_uk @stgemmashospice",1439642233,consilialegal,2,0,2,0,tweet
632529867595227136,"The dance movie you guys dey hype, you slack wey e no pap eh, you go see your moders for here. We no go take dash you kraa.",1439641846,ohniinoi,3,3,27,0,tweet
632527344587132928,GARAGE SALE TODAY,1439641245,asher_dash,2,0,1,0,tweet
632527310290182145,@MurielsOz @LennaLeprena @juliecorb LOL an Abundance of flags cld be used4Signalling or dot dot dot Dash Dot Dot Dot END (your prob 2 young),1439641237,Magpie1954nBird,1,0,1,632481328504565760,reply
632525383330570240,Great visit for the team by Coach Joe Taylor. Winning starts w being around winners.  Control Your Dash @VUUPanthers,1439640777,coach_latrell,7,0,1,0,tweet
632521569433165824,And we don't stop! Catch the weekend restreams Sat 10am-12pm ET and Sun 4pm-6pm ET on @EVRadio via the @dash_radio app,1439639868,NeverNotWorking,3,0,2,0,tweet
632513561038856193,"Gyal yuh pussy good, ah that mi seh, mi love it when you flick it and dash it weh",1439637959,Shadz1017,2,0,1,0,tweet
632510348650749952,"You won't see this on BBC/MSM
A must see documentary
""The Truth Behind the Dash For Gas""
 https://www.youtube.com/watch?v=cX1bsyDuAfg 
@tinalouiseUK
@KAlmsivi",1439637193,AntiFrackingSCO,2,0,3,0,tweet
632509653583269889,The first iteration of a #future we’ll see in a few years: @Amazon's Dash buttons - http://ow.ly/QnTce  @Godelnik #IoT,1439637027,TriplePundit,2,0,0,0,tweet
632508789539885056,"Just completed 100m mad dash, strimmed into wasps nest.I had a direct hit, they got me five times & and it hurts",1439636821,mickhicks101,5,2,0,0,tweet
632504271980904456,"""Hi I'm #Rainbow_Dash ,what's your name?"" 
#MyLittlePony #bronies #pegasisterspic.twitter.com/VF2KaslLjF",1439635744,BrutaL_Pony_,7,0,2,0,tweet
632497618518720512,"Mad Dash: What a 300-pound, vegan NFL lineman eats | NBC on Yahoo Sports - Yahoo Sports #vegan #farm365 http://sports.yahoo.com/blogs/nbc-yahoo-sports/mad-dash--what-a-300-pound--vegan-nfl-lineman-eats-125857144.html ",1439634158,mistervegan,3,0,6,0,tweet
632495715009212416,A quick question for all those with a sharp eye – our #Dash is ascending or descending? :) #CroatiaAirlinesFleetpic.twitter.com/WiZxPMAaFz,1439633704,croatiaairlines,3,2,1,0,tweet
632493513435947008,Children's Back to School Rainbow Dash Backpack http://goo.gl/PcUfKY ,1439633179,6vxosS7AnkpDjpt,2,0,1,0,tweet
632492298463371264,Want to try something different? Unlock some #CastleLiteLime with a dash of Lime flavour this weekend. pic.twitter.com/S0XxT5xFSW,1439632889,castlelitesa,2,2,1,0,tweet
632487388787380224,Hooray it's Super Sport Saturday! Off to MK for @pnefc  then quick dash to Twickers for @EnglandRugby  wooooo let's do the double ,1439631719,SRMLondon,6,1,0,0,tweet
632484509171232768,"Today, playing In OMNI Club, taipei with Dash Berlin, Alvaro and Cazzette OMNI http://fb.me/7p0reA0HL ",1439631032,KURA_live,13,0,5,0,tweet
632479595980193792,"From @BrooksBrothers to @LouisVuitton, make like Howard Hughes and cut a dash while you fly
 http://fw.to/GvQ1NsC ",1439629861,TelegraphLuxury,3,0,4,0,tweet
632432818149306368,"This Video Explains How to Properly Use the Hyphen, En Dash, and Em Dash http://ow.ly/32D913 ",1439618708,ABAEnglish,1,0,1,0,tweet
632431865501057025,All you have in life is a dash between two dates. Are are you gonna do with your dash? pic.twitter.com/U4b5Bf7fSu,1439618481,dayyy_day23,3,0,0,0,tweet
632429129799999488,Don’t know what the fuck future is saying in March Madness all I know is that it’s 200 miles on the dash and the song is amazing,1439617829,Roscoe_Inglish,5,0,18,0,tweet
632427714025254912,"Dine and Dash: Village Inn, 3333 N 90th Street. Staff says 3 juveniles were last seen running southbound.",1439617491,MeanStreetsOMA,7,3,4,0,tweet
632421962497835008,life consists of two dates and a dash in between them. Make the dash count.  -,1439616120,zmoe_,16,0,6,0,tweet
632419542275264512,@tyleriacona I asked for dash's INCREDIBLES suit for Christmas one year,1439615543,amattfuentes,7,1,0,632419310217117696,reply
632415569241751553,I am sad and I am bloated and I have been scrolling down my tumblr dash for a straight 2 hours,1439614596,uhbia,1,0,1,0,tweet
632414464579538945,"I'll be joining @dash_radio soon. Thx to my bro @djskee for the opportunity, understanding my culture & wanting to push our culture fwd!",1439614332,IamLuLuTorres,2,0,0,0,tweet
632411137934536704,"everyone, Hannah is single, hot, outgoing, a little annoying, kinda clingy, a dash of funny, and sometimes slow. get at her.",1439613539,roryjones15,4,0,1,0,tweet
632410158262583300,DASH BOARD INDICATORS AND THEIR MEANINGS http://wp.me/p2s94d-7g  via #GIDITRAFFICpic.twitter.com/CxRsMKv3ND,1439613305,Gidi_Traffic,60,4,572,0,tweet
632407888703524865,"His kick wasn’t great, but so good to see  Nathan Wright’s dash off half-back again. 

#AFLNorthSaints",1439612764,stkildafc,5,1,1,0,tweet
632407811029401600,@chelseybennett3 update: started punching the dash and it started...sometimes it pays to have anger issues,1439612746,chelseybennett3,4,0,0,632405711499104256,reply
632404742375780352,4.90 40 yard dash ,1439612014,MikeyB_VA,11,0,0,0,tweet
632404229773238273,(Photos) Dame Dash To Launch Streaming Service! - http://bit.ly/1IRA913  #IFWT,1439611892,funkflex,3,2,4,0,tweet
632398546541547521,Wear your favourite white with a dash of tricolour! After all its our Independence Day! #IndependenceDay #spjimrpic.twitter.com/ygHb3OVBXS,1439610537,SPJIMR,6,1,4,0,tweet
632395438222667776,"@ash_dash_dan @kimberlyc81497 love you both! hope you've had a great day kimberly!!!! thanks for everything ashley, you're my rock <3",1439609796,_HannahSnow,2,1,2,632394912445689856,reply
632390422661230593,"Dash of Patriotism, Surge of Pride. This #IndependenceDay, let's help our Motherland prosper and shine! #Jaihind",1439608600,TawdeVinod,17,1,12,0,tweet
632387685949149185,Won the dash! Starting pole of the feature here in Yreka @MichaelKofoid11 pic.twitter.com/ueYaH5niH4,1439607948,brandon_lach9,11,0,1,0,tweet
632386529067958272,"Armed with facts, focus on good governance and a dash of rhetoric, personal touch off and on. Great independence speech so far",1439607672,sunandavashisht,6,2,7,0,tweet
632385871447109632,"Ran 2nd in the dash, start front row outside 30 lap feature",1439607515,KyleHirstRacing,13,0,1,0,tweet
632378551849758720,"Dash enters this super fast berserk mode when low on health and so does Vandarin, so  towards the end the fight got super fast and intense!!",1439605770,NickRidgway,2,0,1,0,tweet
632377124125446144,Scrimmage at 9 tomorrow!!,1439605430,Dash_Era,19,3,6,0,tweet
632374286041219072,Dash goes so fast he taps into the speed force and ends up in the flash's live action universe  pic.twitter.com/9oMEjUHlx9,1439604753,DorianParksnRec,28,0,11,0,tweet
632373870276689920,Drew Gibbs sets it up with the 40 yard DASH!!! SOHI up 6-0!!,1439604654,AlaskanAthlete,4,0,1,0,tweet
632371249272885248,"Had to dash outta #D23Expo which was such a bummer, but IT WAS SO COOL MEETING ALL OF YOU sorry I was so sweaty thanks for hugging me anyway",1439604029,pipercurda,322,16,59,0,tweet
632368525177319424,@yungxsinger you just came on my dash wowie pic.twitter.com/4SS8qC5sGy,1439603379,floralndfadings,8,1,6,0,tweet
632365124771270656,#Orioles tie it on Manny Machado's daring dash from third on Jones' fly ball. He eludes Stephen's Vogt's tag. It's 4-4 in seventh.,1439602569,RichDubroffMLB,4,0,1,0,tweet
632364505524273152,I feel like that's all I see on my dash anymore is models throwing other models under the bus : / like whyyyyyyyyyyy pic.twitter.com/3sf4Sns9AN,1439602421,AutumnVonDoe,12,0,6,0,tweet
632363820355338240,Ponyvile's new maid service... Rainbow Dash is still adjusting #bronypic.twitter.com/UHt967hVW4,1439602258,Moliminous,13,2,4,0,tweet
632358864604626944,Dash better be like grown up and a beast cuz I didn't wait ten years to see the same exact incredibles. There better be a new member too,1439601076,Diego11_J,5,2,2,0,tweet
632356508953669632,"Ok but where's Dash??? https://twitter.com/ign/status/632315300348841984  <quoted_status>#Disney unveils posters for The Incredibles 2, Toy Story 4, Finding Dory, and more http://go.ign.com/ZicWtas  #D23Expo pic.twitter.com/VsWTSLHnh2</quoted_status>",1439600515,Ivanchapman1,7,2,2,632315300348841984,quoted_retweet
632355218592698369,Come listen to @theheydaze sing songs off their new EP right now on #Discover @dash_radio http://dashradio.com pic.twitter.com/CCMC8AqmOS,1439600207,realmandyrain,94,1,30,0,tweet
632347125867782144,".@RonnieWrennJR honored @NfldPark for 2 years of leading locally & national dash, gunning for 3rd straight pic.twitter.com/AZjUXeIK4k",1439598277,USTrotting,8,0,5,0,tweet
632345236300255236,Kreaydio airs tonight at 7pm PT 10pm ET on Dash Radio's The Cut! Make sure you tune in,1439597827,KREAYSHAWN,37,2,8,0,tweet
632345164871241728,"Or not, she'd probably think it was so funny and love it actually.",1439597810,jj_dash,6,0,3,632344861056847872,reply
632344861056847872,I just hope @TheHungerGames is very careful with the way they place the letters on their birthday graphic for Jen.,1439597737,jj_dash,9,1,3,0,tweet
632343634478825472,"@TheHungerGames aww, he won. That's nice.",1439597445,jj_dash,8,0,2,632343493122256896,reply
632341968341766144,"[VIDEO] Cast of @ComptonMovie talk about the film on @dash_radio
 http://youtu.be/qSOjdQw346I  @CaliforniaHeir @CoreyHawkins @JasonMitch",1439597048,SKEETV,4,0,1,0,tweet
632341246472757248,Powerful dash cam video shows an Ohio State Trooper fighting to save a driver’s life: http://shout.lt/9KVT pic.twitter.com/aIVIvWlBDJ,1439596876,KLTV7,3,0,2,0,tweet
632341182912286721,135 On The Dash  https://soundcloud.com/playhouse_mafia/135-on-da-dash-headhoncho ,1439596860,EddieFiasco_,2,0,3,0,tweet
632341160657219584,"この後RSR会場から生中継！
HBCラジオ「ウィークエンドナビ ファンダフル 〜アソViva中継DASH !!! 〜」
#RSR15
 http://radiko.jp ",1439596855,rsrfes_official,17,0,17,0,tweet
632341152692355074,I've been trying to go back to three dots and a dash for the longest now,1439596853,______DC,0,0,0,0,tweet
632341152654495745,내 전매특허인 레인블로우 드라이야-,1439596853,Rainbow_dash_kb,0,0,0,0,tweet
632341138381381633,"Parents have got home, completely off their tits.... Oh and they bought 'friends'",1439596850,waggy_dash,0,0,0,0,tweet
632341080638423044,Congratulations Joseph Adams (CXA284) who has completed the Canadian Xpress® FlyJSim Dash 8 Q400 training course. pic.twitter.com/j0QxIJsVVY,1439596836,canadianxpress,0,0,0,0,tweet
632340990712410113,"(meanwhile E.Ryu was on his training field fighting some fighters knocking them down by the violent charge dash)
You think you can stop me>>",1439596815,EvilHadouRyu,0,1,0,0,tweet
632340980738318336,"ヌベヂョンヌゾジョンベルミッティスモゲロンボョｗｗｗｗ
　　  ９_９
　　 ( ՞ةڼ◔) 
　 ＿|　⊃／(＿＿_ 
／　└-(＿＿＿_／ 
￣￣￣￣￣￣￣ 
クジーｗｗｗクジジジジジｗｗｗｗｗｗｗ

　９⌒９-､＿_９
／９_/＿＿９９／",1439596812,DASH_335,0,0,0,0,tweet
632340978603532289,We love this! New post: Unusual Scary Car Accident Caught On Tape-Dash Cam Accident http://gr8wtf.com/random/unusual-scary-car-accident-caught-on-tape-dash-cam-accident/  More to enjoy at #gr8wtf.com,1439596812,Gr8Wtf,0,0,0,0,tweet
632340972718809088,@JuXrod @Fosko_Dash lmao I like you  needa teach her your ways,1439596810,millennialbby,0,1,0,631895980577816577,reply
632340968017006592,@DashN01 108 #Dash #Dahs #Dsha #ashD #Dsah,1439596809,YukiDashN,1,0,0,0,tweet
632340949004214273,"Market CAP $ 17,170,929 Volume(24h) $ 74,860",1439596805,darkcoin_price,0,0,0,0,tweet
632340938933735424,Dash hangs out by the firepit in the hopes that someone makes some smores... and then hopes that person is very... http://fb.me/yPqBFIjd ,1439596802,lulabellemom,0,0,0,0,tweet
632340935259627520,Rainbow Dash would like to to kick books but can't because the carriage is broken.,1439596801,PonyMadLibs,0,0,0,0,tweet
